B1: Oct | C1: Nov | D1: Dec | E1: Jan | F1: Feb | G1: Mar | H1: Apr | I1: May | J1: Jun | K1: Jul | L1: Aug | M1: Sep | N1: Water Yr
A2: 2008 - 2009 Water Year | B2: 2008 | C2: 2008 | D2: 2008 | E2: 2009 | F2: 2009 | G2: 2009 | H2: 2009 | I2: 2009 | J2: 2009 | K2: 2009 | L2: 2009 | M2: 2009 | N2: Total
A3: 42-0061-03 Alpine | B3: 1.68 | C3: 2.77 | D3: 3.08 | E3: 3.05 | F3: 1.57 | G3: 2.36 | H3: 5.54 | I3: 2.33 | J3: 3.27 | K3: 0.05 | L3: 0.69 | M3: 0.91 | N3: =SUM(B3:M3) -> 27.30
A4: % of normal | B4: =ROUND(B3/1.89,2) -> 0.89 | C4: =ROUND(C3/1.66,2) -> 1.67 | D4: =ROUND(D3/1.67,2) -> 1.84 | E4: =ROUND(E3/1.99,2) -> 1.53 | F4: =ROUND(F3/1.74,2) -> 0.9 | G4: =ROUND(G3/1.92,2) -> 1.23 | H4: =ROUND(H3/1.85,2) -> 2.99 | I4: =ROUND(I3/2.17,2) -> 1.07 | J4: =ROUND(J3/0.88,2) -> 3.72 | K4: =ROUND(K3/0.74,2) -> 0.07 | L4: =ROUND(L3/1,2) -> 0.69 | M4: =ROUND(M3/1.38,2) -> 0.66 | N4: =ROUND(N3/18.89,2) -> 1.45
A5: 42-0072-05 Alta | B5: 2.55 | C5: 6.78 | D5: 7.04 | E5: 7.33 | F5: 4.92 | G5: 9.04 | H5: 8.78 | I5: 1.84 | J5: 9.67 | K5: 0.55 | L5: 1.05 | M5: 3.18 | N5: =SUM(B5:M5) -> 62.73
A6: % of normal | B6: =ROUND(B5/4.08,2) -> 0.63 | C6: =ROUND(C5/5.66,2) -> 1.2 | D6: =ROUND(D5/6.01,2) -> 1.17 | E6: =ROUND(E5/5.99,2) -> 1.22 | F6: =ROUND(F5/5.88,2) -> 0.84 | G6: =ROUND(G5/6.62,2) -> 1.37 | H6: =ROUND(H5/5.34,2) -> 1.64 | I6: =ROUND(I5/4.26,2) -> 0.43 | J6: =ROUND(J5/1.89,2) -> 5.12 | K6: =ROUND(K5/1.75,2) -> 0.31 | L6: =ROUND(L5/1.96,2) -> 0.54 | M6: =ROUND(M5/2.82,2) -> 1.13 | N6: =ROUND(N5/52.26,2) -> 1.2
A7: 42-0074-06 Altamont | B7: 0.43 | C7: 0.20 | D7: 0.79 | E7: 0.23 | F7: 0.50 | G7: 0.29 | H7: 1.16 | I7: 1.10 | J7: 2.21 | K7: 0.86 | L7: 0.50 | M7: 0.95 | N7: =SUM(B7:M7) -> 9.22
A8: % of normal | B8: =ROUND(B7/1.04,2) -> 0.41 | C8: =ROUND(C7/0.62,2) -> 0.32 | D8: =ROUND(D7/0.54,2) -> 1.46 | E8: =ROUND(E7/0.69,2) -> 0.33 | F8: =ROUND(F7/0.64,2) -> 0.78 | G8: =ROUND(G7/0.64,2) -> 0.45 | H8: =ROUND(H7/0.73,2) -> 1.59 | I8: =ROUND(I7/1.01,2) -> 1.09 | J8: =ROUND(J7/0.71,2) -> 3.11 | K8: =ROUND(K7/0.85,2) -> 1.01 | L8: =ROUND(L7/0.86,2) -> 0.58 | M8: =ROUND(M7/1.07,2) -> 0.89 | N8: =ROUND(N7/9.4,2) -> 0.98
A9: 42-0086-04 Alton | B9: 0.80 | C9: 1.34 | D9: 4.11 | E9: 1.04 | F9: 2.21 | G9: 0.22 | H9: 0.81 | I9: 0.20 | J9: 1.03 | K9: 0.46 | L9: 0.17 | M9: 1.37 | N9: =SUM(B9:M9) -> 13.76
A10: % of normal | B10: =ROUND(B9/1.59,2) -> 0.5 | C10: =ROUND(C9/1.4,2) -> 0.96 | D10: =ROUND(D9/1.19,2) -> 3.45 | E10: =ROUND(E9/1.76,2) -> 0.59 | F10: =ROUND(F9/1.9,2) -> 1.16 | G10: =ROUND(G9/1.75,2) -> 0.13 | H10: =ROUND(H9/0.95,2) -> 0.85 | I10: =ROUND(I9/0.97,2) -> 0.21 | J10: =ROUND(J9/0.51,2) -> 2.02 | K10: =ROUND(K9/1.34,2) -> 0.34 | L10: =ROUND(L9/1.62,2) -> 0.1 | M10: =ROUND(M9/1.53,2) -> 0.9 | N10: =ROUND(N9/16.51,2) -> 0.83
A11: 42-0168-04 Angle | B11: 0.43 | C11: 0.93 | D11: 0.30 | E11: 0.12 | F11: 0.38 | G11: 0.57 | H11: 0.10 | J11: 0.61 | K11: 0.77 | L11: 0.18 | M11: 0.00 | N11: =SUM(B11:M11) -> 4.39
A12: % of normal | B12: =ROUND(B11/0.89,2) -> 0.48 | C12: =ROUND(C11/0.38,2) -> 2.45 | D12: =ROUND(D11/0.29,2) -> 1.03 | E12: =ROUND(E11/0.48,2) -> 0.25 | F12: =ROUND(F11/0.35,2) -> 1.09 | G12: =ROUND(G11/0.75,2) -> 0.76 | H12: =ROUND(H11/0.69,2) -> 0.14 | I12: =ROUND(I11/0.8,2) -> 0 | J12: =ROUND(J11/0.59,2) -> 1.03 | K12: =ROUND(K11/0.9,2) -> 0.86 | L12: =ROUND(L11/1.3,2) -> 0.14 | M12: =ROUND(M11/0.97,2) -> 0 | N12: =ROUND(N11/8.39,2) -> 0.52
A13: 42-0688-07 Big Water | B13: 0.15 | C13: 0.64 | D13: M | E13: M | F13: 0.35 | G13: 0.03 | H13: 0.06 | I13: 1.33 | J13: 0.84 | K13: 0.18 | L13: 0.01 | M13: 0.55 | N13: =SUM(B13:M13) -> 4.14
A14: % of normal | B14: =ROUND(B13/0.88,2) -> 0.17 | C14: =ROUND(C13/0.42,2) -> 1.52 | D14: 0 | E14: 0 | F14: =ROUND(F13/0.56,2) -> 0.63 | G14: =ROUND(G13/0.6,2) -> 0.05 | H14: =ROUND(H13/0.37,2) -> 0.16 | I14: =ROUND(I13/0.31,2) -> 4.29 | J14: =ROUND(J13/0.11,2) -> 7.64 | K14: =ROUND(K13/0.64,2) -> 0.28 | L14: =ROUND(L13/0.6,2) -> 0.02 | M14: =ROUND(M13/0.55,2) -> 1 | N14: =ROUND(N13/5.77,2) -> 0.72
A15: 42-0820-05 Bountiful Val Verda | B15: 2.07 | C15: 1.87 | D15: 2.29 | E15: 3.42 | F15: 1.58 | G15: 2.29 | H15: 4.16 | I15: 1.73 | J15: 4.64 | K15: 1.04 | L15: 0.51 | M15: 1.16 | N15: =SUM(B15:M15) -> 26.76
A16: % of normal | B16: =ROUND(B15/2.18,2) -> 0.95 | C16: =ROUND(C15/1.92,2) -> 0.97 | D16: =ROUND(D15/1.75,2) -> 1.31 | E16: =ROUND(E15/2,2) -> 1.71 | F16: =ROUND(F15/1.84,2) -> 0.86 | G16: =ROUND(G15/2.39,2) -> 0.96 | H16: =ROUND(H15/2.81,2) -> 1.48 | I16: =ROUND(I15/3,2) -> 0.58 | J16: =ROUND(J15/1.15,2) -> 4.03 | K16: =ROUND(K15/0.88,2) -> 1.18 | L16: =ROUND(L15/0.94,2) -> 0.54 | M16: =ROUND(M15/1.54,2) -> 0.75 | N16: =ROUND(N15/22.4,2) -> 1.19
A17: 42-0849-04 Boulder | B17: 0.71 | C17: 0.88 | D17: 1.81 | E17: 0.31 | F17: 0.71 | G17: 0.13 | H17: 0.32 | I17: 1.72 | J17: 1.44 | K17: 0.65 | L17: 1.80 | M17: 0.45 | N17: =SUM(B17:M17) -> 10.93
A18: % of normal | B18: =ROUND(B17/1.21,2) -> 0.59 | C18: =ROUND(C17/0.79,2) -> 1.11 | D18: =ROUND(D17/0.58,2) -> 3.12 | E18: =ROUND(E17/0.96,2) -> 0.32 | F18: =ROUND(F17/0.91,2) -> 0.78 | G18: =ROUND(G17/1.02,2) -> 0.13 | H18: =ROUND(H17/0.49,2) -> 0.65 | I18: =ROUND(I17/0.77,2) -> 2.23 | J18: =ROUND(J17/0.33,2) -> 4.36 | K18: =ROUND(K17/1.06,2) -> 0.61 | L18: =ROUND(L17/1.5,2) -> 1.2 | M18: =ROUND(M17/1.2,2) -> 0.38 | N18: =ROUND(N17/10.82,2) -> 1.01
A19: 42-1008-04 Bryce Canyon N. P. HQRS | B19: 0.33 | C19: 0.81 | D19: 2.40 | F19: 1.01 | G19: 0.31 | H19: 0.74 | I19: 1.02 | J19: 0.71 | K19: 0.62 | L19: 0.29 | M19: 0.94 | N19: =SUM(B19:M19) -> 9.18
A20: % of normal | B20: =ROUND(B19/1.7,2) -> 0.19 | C20: =ROUND(C19/1.2,2) -> 0.68 | D20: =ROUND(D19/0.97,2) -> 2.47 | E20: =ROUND(E19/1.5,2) -> 0 | F20: =ROUND(F19/1.66,2) -> 0.61 | G20: =ROUND(G19/1.64,2) -> 0.19 | H20: =ROUND(H19/0.84,2) -> 0.88 | I20: =ROUND(I19/1.05,2) -> 0.97 | J20: =ROUND(J19/0.6,2) -> 1.18 | K20: =ROUND(K19/1.43,2) -> 0.43 | L20: =ROUND(L19/2.16,2) -> 0.13 | M20: =ROUND(M19/1.65,2) -> 0.57 | N20: =ROUND(N19/16.4,2) -> 0.56
A21: 42-1020-07 Bullfrog Basin | B21: 0.27 | C21: 0.42 | D21: M | E21: 0.09 | F21: 0.09 | H21: 0.37 | I21: 0.96 | J21: 0.19 | K21: 0.02 | L21: 0.01 | M21: 0.18 | N21: =SUM(B21:M21) -> 2.60
A22: % of normal | B22: =ROUND(B21/0.98,2) -> 0.28 | C22: =ROUND(C21/0.62,2) -> 0.68 | D22: 0 | E22: =ROUND(E21/0.6,2) -> 0.15 | F22: =ROUND(F21/0.4,2) -> 0.23 | G22: =ROUND(G21/0.63,2) -> 0 | H22: =ROUND(H21/0.31,2) -> 1.19 | I22: =ROUND(I21/0.37,2) -> 2.59 | J22: =ROUND(J21/0.13,2) -> 1.46 | K22: =ROUND(K21/0.37,2) -> 0.05 | L22: =ROUND(L21/0.5,2) -> 0.02 | M22: =ROUND(M21/0.66,2) -> 0.27 | N22: =ROUND(N21/6,2) -> 0.43
A23: 42-1171-07 Capitol Reef N. P. | B23: 0.37 | C23: 0.59 | D23: 0.45 | E23: 0.08 | F23: 0.03 | G23: T | H23: 0.32 | I23: 0.59 | J23: 0.69 | K23: 0.79 | L23: 0.46 | M23: 0.83 | N23: =SUM(B23:M23) -> 5.20
A24: % of normal | B24: =ROUND(B23/0.76,2) -> 0.49 | C24: =ROUND(C23/0.61,2) -> 0.97 | D24: =ROUND(D23/0.27,2) -> 1.67 | E24: =ROUND(E23/0.52,2) -> 0.15 | F24: =ROUND(F23/0.38,2) -> 0.08 | G24: 0 | H24: =ROUND(H23/0.52,2) -> 0.62 | I24: =ROUND(I23/0.64,2) -> 0.92 | J24: =ROUND(J23/0.37,2) -> 1.86 | K24: =ROUND(K23/0.95,2) -> 0.83 | L24: =ROUND(L23/1.19,2) -> 0.39 | M24: =ROUND(M23/0.83,2) -> 1 | N24: =ROUND(N23/7.68,2) -> 0.68
A25: 42-1214-07 Castledale | B25: 0.36 | C25: 0.22 | D25: 0.91 | E25: 0.07 | F25: 0.37 | G25: T | H25: 0.59 | I25: 0.70 | J25: 0.69 | K25: 0.07 | L25: 0.21 | M25: 0.60 | N25: =SUM(B25:M25) -> 4.79
A26: % of normal | B26: =ROUND(B25/0.9,2) -> 0.4 | C26: =ROUND(C25/0.52,2) -> 0.42 | D26: =ROUND(D25/0.36,2) -> 2.53 | E26: =ROUND(E25/0.64,2) -> 0.11 | F26: =ROUND(F25/0.57,2) -> 0.65 | G26: 0 | H26: =ROUND(H25/0.52,2) -> 1.13 | I26: =ROUND(I25/0.65,2) -> 1.08 | J26: =ROUND(J25/0.41,2) -> 1.68 | K26: =ROUND(K25/0.81,2) -> 0.09 | L26: =ROUND(L25/0.97,2) -> 0.22 | M26: =ROUND(M25/0.86,2) -> 0.7 | N26: =ROUND(N25/7.89,2) -> 0.61
A27: 42-1432-04 Circleville | B27: 0.76 | C27: 0.38 | D27: M | E27: M | F27: 0.03 | G27: M | H27: 0.45 | I27: 0.30 | J27: 0.48 | K27: 0.69 | L27: 0.15 | M27: 0.51 | N27: =SUM(B27:M27) -> 3.75
A28: % of normal | B28: =ROUND(B27/0.9,2) -> 0.84 | C28: =ROUND(C27/0.5,2) -> 0.76 | D28: 0 | E28: 0 | F28: =ROUND(F27/0.54,2) -> 0.06 | G28: 0 | H28: =ROUND(H27/0.64,2) -> 0.7 | I28: =ROUND(I27/0.9,2) -> 0.33 | J28: =ROUND(J27/0.57,2) -> 0.84 | K28: =ROUND(K27/0.86,2) -> 0.8 | L28: =ROUND(L27/1.42,2) -> 0.11 | M28: =ROUND(M27/0.95,2) -> 0.54 | N28: =ROUND(N27/9.07,2) -> 0.41
A29: 42-1446-05 City Creek Water Plant | B29: 2.04 | C29: 2.34 | D29: 3.06 | E29: 4.00 | F29: 2.23 | G29: 4.66 | H29: 4.70 | I29: 1.96 | J29: 4.39 | K29: 0.70 | L29: 0.47 | M29: 0.73 | N29: =SUM(B29:M29) -> 31.28
A30: % of normal | B30: =ROUND(B29/2.64,2) -> 0.77 | C30: =ROUND(C29/2.68,2) -> 0.87 | D30: =ROUND(D29/2.52,2) -> 1.21 | E30: =ROUND(E29/2.82,2) -> 1.42 | F30: =ROUND(F29/2.61,2) -> 0.85 | G30: =ROUND(G29/3.35,2) -> 1.39 | H30: =ROUND(H29/3.4,2) -> 1.38 | I30: =ROUND(I29/3.16,2) -> 0.62 | J30: =ROUND(J29/1.42,2) -> 3.09 | K30: =ROUND(K29/1.02,2) -> 0.69 | L30: =ROUND(L29/1.01,2) -> 0.47 | M30: =ROUND(M29/2.21,2) -> 0.33 | N30: =ROUND(N29/28.84,2) -> 1.08
A31: 42-1588-05 Coalville | B31: 0.68 | C31: 1.03 | D31: 1.55 | E31: 1.66 | F31: 0.78 | G31: 1.48 | H31: 2.57 | I31: 0.78 | J31: 4.25 | K31: 1.41 | L31: 0.72 | M31: 1.01 | N31: =SUM(B31:M31) -> 17.92
A32: % of normal | B32: =ROUND(B31/1.61,2) -> 0.42 | C32: =ROUND(C31/1.62,2) -> 0.64 | D32: =ROUND(D31/1.15,2) -> 1.35 | E32: =ROUND(E31/1.31,2) -> 1.27 | F32: =ROUND(F31/1.22,2) -> 0.64 | G32: =ROUND(G31/1.62,2) -> 0.91 | H32: =ROUND(H31/1.84,2) -> 1.4 | I32: =ROUND(I31/2.02,2) -> 0.39 | J32: =ROUND(J31/1.13,2) -> 3.76 | K32: =ROUND(K31/1,2) -> 1.41 | L32: =ROUND(L31/1.08,2) -> 0.67 | M32: =ROUND(M31/1.37,2) -> 0.74 | N32: =ROUND(N31/16.97,2) -> 1.06
A33: 42-1590-05 Coalville 13E | B33: 0.76 | C33: 1.15 | D33: 1.37 | E33: 1.18 | F33: 0.63 | G33: 1.38 | H33: 4.17 | I33: 1.09 | J33: 4.25 | K33: 1.76 | L33: 0.71 | M33: 1.20 | N33: =SUM(B33:M33) -> 19.65
A34: % of normal | B34: =ROUND(B33/1.56,2) -> 0.49 | C34: =ROUND(C33/1.39,2) -> 0.83 | D34: =ROUND(D33/0.88,2) -> 1.56 | E34: =ROUND(E33/0.98,2) -> 1.2 | F34: =ROUND(F33/0.91,2) -> 0.69 | G34: =ROUND(G33/1.36,2) -> 1.01 | H34: =ROUND(H33/1.7,2) -> 2.45 | I34: =ROUND(I33/1.81,2) -> 0.6 | J34: =ROUND(J33/1.01,2) -> 4.21 | K34: =ROUND(K33/1.02,2) -> 1.73 | L34: =ROUND(L33/0.84,2) -> 0.85 | M34: =ROUND(M33/1.5,2) -> 0.8 | N34: =ROUND(N33/14.96,2) -> 1.31
A35: 42-1759-03 Cottonwood Weir | B35: 1.14 | C35: 3.04 | D35: 3.58 | E35: 3.37 | F35: 0.76 | G35: 4.06 | H35: 4.24 | I35: 1.53 | J35: 4.34 | K35: 0.15 | L35: 0.32 | M35: 1.25 | N35: =SUM(B35:M35) -> 27.78
A36: % of normal | B36: =ROUND(B35/2.62,2) -> 0.44 | C36: =ROUND(C35/2.45,2) -> 1.24 | D36: =ROUND(D35/2.03,2) -> 1.76 | E36: =ROUND(E35/2.05,2) -> 1.64 | F36: =ROUND(F35/2.19,2) -> 0.35 | G36: =ROUND(G35/2.92,2) -> 1.39 | H36: =ROUND(H35/3.17,2) -> 1.34 | I36: =ROUND(I35/3.06,2) -> 0.5 | J36: =ROUND(J35/1.27,2) -> 3.42 | K36: =ROUND(K35/1.11,2) -> 0.14 | L36: =ROUND(L35/1.2,2) -> 0.27 | M36: =ROUND(M35/2.12,2) -> 0.59 | N36: =ROUND(N35/26.19,2) -> 1.06
A37: 42-2057-05 Deer Creek Dam | B37: 0.98 | C37: 2.57 | D37: 3.59 | E37: 3.14 | F37: 2.39 | G37: 0.83 | H37: 2.30 | I37: 2.29 | J37: 4.08 | K37: 0.57 | L37: 0.68 | M37: 1.16 | N37: =SUM(B37:M37) -> 24.58
A38: % of normal | B38: =ROUND(B37/2.09,2) -> 0.47 | C38: =ROUND(C37/2.3,2) -> 1.12 | D38: =ROUND(D37/2.32,2) -> 1.55 | E38: =ROUND(E37/3.12,2) -> 1.01 | F38: =ROUND(F37/2.86,2) -> 0.84 | G38: =ROUND(G37/2.42,2) -> 0.34 | H38: =ROUND(H37/1.76,2) -> 1.31 | I38: =ROUND(I37/1.92,2) -> 1.19 | J38: =ROUND(J37/1.01,2) -> 4.04 | K38: =ROUND(K37/0.91,2) -> 0.63 | L38: =ROUND(L37/1.12,2) -> 0.61 | M38: =ROUND(M37/1.58,2) -> 0.73 | N38: =ROUND(N37/23.41,2) -> 1.05
A39: 42-2090-01 Delta | B39: 1.18 | D39: 0.61 | E39: 0.66 | F39: 0.28 | G39: 0.26 | H39: 0.61 | I39: 0.47 | J39: 1.76 | K39: 0.26 | L39: 0.18 | M39: 0.55 | N39: =SUM(B39:M39) -> 6.82
A40: % of normal | B40: =ROUND(B39/1.01,2) -> 1.17 | C40: =ROUND(C39/0.61,2) -> 0 | D40: =ROUND(D39/0.43,2) -> 1.42 | E40: =ROUND(E39/0.6,2) -> 1.1 | F40: =ROUND(F39/0.65,2) -> 0.43 | G40: =ROUND(G39/0.85,2) -> 0.31 | H40: =ROUND(H39/0.83,2) -> 0.73 | I40: =ROUND(I39/0.99,2) -> 0.47 | J40: =ROUND(J39/0.48,2) -> 3.67 | K40: =ROUND(K39/0.56,2) -> 0.46 | L40: =ROUND(L39/0.64,2) -> 0.28 | M40: =ROUND(M39/0.78,2) -> 0.71 | N40: =ROUND(N39/8.43,2) -> 0.81
A41: 42-2253-06 Duchesne | B41: 0.32 | C41: 0.25 | D41: 0.69 | E41: 0.19 | F41: 0.34 | G41: 0.42 | H41: 1.07 | I41: 0.84 | J41: 1.60 | K41: 0.57 | L41: 0.36 | M41: 1.12 | N41: =SUM(B41:M41) -> 7.77
A42: % of normal | B42: =ROUND(B41/0.94,2) -> 0.34 | C42: =ROUND(C41/0.49,2) -> 0.51 | D42: =ROUND(D41/0.54,2) -> 1.28 | E42: =ROUND(E41/0.51,2) -> 0.37 | F42: =ROUND(F41/0.57,2) -> 0.6 | G42: =ROUND(G41/0.69,2) -> 0.61 | H42: =ROUND(H41/0.9,2) -> 1.19 | I42: =ROUND(I41/1.1,2) -> 0.76 | J42: =ROUND(J41/0.68,2) -> 2.35 | K42: =ROUND(K41/1,2) -> 0.57 | L42: =ROUND(L41/1.19,2) -> 0.3 | M42: =ROUND(M41/1.12,2) -> 1 | N42: =ROUND(N41/9.73,2) -> 0.8
A43: 42-2385-05 Echo Dam | B43: 0.75 | C43: 1.13 | D43: 1.16 | E43: 1.65 | F43: 0.54 | G43: 1.34 | H43: 2.32 | I43: 1.08 | J43: 3.86 | K43: 0.96 | L43: 0.92 | M43: 1.11 | N43: =SUM(B43:M43) -> 16.82
A44: % of normal | B44: =ROUND(B43/1.52,2) -> 0.49 | C44: =ROUND(C43/1.53,2) -> 0.74 | D44: =ROUND(D43/1.03,2) -> 1.13 | E44: =ROUND(E43/1.14,2) -> 1.45 | F44: =ROUND(F43/1.03,2) -> 0.52 | G44: =ROUND(G43/1.38,2) -> 0.97 | H44: =ROUND(H43/1.52,2) -> 1.53 | I44: =ROUND(I43/1.97,2) -> 0.55 | J44: =ROUND(J43/1.05,2) -> 3.68 | K44: =ROUND(K43/0.85,2) -> 1.13 | L44: =ROUND(L43/0.8,2) -> 1.15 | M44: =ROUND(M43/1.38,2) -> 0.8 | N44: =ROUND(N43/15.2,2) -> 1.11
A45: 42-2578-04 Ephraim USFS | B45: 0.51 | C45: 0.76 | D45: 0.76 | E45: 1.34 | F45: 0.63 | G45: 0.30 | H45: 1.33 | I45: 0.39 | J45: 1.10 | K45: 0.03 | L45: 0.05 | N45: =SUM(B45:M45) -> 7.20
A46: % of normal | B46: =ROUND(B45/1.34,2) -> 0.38 | C46: =ROUND(C45/1.1,2) -> 0.69 | D46: =ROUND(D45/0.88,2) -> 0.86 | E46: =ROUND(E45/1.01,2) -> 1.33 | F46: =ROUND(F45/1.08,2) -> 0.58 | G46: =ROUND(G45/1.39,2) -> 0.22 | H46: =ROUND(H45/1.14,2) -> 1.17 | I46: =ROUND(I45/1.29,2) -> 0.3 | J46: =ROUND(J45/0.67,2) -> 1.64 | K46: =ROUND(K45/0.76,2) -> 0.04 | L46: =ROUND(L45/0.85,2) -> 0.06 | M46: =ROUND(M45/1.19,2) -> 0 | N46: =ROUND(N45/12.7,2) -> 0.57
A47: 42-2592-04 Escalante | B47: 0.43 | C47: 0.80 | D47: 1.67 | E47: 0.07 | F47: 0.50 | G47: 0.24 | H47: 0.22 | I47: 1.56 | J47: 0.86 | K47: 1.18 | L47: 0.14 | M47: 0.59 | N47: =SUM(B47:M47) -> 8.26
A48: % of normal | B48: =ROUND(B47/1.16,2) -> 0.37 | C48: =ROUND(C47/0.77,2) -> 1.04 | D48: =ROUND(D47/0.54,2) -> 3.09 | E48: =ROUND(E47/0.9,2) -> 0.08 | F48: =ROUND(F47/0.79,2) -> 0.63 | G48: =ROUND(G47/0.92,2) -> 0.26 | H48: =ROUND(H47/0.49,2) -> 0.45 | I48: =ROUND(I47/0.65,2) -> 2.4 | J48: =ROUND(J47/0.37,2) -> 2.32 | K48: =ROUND(K47/0.76,2) -> 1.55 | L48: =ROUND(L47/1.52,2) -> 0.09 | M48: =ROUND(M47/1.12,2) -> 0.53 | N48: =ROUND(N47/9.99,2) -> 0.83
A49: 42-2696-03 Fairfield | B49: 2.20 | C49: 0.38 | D49: 1.22 | E49: 1.59 | F49: 0.73 | G49: 0.24 | H49: 0.96 | I49: 0.81 | J49: 1.58 | K49: 0.51 | L49: 0.03 | M49: 0.64 | N49: =SUM(B49:M49) -> 10.89
A50: % of normal | B50: =ROUND(B49/1.31,2) -> 1.68 | C50: =ROUND(C49/1.04,2) -> 0.37 | D50: =ROUND(D49/0.84,2) -> 1.45 | E50: =ROUND(E49/1.15,2) -> 1.38 | F50: =ROUND(F49/1.17,2) -> 0.62 | G50: =ROUND(G49/1.19,2) -> 0.2 | H50: =ROUND(H49/1.16,2) -> 0.83 | I50: =ROUND(I49/1.29,2) -> 0.63 | J50: =ROUND(J49/0.72,2) -> 2.19 | K50: =ROUND(K49/1.09,2) -> 0.47 | L50: =ROUND(L49/1.09,2) -> 0.03 | M50: =ROUND(M49/1.06,2) -> 0.6 | N50: =ROUND(N49/13.11,2) -> 0.83
A51: 42-2702-05 Fairview 8N | B51: 1.33 | C51: 1.04 | D51: 2.96 | E51: 2.34 | F51: 1.27 | G51: 1.60 | H51: 3.18 | I51: 1.87 | J51: 1.78 | K51: T | L51: 0.38 | M51: 1.29 | N51: =SUM(B51:M51) -> 19.04
A52: % of normal | B52: 0.8 | C52: =ROUND(C51/1.41,2) -> 0.74 | D52: =ROUND(D51/1.27,2) -> 2.33 | E52: =ROUND(E51/1.58,2) -> 1.48 | F52: =ROUND(F51/1.45,2) -> 0.88 | G52: =ROUND(G51/1.58,2) -> 1.01 | H52: =ROUND(H51/1.2,2) -> 2.65 | I52: =ROUND(I51/1.77,2) -> 1.06 | J52: =ROUND(J51/1.02,2) -> 1.75 | K52: 0 | L52: =ROUND(L51/1.22,2) -> 0.31 | M52: =ROUND(M51/1.51,2) -> 0.85 | N52: =ROUND(N51/16.69,2) -> 1.14
A53: 42-2726-03 Farmington 3NW | B53: 1.64 | C53: 2.07 | D53: 1.52 | E53: 2.95 | F53: 2.53 | G53: 1.25 | H53: 2.35 | I53: 1.87 | J53: 1.80 | K53: M | L53: M | N53: =SUM(B53:M53) -> 17.98
A54: % of normal | B54: =ROUND(B53/2.15,2) -> 0.76 | C54: =ROUND(C53/2.03,2) -> 1.02 | D54: =ROUND(D53/1.89,2) -> 0.8 | E54: =ROUND(E53/2.18,2) -> 1.35 | F54: =ROUND(F53/2.08,2) -> 1.22 | G54: =ROUND(G53/2.62,2) -> 0.48 | H54: =ROUND(H53/2.68,2) -> 0.88 | I54: =ROUND(I53/2.98,2) -> 0.63 | J54: =ROUND(J53/1.27,2) -> 1.42 | K54: =ROUND(K53/0.92,2) -> ##### | L54: =ROUND(L53/0.88,2) -> ##### | M54: =ROUND(M53/1.58,2) -> 0 | N54: =ROUND(N53/23.26,2) -> 0.77
A55: 42-2798-07 Ferron | B55: 0.19 | C55: 0.28 | D55: 0.92 | E55: 0.20 | F55: 0.34 | G55: T | H55: 0.69 | I55: 1.17 | J55: 0.92 | K55: 0.19 | L55: 0.75 | M55: 0.76 | N55: =SUM(B55:M55) -> 6.41
A56: % of normal | B56: =ROUND(B55/0.98,2) -> 0.19 | C56: =ROUND(C55/0.57,2) -> 0.49 | D56: =ROUND(D55/0.39,2) -> 2.36 | E56: =ROUND(E55/0.66,2) -> 0.3 | F56: =ROUND(F55/0.64,2) -> 0.53 | G56: 0 | H56: =ROUND(H55/0.51,2) -> 1.35 | I56: =ROUND(I55/0.74,2) -> 1.58 | J56: =ROUND(J55/0.41,2) -> 2.24 | K56: =ROUND(K55/1.04,2) -> 0.18 | L56: =ROUND(L55/0.97,2) -> 0.77 | M56: =ROUND(M55/1.02,2) -> 0.75 | N56: =ROUND(N55/8.67,2) -> 0.74
A57: 42-2828-04 Fillmore | B57: 1.28 | C57: 1.32 | D57: 1.27 | E57: 1.78 | F57: 0.80 | G57: 1.96 | H57: 1.09 | I57: 0.92 | J57: 0.95 | K57: 0.43 | L57: 1.06 | M57: 0.69 | N57: =SUM(B57:M57) -> 13.55
A58: % of normal | B58: =ROUND(B57/1.69,2) -> 0.76 | C58: =ROUND(C57/1.5,2) -> 0.88 | D58: =ROUND(D57/1.21,2) -> 1.05 | E58: =ROUND(E57/1.42,2) -> 1.25 | F58: =ROUND(F57/1.39,2) -> 0.58 | G58: =ROUND(G57/1.98,2) -> 0.99 | H58: =ROUND(H57/1.82,2) -> 0.6 | I58: =ROUND(I57/1.68,2) -> 0.55 | J58: =ROUND(J57/0.7,2) -> 1.36 | K58: =ROUND(K57/0.8,2) -> 0.54 | L58: =ROUND(L57/0.83,2) -> 1.28 | M58: =ROUND(M57/1.09,2) -> 0.63 | N58: =ROUND(N57/16.11,2) -> 0.84
A59: 42-3012-04 Fremont Indian State Park | B59: 0.58 | C59: 0.81 | D59: 1.21 | E59: 0.64 | F59: 0.58 | G59: 1.57 | H59: 0.62 | I59: 0.08 | J59: 1.81 | K59: 0.01 | L59: 0.33 | N59: =SUM(B59:M59) -> 8.24
A60: % of normal | B60: =ROUND(B59/1.38,2) -> 0.42 | C60: =ROUND(C59/0.79,2) -> 1.03 | D60: =ROUND(D59/0.65,2) -> 1.86 | E60: =ROUND(E59/0.78,2) -> 0.82 | F60: =ROUND(F59/0.78,2) -> 0.74 | G60: =ROUND(G59/1.02,2) -> 1.54 | H60: =ROUND(H59/1,2) -> 0.62 | I60: =ROUND(I59/1.12,2) -> 0.07 | J60: =ROUND(J59/0.75,2) -> 2.41 | K60: =ROUND(K59/1.05,2) -> 0.01 | L60: =ROUND(L59/1.69,2) -> 0.2 | M60: =ROUND(M59/0.93,2) -> 0 | N60: =ROUND(N59/11.94,2) -> 0.69
A61: 42-3097-03 Garfield | B61: 0.72 | C61: 1.14 | D61: 2.60 | E61: 2.15 | F61: 0.65 | G61: 1.40 | H61: 2.52 | I61: 1.22 | J61: 2.65 | K61: 0.75 | L61: 0.39 | M61: 1.85 | N61: =SUM(B61:M61) -> 18.04
A62: % of normal | B62: =ROUND(B61/1.98,2) -> 0.36 | C62: =ROUND(C61/1.73,2) -> 0.66 | D62: =ROUND(D61/1.2,2) -> 2.17 | E62: =ROUND(E61/1.3,2) -> 1.65 | F62: =ROUND(F61/1.38,2) -> 0.47 | G62: =ROUND(G61/1.98,2) -> 0.71 | H62: =ROUND(H61/2.22,2) -> 1.14 | I62: =ROUND(I61/2.43,2) -> 0.5 | J62: =ROUND(J61/0.95,2) -> 2.79 | K62: =ROUND(K61/1.03,2) -> 0.73 | L62: =ROUND(L61/0.93,2) -> 0.42 | M62: =ROUND(M61/1.63,2) -> 1.13 | N62: =ROUND(N61/18.76,2) -> 0.96
A63: 42-3254-07 Goblin Valley State Park | B63: 0.45 | C63: 0.88 | D63: 0.26 | E63: 0.08 | F63: 0.15 | G63: T | H63: 0.38 | I63: 2.09 | J63: 0.53 | K63: 0.08 | L63: 0.02 | M63: 0.69 | N63: =SUM(B63:M63) -> 5.61
A64: Normals not available | B64: NA | C64: NA | D64: NA | E64: NA | F64: NA | G64: NA | H64: NA | I64: NA | J64: NA | K64: NA | L64: NA | M64: NA | N64: NA
A65: 42-3418-07 Green River Aviation | B65: M | C65: M | D65: M | E65: M | F65: M | G65: M | H65: M | I65: M | J65: M | K65: M | L65: M | M65: M | N65: M
A66: % of normal | B66: 0 | C66: 0 | D66: 0 | E66: 0 | F66: 0 | G66: 0 | H66: 0 | I66: 0 | J66: 0 | K66: 0 | L66: 0 | M66: 0 | N66: 0
A67: 42-3600-07 Hans Flat Ranger Station | B67: 0.37 | C67: 0.96 | D67: 2.90 | E67: 0.28 | F67: 0.22 | G67: 0.26 | H67: 0.66 | I67: 1.83 | J67: 0.48 | K67: 0.13 | L67: 0.13 | M67: 0.66 | N67: =SUM(B67:M67) -> 8.88
A68: % of normal | B68: =ROUND(B67/1.18,2) -> 0.31 | C68: =ROUND(C67/0.78,2) -> 1.23 | D68: =ROUND(D67/0.54,2) -> 5.37 | E68: =ROUND(E67/0.66,2) -> 0.42 | F68: =ROUND(F67/0.47,2) -> 0.47 | G68: =ROUND(G67/0.81,2) -> 0.32 | H68: =ROUND(H67/0.64,2) -> 1.03 | I68: =ROUND(I67/0.61,2) -> 3 | J68: =ROUND(J67/0.44,2) -> 1.09 | K68: =ROUND(K67/1.16,2) -> 0.11 | L68: =ROUND(L67/0.96,2) -> 0.14 | M68: =ROUND(M67/0.91,2) -> 0.73 | N68: =ROUND(N67/9.16,2) -> 0.97
A69: 42-3611-07 Hanksville | B69: 0.21 | C69: 0.80 | D69: 0.79 | E69: 0.29 | F69: 0.07 | G69: 0.19 | H69: 0.43 | I69: 1.21 | J69: 0.56 | K69: T | L69: 0.04 | M69: 0.47 | N69: =SUM(B69:M69) -> 5.06
A70: % of normal | B70: =ROUND(B69/0.71,2) -> 0.3 | C70: =ROUND(C69/0.41,2) -> 1.95 | D70: =ROUND(D69/0.27,2) -> 2.93 | E70: =ROUND(E69/0.5,2) -> 0.58 | F70: =ROUND(F69/0.25,2) -> 0.28 | G70: =ROUND(G69/0.55,2) -> 0.35 | H70: =ROUND(H69/0.45,2) -> 0.96 | I70: =ROUND(I69/0.52,2) -> 2.33 | J70: =ROUND(J69/0.23,2) -> 2.43 | K70: 0 | L70: =ROUND(L69/0.55,2) -> 0.07 | M70: =ROUND(M69/0.79,2) -> 0.59 | N70: =ROUND(N69/5.72,2) -> 0.88
A71: 42-3776-04 Hatch | B71: 0.48 | C71: 1.19 | D71: 2.40 | E71: 0.76 | F71: 1.16 | G71: 0.43 | H71: 0.99 | I71: 0.56 | J71: 0.53 | K71: 1.29 | L71: 0.11 | M71: 0.72 | N71: =SUM(B71:M71) -> 10.62
A72: % of normal | B72: =ROUND(B71/1.26,2) -> 0.38 | C72: =ROUND(C71/0.96,2) -> 1.24 | D72: =ROUND(D71/0.66,2) -> 3.64 | E72: =ROUND(E71/0.86,2) -> 0.88 | F72: =ROUND(F71/1.07,2) -> 1.08 | G72: =ROUND(G71/1.18,2) -> 0.36 | H72: =ROUND(H71/0.72,2) -> 1.38 | I72: =ROUND(I71/0.89,2) -> 0.63 | J72: =ROUND(J71/0.55,2) -> 0.96 | K72: =ROUND(K71/1.25,2) -> 1.03 | L72: =ROUND(L71/1.69,2) -> 0.07 | M72: =ROUND(M71/1.17,2) -> 0.62 | N72: =ROUND(N71/12.26,2) -> 0.87
A73: 42-3809-05 Heber | B73: 0.02 | C73: 1.68 | D73: 1.29 | E73: 2.42 | F73: 1.87 | G73: 0.66 | H73: 2.73 | I73: 0.87 | J73: 1.47 | K73: 0.39 | L73: 0.65 | M73: 1.32 | N73: =SUM(B73:M73) -> 15.37
A74: % of normal | B74: =ROUND(B73/1.62,2) -> 0.01 | C74: =ROUND(C73/1.5,2) -> 1.12 | D74: =ROUND(D73/1.39,2) -> 0.93 | E74: =ROUND(E73/1.86,2) -> 1.3 | F74: =ROUND(F73/1.71,2) -> 1.09 | G74: =ROUND(G73/1.47,2) -> 0.45 | H74: =ROUND(H73/1.28,2) -> 2.13 | I74: =ROUND(I73/1.48,2) -> 0.59 | J74: =ROUND(J73/0.84,2) -> 1.75 | K74: =ROUND(K73/0.83,2) -> 0.47 | L74: =ROUND(L73/0.97,2) -> 0.67 | M74: =ROUND(M73/1.27,2) -> 1.04 | N74: =ROUND(N73/16.22,2) -> 0.95
A75: 42-3836-05 Helper-Carbon UP&L | J75: 1.35 | K75: 0.27 | L75: 0.19 | M75: 0.23 | N75: =SUM(B75:M75) -> 2.04
A76: % of normal | B76: =ROUND(B75/1.64,2) -> 0 | C76: =ROUND(C75/0.94,2) -> 0 | D76: =ROUND(D75/0.73,2) -> 0 | E76: =ROUND(E75/1.19,2) -> 0 | F76: =ROUND(F75/1.27,2) -> 0 | G76: =ROUND(G75/1.48,2) -> 0 | H76: =ROUND(H75/1.09,2) -> 0 | I76: =ROUND(I75/1.03,2) -> 0 | J76: =ROUND(J75/0.62,2) -> 2.18 | K76: =ROUND(K75/1,2) -> 0.27 | L76: =ROUND(L75/1.2,2) -> 0.16 | M76: =ROUND(M75/1.58,2) -> 0.15 | N76: =ROUND(N75/13.77,2) -> 0.15
A77: 42-3980-07 Hite Ranger Station | B77: 0.17 | C77: 0.67 | D77: M | E77: 0.18 | F77: M | G77: 0.19 | H77: 0.31 | I77: 0.80 | J77: 0.26 | K77: 0.32 | L77: 0.01 | M77: 0.21 | N77: =SUM(B77:M77) -> 3.12
A78: % of normal | B78: =ROUND(B77/1.33,2) -> 0.13 | C78: =ROUND(C77/0.67,2) -> 1 | D78: =ROUND(D77/0.55,2) -> ##### | E78: =ROUND(E77/0.7,2) -> 0.26 | F78: =ROUND(F77/0.37,2) -> ##### | G78: =ROUND(G77/0.69,2) -> 0.28 | H78: =ROUND(H77/0.49,2) -> 0.63 | I78: =ROUND(I77/0.47,2) -> 1.7 | J78: =ROUND(J77/0.26,2) -> 1 | K78: =ROUND(K77/0.63,2) -> 0.51 | L78: =ROUND(L77/0.46,2) -> 0.02 | M78: =ROUND(M77/0.8,2) -> 0.26 | N78: =ROUND(N77/7.42,2) -> 0.42
A79: 42-4135-05 Huntsville Monastery | B79: 1.41 | C79: 1.60 | D79: 1.86 | E79: 1.38 | F79: 3.60 | G79: 1.51 | H79: 2.90 | I79: 0.95 | J79: 3.46 | K79: 0.00 | L79: 0.67 | M79: 0.76 | N79: =SUM(B79:M79) -> 20.10
A80: % of normal | B80: =ROUND(B79/1.97,2) -> 0.72 | C80: =ROUND(C79/2.2,2) -> 0.73 | D80: =ROUND(D79/2.06,2) -> 0.9 | E80: =ROUND(E79/2.64,2) -> 0.52 | F80: =ROUND(F79/2.1,2) -> 1.71 | G80: =ROUND(G79/2.21,2) -> 0.68 | H80: =ROUND(H79/2.01,2) -> 1.44 | I80: =ROUND(I79/2.21,2) -> 0.43 | J80: =ROUND(J79/1.29,2) -> 2.68 | K80: =ROUND(K79/0.87,2) -> 0 | L80: =ROUND(L79/0.84,2) -> 0.8 | M80: =ROUND(M79/1.69,2) -> 0.45 | N80: =ROUND(N79/22.09,2) -> 0.91
A81: 42-4467-05 Kamas | B81: 0.68 | C81: 1.73 | D81: 2.86 | E81: 2.11 | F81: 0.73 | G81: 1.80 | H81: 4.18 | I81: 0.67 | J81: 3.49 | K81: 0.60 | L81: 1.02 | M81: 1.72 | N81: =SUM(B81:M81) -> 21.59
A82: % of normal | B82: =ROUND(B81/1.74,2) -> 0.39 | C82: =ROUND(C81/1.52,2) -> 1.14 | D82: =ROUND(D81/1.28,2) -> 2.23 | E82: =ROUND(E81/1.58,2) -> 1.34 | F82: =ROUND(F81/1.45,2) -> 0.5 | G82: =ROUND(G81/1.59,2) -> 1.13 | H82: =ROUND(H81/1.55,2) -> 2.7 | I82: =ROUND(I81/1.64,2) -> 0.41 | J82: =ROUND(J81/0.94,2) -> 3.71 | K82: =ROUND(K81/1.06,2) -> 0.57 | L82: =ROUND(L81/1.06,2) -> 0.96 | M82: =ROUND(M81/1.48,2) -> 1.16 | N82: =ROUND(N81/16.89,2) -> 1.28
A83: 42-4508-04 Kanab | B83: 0.65 | C83: 1.62 | D83: 2.00 | E83: 0.51 | F83: 0.92 | G83: 0.04 | H83: 0.29 | I83: 0.66 | J83: 0.26 | K83: 0.94 | L83: 0.40 | M83: 1.10 | N83: =SUM(B83:M83) -> 9.39
A84: % of normal | B84: =ROUND(B83/1.35,2) -> 0.48 | C84: =ROUND(C83/1.18,2) -> 1.37 | D84: =ROUND(D83/1.01,2) -> 1.98 | E84: =ROUND(E83/1.86,2) -> 0.27 | F84: =ROUND(F83/1.73,2) -> 0.53 | G84: =ROUND(G83/1.91,2) -> 0.02 | H84: =ROUND(H83/0.95,2) -> 0.31 | I84: =ROUND(I83/0.68,2) -> 0.97 | J84: =ROUND(J83/0.4,2) -> 0.65 | K84: =ROUND(K83/1.05,2) -> 0.9 | L84: =ROUND(L83/1.45,2) -> 0.28 | M84: =ROUND(M83/1.37,2) -> 0.8 | N84: =ROUND(N83/14.94,2) -> 0.63
A85: 42-4527-04 Kanosh | B85: 1.03 | C85: 1.15 | D85: 1.64 | E85: 2.09 | F85: 0.40 | G85: 1.56 | H85: 1.51 | I85: 0.79 | J85: 1.63 | K85: 0.31 | L85: 0.04 | M85: 0.65 | N85: =SUM(B85:M85) -> 12.80
A86: % of normal | B86: =ROUND(B85/1.66,2) -> 0.62 | C86: =ROUND(C85/1.5,2) -> 0.77 | D86: 1.6400000000000001E-2 | E86: =ROUND(E85/1.38,2) -> 1.51 | F86: =ROUND(F85/1.25,2) -> 0.32 | G86: =ROUND(G85/1.91,2) -> 0.82 | H86: =ROUND(H85/1.82,2) -> 0.83 | I86: =ROUND(I85/1.58,2) -> 0.5 | J86: =ROUND(J85/0.67,2) -> 2.43 | K86: =ROUND(K85/0.89,2) -> 0.35 | L86: =ROUND(L85/1.14,2) -> 0.04 | M86: =ROUND(M85/1.05,2) -> 0.62 | N86: =ROUND(N85/16.06,2) -> 0.8
A87: 42-4755-04 Kodachrome Basin Park | B87: 0.29 | C87: 0.80 | D87: 2.74 | E87: 0.38 | F87: 0.51 | G87: 0.28 | H87: 0.25 | I87: 1.19 | J87: 0.57 | K87: 1.68 | L87: 0.24 | M87: 0.05 | N87: =SUM(B87:M87) -> 8.98
A88: % of normal | B88: =ROUND(B87/1.34,2) -> 0.22 | C88: =ROUND(C87/0.72,2) -> 1.11 | D88: =ROUND(D87/0.63,2) -> 4.35 | E88: =ROUND(E87/1.03,2) -> 0.37 | F88: =ROUND(F87/1.12,2) -> 0.46 | G88: =ROUND(G87/1.12,2) -> 0.25 | H88: =ROUND(H87/0.66,2) -> 0.38 | I88: =ROUND(I87/0.67,2) -> 1.78 | J88: =ROUND(J87/0.37,2) -> 1.54 | K88: =ROUND(K87/1.02,2) -> 1.65 | L88: =ROUND(L87/1.57,2) -> 0.15 | M88: =ROUND(M87/1.2,2) -> 0.04 | N88: =ROUND(N87/11.45,2) -> 0.78
A89: 42-4764-04 Koosharem | B89: 0.65 | C89: 0.84 | D89: 0.32 | E89: 0.52 | F89: 0.21 | G89: 0.21 | H89: M | I89: M | J89: M | K89: M | L89: M | M89: M | N89: =SUM(B89:M89) -> 2.75
A90: % of normal | B90: =ROUND(B89/0.97,2) -> 0.67 | C90: =ROUND(C89/0.56,2) -> 1.5 | D90: 0.67 | E90: =ROUND(E89/0.64,2) -> 0.81 | F90: =ROUND(F89/0.57,2) -> 0.37 | G90: =ROUND(G89/0.78,2) -> 0.27 | H90: 0 | I90: 0 | J90: 0 | K90: 0 | L90: 0 | M90: 0 | N90: =ROUND(N89/9.49,2) -> 0.29
A91: 42-4970-03 Layton | B91: 2.33 | C91: 2.10 | D91: 1.55 | E91: 2.93 | F91: 3.24 | G91: 1.46 | H91: 2.53 | I91: 0.93 | J91: 4.75 | K91: 0.70 | L91: 1.26 | M91: 0.96 | N91: =SUM(B91:M91) -> 24.74
A92: Normals not available | B92: NA | C92: NA | D92: NA | E92: NA | F92: NA | G92: NA | H92: NA | I92: NA | J92: NA | K92: NA | L92: NA | M92: NA | N92: NA
A93: 42-5065-04 Levan | B93: M | C93: M | D93: 1.31 | E93: M | F93: 0.27 | G93: 0.65 | H93: 0.66 | I93: 1.11 | J93: 1.29 | K93: 0.31 | L93: 0.01 | M93: 0.70 | N93: =SUM(B93:M93) -> 6.31
A94: % of normal | B94: =ROUND(B93/1.62,2) -> ###### | C94: =ROUND(C93/1.24,2) -> ###### | D94: =ROUND(D93/1.12,2) -> 1.17 | E94: =ROUND(E93/1.35,2) -> ##### | F94: =ROUND(F93/1.37,2) -> 0.2 | G94: =ROUND(G93/1.64,2) -> 0.4 | H94: =ROUND(H93/1.49,2) -> 0.44 | I94: =ROUND(I93/1.63,2) -> 0.68 | J94: =ROUND(J93/0.78,2) -> 1.65 | K94: =ROUND(K93/0.77,2) -> 0.4 | L94: =ROUND(L93/0.82,2) -> 0.01 | M94: =ROUND(M93/1.21,2) -> 0.58 | N94: =ROUND(N93/15.04,2) -> 0.42
A95: 42-5148-04 Loa | B95: 0.25 | C95: 0.32 | D95: 0.61 | E95: 0.06 | F95: 0.26 | G95: 0.16 | H95: 0.40 | I95: 0.24 | J95: 0.78 | K95: 0.17 | L95: 0.01 | M95: 0.62 | N95: =SUM(B95:M95) -> 3.88
A96: % of normal | B96: =ROUND(B95/0.73,2) -> 0.34 | C96: =ROUND(C95/0.37,2) -> 0.86 | D96: =ROUND(D95/0.27,2) -> 2.26 | E96: =ROUND(E95/0.46,2) -> 0.13 | F96: =ROUND(F95/0.32,2) -> 0.81 | G96: =ROUND(G95/0.55,2) -> 0.29 | H96: =ROUND(H95/0.44,2) -> 0.91 | I96: =ROUND(I95/0.82,2) -> 0.29 | J96: =ROUND(J95/0.57,2) -> 1.37 | K96: =ROUND(K95/0.89,2) -> 0.19 | L96: =ROUND(L95/1.39,2) -> 0.01 | M96: =ROUND(M95/0.94,2) -> 0.66 | N96: =ROUND(N95/7.75,2) -> 0.5
A97: 42-5186-03 Logan Utah State Univ | B97: 1.46 | C97: 1.69 | D97: 2.11 | E97: 2.40 | F97: 1.48 | G97: 2.92 | H97: 3.05 | I97: 1.79 | J97: 3.38 | K97: T | L97: 1.65 | M97: 1.13 | N97: =SUM(B97:M97) -> 23.06
A98: % of normal | B98: =ROUND(B97/2.06,2) -> 0.71 | C98: =ROUND(C97/1.56,2) -> 1.08 | D98: =ROUND(D97/1.58,2) -> 1.34 | E98: =ROUND(E97/1.56,2) -> 1.54 | F98: =ROUND(F97/1.61,2) -> 0.92 | G98: =ROUND(G97/2.15,2) -> 1.36 | H98: =ROUND(H97/2.12,2) -> 1.44 | I98: =ROUND(I97/2.39,2) -> 0.75 | J98: =ROUND(J97/1.34,2) -> 2.52 | K98: 0 | L98: =ROUND(L97/0.98,2) -> 1.68 | M98: =ROUND(M97/1.56,2) -> 0.72 | N98: =ROUND(N97/19.89,2) -> 1.16
A99: 42-5194-03 Logan 5SW Exp Farm | B99: 0.93 | C99: 1.01 | D99: 1.65 | E99: 2.25 | F99: 1.81 | G99: 2.14 | H99: 2.58 | I99: 1.92 | J99: 2.22 | K99: T | L99: 1.26 | M99: 0.85 | N99: =SUM(B99:M99) -> 18.62
A100: % of normal | B100: =ROUND(B99/1.89,2) -> 0.49 | C100: =ROUND(C99/1.54,2) -> 0.66 | D100: =ROUND(D99/1.48,2) -> 1.11 | E100: =ROUND(E99/1.67,2) -> 1.35 | F100: =ROUND(F99/1.69,2) -> 1.07 | G100: =ROUND(G99/1.86,2) -> 1.15 | H100: =ROUND(H99/1.96,2) -> 1.32 | I100: =ROUND(I99/2.17,2) -> 0.88 | J100: =ROUND(J99/1.26,2) -> 1.76 | K100: 0 | L100: =ROUND(L99/0.95,2) -> 1.33 | M100: =ROUND(M99/1.44,2) -> 0.59 | N100: =ROUND(N99/18.79,2) -> 0.99
A101: 42-5402-04 Manti | B101: 0.89 | C101: 0.90 | D101: 0.82 | E101: 1.94 | F101: 0.81 | G101: 0.50 | H101: 2.05 | I101: 1.09 | J101: 1.13 | K101: 0.21 | L101: 0.47 | M101: 0.99 | N101: =SUM(B101:M101) -> 11.80
A102: % of normal | B102: =ROUND(B101/1.45,2) -> 0.61 | C102: =ROUND(C101/1.15,2) -> 0.78 | D102: =ROUND(D101/0.91,2) -> 0.9 | E102: =ROUND(E101/1.08,2) -> 1.8 | F102: =ROUND(F101/1.07,2) -> 0.76 | G102: =ROUND(G101/1.46,2) -> 0.34 | H102: =ROUND(H101/1.31,2) -> 1.56 | I102: =ROUND(I101/1.52,2) -> 0.72 | J102: =ROUND(J101/0.77,2) -> 1.47 | K102: =ROUND(K101/0.79,2) -> 0.27 | L102: =ROUND(L101/0.89,2) -> 0.53 | M102: =ROUND(M101/1.31,2) -> 0.76 | N102: =ROUND(N101/13.71,2) -> 0.86
A103: 42-5477-04 Marysvale | B103: 0.36 | C103: 0.60 | D103: 1.07 | E103: 0.40 | F103: 0.40 | G103: 0.26 | H103: 0.30 | I103: 0.51 | J103: 0.48 | K103: 0.64 | L103: 0.06 | M103: 0.08 | N103: =SUM(B103:M103) -> 5.16
A104: % of normal | B104: =ROUND(B103/0.87,2) -> 0.41 | C104: =ROUND(C103/0.59,2) -> 1.02 | D104: =ROUND(D103/0.44,2) -> 2.43 | E104: =ROUND(E103/0.59,2) -> 0.68 | F104: =ROUND(F103/0.54,2) -> 0.74 | G104: =ROUND(G103/0.76,2) -> 0.34 | H104: =ROUND(H103/0.61,2) -> 0.49 | I104: =ROUND(I103/0.75,2) -> 0.68 | J104: =ROUND(J103/0.44,2) -> 1.09 | K104: =ROUND(K103/0.76,2) -> 0.84 | L104: =ROUND(L103/1,2) -> 0.06 | M104: =ROUND(M103/0.8,2) -> 0.1 | N104: =ROUND(N103/8.15,2) -> 0.63
A105: 42-5826-05 Morgan Power & Light | B105: 0.79 | C105: 0.91 | D105: 1.39 | E105: 1.15 | F105: M | G105: 1.73 | H105: 2.24 | I105: 1.09 | J105: 2.58 | K105: M | L105: M | M105: 1.41 | N105: =SUM(B105:M105) -> 13.29
A106: % of normal | B106: =ROUND(B105/1.71,2) -> 0.46 | C106: =ROUND(C105/1.85,2) -> 0.49 | D106: =ROUND(D105/1.58,2) -> 0.88 | E106: =ROUND(E105/1.85,2) -> 0.62 | F106: =ROUND(F105/1.77,2) -> ##### | G106: =ROUND(G105/1.88,2) -> 0.92 | H106: =ROUND(H105/2.1,2) -> 1.07 | I106: =ROUND(I105/2.03,2) -> 0.54 | J106: =ROUND(J105/1.13,2) -> 2.28 | K106: 0 | L106: 0 | M106: =ROUND(M105/1.54,2) -> 0.92 | N106: =ROUND(N105/19.02,2) -> 0.7
A107: 42-5837-04 Moroni | C107: 0.67 | D107: 0.89 | E107: 1.15 | F107: 0.75 | G107: M | H107: M | I107: M | J107: 1.30 | K107: 0.14 | L107: 0.12 | M107: 1.02 | N107: =SUM(B107:M107) -> 6.04
A108: % of normal | B108: =ROUND(B107/1.07,2) -> 0 | C108: =ROUND(C107/0.86,2) -> 0.78 | D108: =ROUND(D107/0.83,2) -> 1.07 | E108: =ROUND(E107/0.93,2) -> 1.24 | F108: =ROUND(F107/0.9,2) -> 0.83 | G108: 0 | H108: 0 | I108: 0 | J108: =ROUND(J107/0.54,2) -> 2.41 | K108: =ROUND(K107/0.73,2) -> 0.19 | L108: =ROUND(L107/0.81,2) -> 0.15 | M108: =ROUND(M107/0.93,2) -> 1.1 | N108: =ROUND(N107/10.12,2) -> 0.6
A109: 42-5892-05 Mountain Dell Dam | B109: 1.47 | C109: 2.80 | D109: 2.72 | E109: 3.45 | F109: 1.30 | G109: 3.59 | H109: 4.56 | I109: 2.12 | J109: 4.33 | K109: 0.17 | L109: 0.33 | M109: 2.14 | N109: =SUM(B109:M109) -> 28.98
A110: % of normal | B110: =ROUND(B109/2.65,2) -> 0.55 | C110: =ROUND(C109/2.12,2) -> 1.32 | D110: =ROUND(D109/1.99,2) -> 1.37 | E110: =ROUND(E109/1.97,2) -> 1.75 | F110: =ROUND(F109/1.96,2) -> 0.66 | G110: =ROUND(G109/2.5,2) -> 1.44 | H110: =ROUND(H109/2.47,2) -> 1.85 | I110: =ROUND(I109/2.74,2) -> 0.77 | J110: =ROUND(J109/1.39,2) -> 3.12 | K110: =ROUND(K109/1.08,2) -> 0.16 | L110: =ROUND(L109/1.14,2) -> 0.29 | M110: =ROUND(M109/2.03,2) -> 1.05 | N110: =ROUND(N109/24.04,2) -> 1.21
A111: 42-5969-06 Myton | B111: 0.43 | C111: 0.29 | D111: 0.63 | E111: 0.22 | F111: 0.01 | G111: 0.13 | H111: 0.97 | I111: 0.69 | J111: 1.68 | K111: 0.04 | L111: 0.76 | M111: 1.22 | N111: =SUM(B111:M111) -> 7.07
A112: % of normal | B112: =ROUND(B111/0.88,2) -> 0.49 | C112: =ROUND(C111/0.41,2) -> 0.71 | D112: =ROUND(D111/0.25,2) -> 2.52 | E112: =ROUND(E111/0.34,2) -> 0.65 | F112: =ROUND(F111/0.34,2) -> 0.03 | G112: =ROUND(G111/0.5,2) -> 0.26 | H112: =ROUND(H111/0.72,2) -> 1.35 | I112: =ROUND(I111/0.93,2) -> 0.74 | J112: =ROUND(J111/0.55,2) -> 3.05 | K112: =ROUND(K111/0.61,2) -> 0.07 | L112: =ROUND(L111/0.72,2) -> 1.06 | M112: =ROUND(M111/0.79,2) -> 1.54 | N112: =ROUND(N111/7.04,2) -> 1
A113: 42-6123-06 Neola | B113: 0.97 | C113: 0.38 | D113: 1.17 | E113: 0.22 | F113: 0.27 | G113: 0.01 | H113: 1.13 | I113: 1.34 | J113: 2.05 | K113: 0.32 | L113: 0.64 | M113: M | N113: =SUM(B113:M113) -> 8.50
A114: % of normal | B114: =ROUND(B113/1.19,2) -> 0.82 | C114: =ROUND(C113/0.6,2) -> 0.63 | D114: =ROUND(D113/0.42,2) -> 2.79 | E114: =ROUND(E113/0.57,2) -> 0.39 | F114: =ROUND(F113/0.54,2) -> 0.5 | G114: =ROUND(G113/0.64,2) -> 0.02 | H114: =ROUND(H113/0.81,2) -> 1.4 | I114: =ROUND(I113/1.17,2) -> 1.15 | J114: =ROUND(J113/0.67,2) -> 3.06 | K114: =ROUND(K113/0.75,2) -> 0.43 | L114: =ROUND(L113/0.84,2) -> 0.76 | M114: 0 | N114: 0
A115: 42-6135-04 Nephi | B115: 1.02 | C115: 0.90 | D115: 1.22 | E115: 2.24 | F115: 0.57 | G115: 0.25 | H115: 1.95 | I115: 1.48 | J115: 2.23 | K115: 0.27 | L115: 0.08 | M115: 0.21 | N115: =SUM(B115:M115) -> 12.42
A116: % of normal | B116: =ROUND(B115/1.55,2) -> 0.66 | C116: =ROUND(C115/1.41,2) -> 0.64 | D116: =ROUND(D115/1.13,2) -> 1.08 | E116: =ROUND(E115/1.36,2) -> 1.65 | F116: =ROUND(F115/1.36,2) -> 0.42 | G116: =ROUND(G115/1.76,2) -> 0.14 | H116: =ROUND(H115/1.57,2) -> 1.24 | I116: =ROUND(I115/1.57,2) -> 0.94 | J116: =ROUND(J115/0.82,2) -> 2.72 | K116: =ROUND(K115/0.85,2) -> 0.32 | L116: =ROUND(L115/1,2) -> 0.08 | M116: =ROUND(M115/1.16,2) -> 0.18 | N116: =ROUND(N115/15.54,2) -> 0.8
A117: 42-6404-03 Ogden Pioneer PH | B117: 2.02 | C117: 1.99 | D117: 1.46 | E117: 2.67 | F117: 2.53 | G117: 1.23 | H117: 2.76 | I117: 0.36 | J117: 3.51 | K117: M | L117: 0.83 | M117: 0.61 | N117: =SUM(B117:M117) -> 19.97
A118: % of normal | B118: =ROUND(B117/2.27,2) -> 0.89 | C118: =ROUND(C117/2.01,2) -> 0.99 | D118: =ROUND(D117/1.97,2) -> 0.74 | E118: =ROUND(E117/2.32,2) -> 1.15 | F118: =ROUND(F117/2.13,2) -> 1.19 | G118: =ROUND(G117/2.44,2) -> 0.5 | H118: =ROUND(H117/2.45,2) -> 1.13 | I118: =ROUND(I117/2.9,2) -> 0.12 | J118: =ROUND(J117/1.47,2) -> 2.39 | K118: 0 | L118: =ROUND(L117/1.02,2) -> 0.81 | M118: =ROUND(M117/1.75,2) -> 0.35 | N118: =ROUND(N117/23.67,2) -> 0.84
A119: 42-6414-03 Ogden Sugar Factory | B119: 1.58 | C119: 2.00 | D119: 0.65 | E119: 0.70 | F119: 3.30 | G119: M | H119: M | I119: M | J119: M | K119: M | L119: M | M119: M | N119: =SUM(B119:M119) -> 8.23
A120: % of normal | B120: =ROUND(B119/1.91,2) -> 0.83 | C120: =ROUND(C119/1.59,2) -> 1.26 | D120: =ROUND(D119/1.37,2) -> 0.47 | E120: =ROUND(E119/1.72,2) -> 0.41 | F120: =ROUND(F119/1.54,2) -> 2.14 | G120: 0 | H120: 0 | I120: 0 | J120: 0 | K120: 0 | L120: 0 | M120: 0 | N120: NA
A121: 42-6534-04 Orderville | B121: 1.10 | C121: 4.57 | D121: 3.82 | E121: 0.76 | F121: M | G121: 0.02 | H121: 0.88 | I121: 1.13 | J121: 0.34 | K121: 0.16 | L121: 0.24 | M121: 2.42 | N121: =SUM(B121:M121) -> 15.44
A122: % of normal | B122: =ROUND(B121/1.27,2) -> 0.87 | C122: =ROUND(C121/1.21,2) -> 3.78 | D122: =ROUND(D121/1.08,2) -> 3.54 | E122: =ROUND(E121/1.82,2) -> 0.42 | F122: 0 | G122: =ROUND(G121/2.05,2) -> 0.01 | H122: =ROUND(H121/0.98,2) -> 0.9 | I122: =ROUND(I121/0.89,2) -> 1.27 | J122: =ROUND(J121/0.58,2) -> 0.59 | K122: =ROUND(K121/1.15,2) -> 0.14 | L122: =ROUND(L121/1.65,2) -> 0.15 | M122: =ROUND(M121/1.15,2) -> 2.1 | N122: =ROUND(N121/15.74,2) -> 0.98
A123: 42-6538-03 Orem Treatment Plant | B123: 1.28 | C123: 0.97 | E123: 2.83 | F123: 1.02 | G123: 0.12 | H123: 3.03 | I123: 1.08 | J123: 1.97 | K123: 0.10 | L123: 0.28 | N123: =SUM(B123:M123) -> 12.68
A124: % of normal | B124: =ROUND(B123/1.49,2) -> 0.86 | C124: =ROUND(C123/1.03,2) -> 0.94 | D124: =ROUND(D123/0.79,2) -> 0 | E124: =ROUND(E123/1.22,2) -> 2.32 | F124: =ROUND(F123/1.11,2) -> 0.92 | G124: =ROUND(G123/1.15,2) -> 0.1 | H124: =ROUND(H123/1.3,2) -> 2.33 | I124: =ROUND(I123/1.38,2) -> 0.78 | J124: =ROUND(J123/0.78,2) -> 2.53 | K124: =ROUND(K123/0.67,2) -> 0.15 | L124: =ROUND(L123/0.77,2) -> 0.36 | M124: =ROUND(M123/1.15,2) -> 0 | N124: =ROUND(N123/12.84,2) -> 0.99
A125: 42-6601-04 Panguitch | B125: M | C125: M | D125: M | E125: M | F125: M | G125: M | H125: M | I125: M | J125: M | K125: M | L125: M | M125: 0.61 | N125: =SUM(B125:M125) -> 0.61
A126: % of normal | B126: 0 | C126: 0 | D126: 0 | E126: 0 | F126: 0 | G126: 0 | H126: 0 | I126: 0 | J126: 0 | K126: 0 | L126: NA | M126: =ROUND(M125/0.98,2) -> 0.62 | N126: =ROUND(N125/10.07,2) -> 0.06
A127: 42-6640-04 Paria Ranger Station | B127: 0.28 | C127: 0.99 | D127: 1.45 | E127: 0.48 | F127: 0.34 | G127: 0.08 | H127: T | I127: 1.76 | J127: 0.40 | K127: 0.50 | L127: 0.02 | M127: 0.18 | N127: =SUM(B127:M127) -> 6.48
A128: Normals not available | B128: NA | C128: NA | D128: NA | E128: NA | F128: NA | G128: NA | H128: NA | I128: NA | J128: NA | K128: NA | L128: NA | M128: NA | N128: NA
A129: 42-6644-05 Park City | B129: M | C129: M | D129: M | E129: M | F129: M | G129: M | H129: M | I129: M | J129: M | K129: M | L129: M | M129: M | N129: =SUM(B129:M129) -> 0.00
A130: Normals not available | B130: NA | C130: NA | D130: NA | E130: NA | F130: NA | G130: NA | H130: NA | I130: NA | J130: NA | K130: NA | L130: NA | M130: NA | N130: NA
A131: 42-6869-05 Pine View Dam | B131: 1.99 | C131: 3.40 | D131: 4.75 | E131: 5.51 | F131: 4.15 | G131: 3.60 | H131: M | I131: 2.07 | J131: 6.54 | K131: 0.43 | L131: 1.09 | N131: =SUM(B131:M131) -> 33.53
A132: % of normal | B132: =ROUND(B131/2.91,2) -> 0.68 | C132: =ROUND(C131/3.15,2) -> 1.08 | D132: =ROUND(D131/3.34,2) -> 1.42 | E132: =ROUND(E131/3.89,2) -> 1.42 | F132: =ROUND(F131/3.25,2) -> 1.28 | G132: =ROUND(G131/3.45,2) -> 1.04 | H132: NA | I132: =ROUND(I131/3.4,2) -> 0.61 | J132: =ROUND(J131/1.74,2) -> 3.76 | K132: =ROUND(K131/1.15,2) -> 0.37 | L132: =ROUND(L131/1.13,2) -> 0.96 | M132: =ROUND(M131/2.03,2) -> 0 | N132: =ROUND(N131/32.38,2) -> 1.04
A133: 42-6919-03 Pleasant Grove | B133: 1.47 | C133: 1.58 | D133: 2.00 | E133: 3.41 | F133: 1.39 | G133: 1.12 | H133: 4.77 | I133: 1.94 | J133: 2.29 | K133: 0.15 | L133: 0.36 | M133: 0.69 | N133: =SUM(B133:M133) -> 21.17
A134: % of normal | B134: =ROUND(B133/1.78,2) -> 0.83 | C134: =ROUND(C133/1.51,2) -> 1.05 | D134: =ROUND(D133/1.44,2) -> 1.39 | E134: =ROUND(E133/1.84,2) -> 1.85 | F134: =ROUND(F133/1.76,2) -> 0.79 | G134: =ROUND(G133/1.87,2) -> 0.6 | H134: =ROUND(H133/1.65,2) -> 2.89 | I134: =ROUND(I133/1.85,2) -> 1.05 | J134: =ROUND(J133/0.9,2) -> 2.54 | K134: =ROUND(K133/0.86,2) -> 0.17 | L134: =ROUND(L133/0.88,2) -> 0.41 | M134: =ROUND(M133/1.32,2) -> 0.52 | N134: =ROUND(N133/17.66,2) -> 1.2
A135: 42-7026-07 Price BLM | B135: 1.09 | C135: 0.40 | D135: 1.31 | E135: 0.25 | F135: 0.68 | G135: 0.07 | H135: 0.31 | I135: 1.10 | J135: 1.95 | K135: 0.45 | L135: 0.84 | M135: 0.39 | N135: =SUM(B135:M135) -> 8.84
A136: % of normal | B136: =ROUND(B135/1.24,2) -> 0.88 | C136: =ROUND(C135/0.6,2) -> 0.67 | D136: =ROUND(D135/0.48,2) -> 2.73 | E136: =ROUND(E135/0.76,2) -> 0.33 | F136: =ROUND(F135/0.8,2) -> 0.85 | G136: =ROUND(G135/0.79,2) -> 0.09 | H136: =ROUND(H135/0.59,2) -> 0.53 | I136: =ROUND(I135/0.8,2) -> 1.38 | J136: =ROUND(J135/0.55,2) -> 3.55 | K136: =ROUND(K135/0.89,2) -> 0.51 | L136: =ROUND(L135/1.1,2) -> 0.76 | M136: =ROUND(M135/1.14,2) -> 0.34 | N136: =ROUND(N135/9.74,2) -> 0.91
A137: 42-7064-03 Provo BYU | B137: 1.46 | C137: 1.53 | D137: 1.61 | E137: 3.42 | F137: 1.20 | G137: 1.08 | H137: 4.69 | I137: 1.76 | J137: 1.90 | K137: 0.17 | L137: 0.37 | M137: 1.08 | N137: =SUM(B137:M137) -> 20.27
A138: % of normal | B138: =ROUND(B137/2.03,2) -> 0.72 | C138: =ROUND(C137/1.79,2) -> 0.85 | D138: =ROUND(D137/1.65,2) -> 0.98 | E138: =ROUND(E137/2.13,2) -> 1.61 | F138: =ROUND(F137/1.93,2) -> 0.62 | G138: =ROUND(G137/2.02,2) -> 0.53 | H138: =ROUND(H137/1.85,2) -> 2.54 | I138: =ROUND(I137/2.03,2) -> 0.87 | J138: =ROUND(J137/1.13,2) -> 1.68 | K138: =ROUND(K137/0.89,2) -> 0.19 | L138: =ROUND(L137/1.14,2) -> 0.32 | M138: =ROUND(M137/1.54,2) -> 0.7 | N138: =ROUND(N137/20.13,2) -> 1.01
A139: 42-7260-04 Richfield Radio KSVC | B139: 0.31 | C139: 0.64 | D139: 0.38 | E139: 0.25 | F139: 0.05 | G139: 0.50 | H139: 0.14 | I139: 0.58 | J139: 0.27 | K139: 0.09 | L139: 0.10 | M139: 0.12 | N139: =SUM(B139:M139) -> 3.43
A140: % of normal | B140: =ROUND(B139/0.99,2) -> 0.31 | C140: =ROUND(C139/0.65,2) -> 0.98 | D140: =ROUND(D139/0.45,2) -> 0.84 | E140: =ROUND(E139/0.62,2) -> 0.4 | F140: =ROUND(F139/0.5,2) -> 0.1 | G140: =ROUND(G139/0.77,2) -> 0.65 | H140: =ROUND(H139/0.63,2) -> 0.22 | I140: =ROUND(I139/1.04,2) -> 0.56 | J140: =ROUND(J139/0.59,2) -> 0.46 | K140: =ROUND(K139/0.72,2) -> 0.13 | L140: =ROUND(L139/0.69,2) -> 0.14 | M140: =ROUND(M139/0.86,2) -> 0.14 | N140: =ROUND(N139/8.51,2) -> 0.4
A141: 42-7557-04 Salina | B141: 2.25 | C141: 0.55 | D141: 3.71 | E141: 1.66 | F141: 0.54 | G141: 1.46 | H141: 1.30 | I141: 1.24 | J141: 1.31 | K141: 0.25 | L141: 0.10 | M141: 1.24 | N141: =SUM(B141:M141) -> 15.61
A142: % of normal | B142: =ROUND(B141/1.03,2) -> 2.18 | C142: =ROUND(C141/0.81,2) -> 0.68 | D142: =ROUND(D141/0.58,2) -> 6.4 | E142: =ROUND(E141/0.69,2) -> 2.41 | F142: =ROUND(F141/0.64,2) -> 0.84 | G142: =ROUND(G141/1.18,2) -> 1.24 | H142: =ROUND(H141/0.93,2) -> 1.4 | I142: =ROUND(I141/1.14,2) -> 1.09 | J142: =ROUND(J141/0.5,2) -> 2.62 | K142: =ROUND(K141/0.63,2) -> 0.4 | L142: =ROUND(L141/0.75,2) -> 0.13 | M142: =ROUND(M141/1,2) -> 1.24 | N142: =ROUND(N141/9.88,2) -> 1.58
A143: 42-7559-04 Salina 24E | B143: 0.82 | C143: 0.64 | D143: 0.86 | E143: 0.84 | F143: 0.62 | G143: 0.88 | H143: 1.17 | I143: 2.16 | J143: 1.47 | K143: 0.64 | L143: 0.22 | M143: 0.76 | N143: =SUM(B143:M143) -> 11.08
A144: % of normal | B144: =ROUND(B143/1.36,2) -> 0.6 | C144: =ROUND(C143/1.01,2) -> 0.63 | D144: =ROUND(D143/0.85,2) -> 1.01 | E144: =ROUND(E143/1.03,2) -> 0.82 | F144: =ROUND(F143/0.9,2) -> 0.69 | G144: =ROUND(G143/1.25,2) -> 0.7 | H144: =ROUND(H143/1.01,2) -> 1.16 | I144: =ROUND(I143/1.2,2) -> 1.8 | J144: =ROUND(J143/0.79,2) -> 1.86 | K144: =ROUND(K143/1.39,2) -> 0.46 | L144: =ROUND(L143/1.71,2) -> 0.13 | M144: =ROUND(M143/1.69,2) -> 0.45 | N144: =ROUND(N143/14.19,2) -> 0.78
A145: 42-7598-03 Salt Lake City Intl Airport | B145: 1.29 | C145: 1.50 | D145: 1.28 | E145: 2.15 | F145: 0.83 | G145: 1.72 | H145: 2.55 | I145: 1.36 | J145: 2.64 | K145: 0.28 | L145: 0.40 | M145: 1.19 | N145: =SUM(B145:M145) -> 17.19
A146: % of normal | B146: =ROUND(B145/1.57,2) -> 0.82 | C146: =ROUND(C145/1.4,2) -> 1.07 | D146: =ROUND(D145/1.23,2) -> 1.04 | E146: =ROUND(E145/1.37,2) -> 1.57 | F146: =ROUND(F145/1.33,2) -> 0.62 | G146: =ROUND(G145/1.91,2) -> 0.9 | H146: =ROUND(H145/2.02,2) -> 1.26 | I146: =ROUND(I145/2.09,2) -> 0.65 | J146: =ROUND(J145/0.77,2) -> 3.43 | K146: =ROUND(K145/0.72,2) -> 0.39 | L146: =ROUND(L145/0.76,2) -> 0.53 | M146: =ROUND(M145/1.33,2) -> 0.89 | N146: =ROUND(N145/16.5,2) -> 1.04
A147: 42-7606-03 Salt Lake Triad Center | B147: 1.21 | C147: 1.72 | D147: 1.05 | E147: 2.08 | F147: 1.01 | G147: 1.71 | H147: 2.91 | I147: 1.25 | J147: 2.89 | K147: 0.76 | L147: 0.17 | M147: 1.19 | N147: =SUM(B147:M147) -> 17.95
A148: % of normal | B148: =ROUND(B147/1.69,2) -> 0.72 | C148: =ROUND(C147/1.65,2) -> 1.04 | D148: =ROUND(D147/1.26,2) -> 0.83 | E148: =ROUND(E147/1.58,2) -> 1.32 | F148: =ROUND(F147/1.63,2) -> 0.62 | G148: =ROUND(G147/2.02,2) -> 0.85 | H148: =ROUND(H147/2.18,2) -> 1.33 | I148: =ROUND(I147/2.31,2) -> 0.54 | J148: =ROUND(J147/0.84,2) -> 3.44 | K148: =ROUND(K147/0.71,2) -> 1.07 | L148: =ROUND(L147/0.64,2) -> 0.27 | M148: =ROUND(M147/1.24,2) -> 0.96 | N148: =ROUND(N147/17.75,2) -> 1.01
A149: 42-7686-03 Santaquin Chlorinator | B149: 0.99 | C149: 1.34 | D149: 2.18 | E149: 4.05 | F149: 0.34 | G149: 1.75 | H149: 3.56 | I149: 1.51 | J149: 3.12 | K149: 0.21 | L149: 0.12 | M149: 1.18 | N149: =SUM(B149:M149) -> 20.35
A150: % of normal | B150: =ROUND(B149/2.06,2) -> 0.48 | C150: =ROUND(C149/1.8,2) -> 0.74 | D150: =ROUND(D149/1.33,2) -> 1.64 | E150: =ROUND(E149/1.54,2) -> 2.63 | F150: =ROUND(F149/1.58,2) -> 0.22 | G150: =ROUND(G149/1.91,2) -> 0.92 | H150: =ROUND(H149/1.94,2) -> 1.84 | I150: =ROUND(I149/2.09,2) -> 0.72 | J150: =ROUND(J149/0.83,2) -> 3.76 | K150: =ROUND(K149/0.74,2) -> 0.28 | L150: =ROUND(L149/0.98,2) -> 0.12 | M150: =ROUND(M149/1.42,2) -> 0.83 | N150: =ROUND(N149/18.22,2) -> 1.12
A151: 42-7714-04 Scipio | B151: 1.03 | C151: 1.44 | D151: 1.40 | E151: 2.03 | F151: 0.82 | G151: 0.52 | H151: 0.94 | I151: 1.12 | J151: 1.21 | K151: 0.11 | L151: M | M151: 0.93 | N151: =SUM(B151:M151) -> 11.55
A152: % of normal | B152: =ROUND(B151/1.54,2) -> 0.67 | C152: =ROUND(C151/1.25,2) -> 1.15 | D152: =ROUND(D151/1.03,2) -> 1.36 | E152: =ROUND(E151/1.31,2) -> 1.55 | F152: =ROUND(F151/1.34,2) -> 0.61 | G152: =ROUND(G151/1.33,2) -> 0.39 | H152: =ROUND(H151/1.21,2) -> 0.78 | I152: =ROUND(I151/1.44,2) -> 0.78 | J152: =ROUND(J151/0.66,2) -> 1.83 | K152: =ROUND(K151/0.85,2) -> 0.13 | L152: =ROUND(L151/1.13,2) -> ##### | M152: =ROUND(M151/1.1,2) -> 0.85 | N152: =ROUND(N151/14.19,2) -> 0.81
A153: 42-7729-05 Scofield-Skyline Mine | B153: 1.15 | C153: 1.25 | D153: 3.86 | E153: 4.03 | F153: 2.84 | G153: 2.81 | H153: 4.26 | I153: 1.96 | J153: 1.91 | K153: 0.44 | L153: 0.41 | M153: 2.17 | N153: =SUM(B153:M153) -> 27.09
A154: % of normal | B154: =ROUND(B153/1.96,2) -> 0.59 | C154: =ROUND(C153/2.4,2) -> 0.52 | D154: =ROUND(D153/2.15,2) -> 1.8 | E154: =ROUND(E153/2.6,2) -> 1.55 | F154: =ROUND(F153/2.72,2) -> 1.04 | G154: =ROUND(G153/2.91,2) -> 0.97 | H154: =ROUND(H153/2.11,2) -> 2.02 | I154: =ROUND(I153/1.69,2) -> 1.16 | J154: =ROUND(J153/1.24,2) -> 1.54 | K154: =ROUND(K153/1.43,2) -> 0.31 | L154: =ROUND(L153/1.32,2) -> 0.31 | M154: =ROUND(M153/2.05,2) -> 1.06 | N154: =ROUND(N153/24.58,2) -> 1.1
A155: 42-7846-05 Silver Lake Brighton | B155: 1.33 | C155: 4.71 | D155: 6.10 | E155: 4.68 | F155: 6.18 | G155: 4.30 | H155: 7.19 | I155: 2.63 | J155: 5.24 | K155: 0.20 | L155: 1.35 | M155: 2.83 | N155: =SUM(B155:M155) -> 46.74
A156: % of normal | B156: =ROUND(B155/3.59,2) -> 0.37 | C156: =ROUND(C155/4.81,2) -> 0.98 | D156: =ROUND(D155/4.63,2) -> 1.32 | E156: =ROUND(E155/5.06,2) -> 0.92 | F156: =ROUND(F155/4.88,2) -> 1.27 | G156: =ROUND(G155/5.28,2) -> 0.81 | H156: =ROUND(H155/4.15,2) -> 1.73 | I156: =ROUND(I155/3.45,2) -> 0.76 | J156: =ROUND(J155/1.52,2) -> 3.45 | K156: =ROUND(K155/1.65,2) -> 0.12 | L156: =ROUND(L155/1.85,2) -> 0.73 | M156: =ROUND(M155/2.55,2) -> 1.11 | N156: =ROUND(N155/43.42,2) -> 1.08
A157: 42-7942-05 Snyderville | B157: 0.75 | C157: 2.05 | D157: 3.51 | E157: 1.98 | F157: 1.76 | G157: 2.25 | H157: 3.17 | I157: 2.48 | J157: 4.63 | K157: 0.20 | L157: 0.55 | M157: 2.24 | N157: =SUM(B157:M157) -> 25.57
A158: Normals not available | B158: NA | C158: NA | D158: NA | E158: NA | F158: NA | G158: NA | H158: NA | I158: NA | J158: NA | K158: NA | L158: NA | M158: NA | N158: NA
A159: 42-8119-03 Spanish Fork Power House | B159: 0.98 | C159: 1.44 | D159: 2.07 | E159: 5.07 | F159: 0.90 | G159: 2.59 | H159: 4.20 | I159: 1.97 | J159: 3.32 | K159: 0.08 | L159: 0.21 | M159: 2.17 | N159: =SUM(B159:M159) -> 25.00
A160: % of normal | B160: =ROUND(B159/2.16,2) -> 0.45 | C160: =ROUND(C159/2.21,2) -> 0.65 | D160: =ROUND(D159/1.78,2) -> 1.16 | E160: =ROUND(E159/1.87,2) -> 2.71 | F160: =ROUND(F159/2.1,2) -> 0.43 | G160: =ROUND(G159/2.35,2) -> 1.1 | H160: =ROUND(H159/2.28,2) -> 1.84 | I160: =ROUND(I159/2.25,2) -> 0.88 | J160: =ROUND(J159/1.09,2) -> 3.05 | K160: =ROUND(K159/0.91,2) -> 0.09 | L160: =ROUND(L159/1.03,2) -> 0.2 | M160: =ROUND(M159/1.52,2) -> 1.43 | N160: =ROUND(N159/21.55,2) -> 1.16
A161: 42-8465-05 Sundance | L161: M | M161: M | N161: =SUM(B161:M161) -> 0.00
A162: Normals not available | B162: NA | C162: NA | D162: NA | E162: NA | F162: NA | G162: NA | H162: NA | I162: NA | J162: NA | K162: NA | L162: NA | M162: NA | N162: NA
A163: 42-8476-07 Sunnyside City | B163: 1.20 | C163: 0.63 | D163: 1.58 | E163: 0.40 | F163: 0.46 | G163: T | H163: 2.08 | I163: 3.39 | J163: 1.44 | K163: 0.70 | L163: 0.60 | M163: 1.20 | N163: =SUM(B163:M163) -> 13.68
A164: % of normal | B164: =ROUND(B163/1.45,2) -> 0.83 | C164: =ROUND(C163/0.57,2) -> 1.11 | D164: =ROUND(D163/0.52,2) -> 3.04 | E164: =ROUND(E163/0.82,2) -> 0.49 | F164: =ROUND(F163/0.78,2) -> 0.59 | G164: 0 | H164: =ROUND(H163/1.09,2) -> 1.91 | I164: =ROUND(I163/1.17,2) -> 2.9 | J164: =ROUND(J163/0.74,2) -> 1.95 | K164: =ROUND(K163/1.42,2) -> 0.49 | L164: =ROUND(L163/1.05,2) -> 0.57 | M164: =ROUND(M163/1.87,2) -> 0.64 | N164: =ROUND(N163/12.56,2) -> 1.09
A165: 42-8733-03 Timpanogos Cave | B165: M | C165: M | D165: 0.27 | E165: 1.78 | F165: 1.60 | G165: 1.14 | H165: 4.40 | I165: 1.91 | J165: 3.34 | K165: M | L165: 0.49 | M165: 0.99 | N165: =SUM(B165:M165) -> 15.92
A166: % of normal | B166: =ROUND(B165/2.54,2) -> ###### | C166: =ROUND(C165/2.02,2) -> ###### | D166: =ROUND(D165/1.96,2) -> 0.14 | E166: =ROUND(E165/2.41,2) -> 0.74 | F166: =ROUND(F165/2.34,2) -> 0.68 | G166: =ROUND(G165/2.82,2) -> 0.4 | H166: =ROUND(H165/2.26,2) -> 1.95 | I166: =ROUND(I165/3.06,2) -> 0.62 | J166: =ROUND(J165/1.48,2) -> 2.26 | K166: =ROUND(K165/1.08,2) -> ##### | L166: =ROUND(L165/1.44,2) -> 0.34 | M166: =ROUND(M165/2.05,2) -> 0.48 | N166: =ROUND(N165/25.46,2) -> 0.63
A167: 42-8973-03 Utah Lake Lehi | B167: M | C167: M | D167: M | E167: M | F167: M | G167: M | H167: M | I167: 1.56 | J167: 1.97 | K167: 0.48 | L167: 0.26 | N167: =SUM(B167:M167) -> 4.27
A168: % of normal | B168: =ROUND(B167/1.33,2) -> ###### | C168: =ROUND(C167/1.13,2) -> ###### | D168: =ROUND(D167/0.69,2) -> ##### | E168: =ROUND(E167/0.98,2) -> ##### | F168: =ROUND(F167/1,2) -> ##### | G168: =ROUND(G167/1.12,2) -> ##### | H168: =ROUND(H167/1.3,2) -> ##### | I168: =ROUND(I167/1.4,2) -> 1.11 | J168: =ROUND(J167/0.66,2) -> 2.98 | K168: =ROUND(K167/0.67,2) -> 0.72 | L168: =ROUND(L167/0.98,2) -> 0.27 | M168: =ROUND(M167/1.15,2) -> 0 | N168: =ROUND(N167/12.41,2) -> 0.34
A169: 42-9165-05 Wanship Dam | B169: 0.66 | C169: 1.75 | D169: 1.21 | E169: 1.28 | F169: 0.49 | G169: 1.48 | H169: 3.14 | I169: 1.48 | J169: 4.56 | K169: 0.50 | L169: 0.56 | M169: 1.39 | N169: =SUM(B169:M169) -> 18.50
A170: % of normal | B170: =ROUND(B169/1.71,2) -> 0.39 | C170: =ROUND(C169/1.68,2) -> 1.04 | D170: =ROUND(D169/1.05,2) -> 1.15 | E170: =ROUND(E169/1.22,2) -> 1.05 | F170: =ROUND(F169/1.08,2) -> 0.45 | G170: =ROUND(G169/1.5,2) -> 0.99 | H170: =ROUND(H169/1.76,2) -> 1.78 | I170: =ROUND(I169/2.02,2) -> 0.73 | J170: =ROUND(J169/1.01,2) -> 4.51 | K170: =ROUND(K169/1.07,2) -> 0.47 | L170: =ROUND(L169/1.03,2) -> 0.54 | M170: =ROUND(M169/1.49,2) -> 0.93 | N170: =ROUND(N169/16.62,2) -> 1.11
A171: 42-9346-03 Weber Basin Pump Plant 3 | B171: 4.34 | C171: M | D171: M | E171: M | F171: M | G171: M | H171: M | I171: M | J171: M | K171: M | L171: M | M171: M | N171: =SUM(B171:M171) -> 4.34
A172: % of normal | B172: 4.34 | C172: =ROUND(C171/2.2,2) -> ###### | D172: =ROUND(D171/2.26,2) -> ##### | E172: =ROUND(E171/2.61,2) -> ##### | F172: =ROUND(F171/2.46,2) -> ##### | G172: =ROUND(G171/2.82,2) -> ##### | H172: =ROUND(H171/2.89,2) -> ##### | I172: =ROUND(I171/3.17,2) -> ##### | J172: =ROUND(J171/1.47,2) -> ##### | K172: =ROUND(K171/1.02,2) -> ##### | L172: NA | M172: =ROUND(M171/1.79,2) -> ##### | N172: =ROUND(N171/26.19,2) -> 0.17
A173: 42-9368-07 Wellington 3E | B173: 1.02 | C173: 0.45 | D173: 0.93 | E173: 0.25 | F173: 0.21 | G173: 0.06 | H173: 0.66 | I173: 1.72 | J173: 1.85 | K173: 0.33 | L173: 0.14 | M173: 0.54 | N173: =SUM(B173:M173) -> 8.16
A174: % of normal | B174: =ROUND(B173/0.88,2) -> 1.16 | C174: =ROUND(C173/0.47,2) -> 0.96 | D174: =ROUND(D173/0.42,2) -> 2.21 | E174: =ROUND(E173/0.58,2) -> 0.43 | F174: =ROUND(F173/0.51,2) -> 0.41 | G174: =ROUND(G173/0.79,2) -> 0.08 | H174: =ROUND(H173/0.68,2) -> 0.97 | I174: =ROUND(I173/0.79,2) -> 2.18 | J174: =ROUND(J173/0.42,2) -> 4.4 | K174: =ROUND(K173/0.84,2) -> 0.39 | L174: =ROUND(L173/0.9,2) -> 0.16 | M174: =ROUND(M173/1.22,2) -> 0.44 | N174: =ROUND(N173/8.5,2) -> 0.96
A175: 42-9382-01 Wendover Ut | B175: 0.21 | C175: 0.00 | D175: 0.00 | E175: 0.00 | F175: 0.02 | G175: 0.00 | H175: 0.15 | I175: 0.40 | J175: 1.10 | K175: 0.06 | L175: 0.00 | M175: 0.48 | N175: =SUM(B175:M175) -> 2.42
A176: % of normal | B176: =ROUND(B175/0.53,2) -> 0.4 | C176: =ROUND(C175/0.27,2) -> 0 | D176: =ROUND(D175/0.16,2) -> 0 | E176: =ROUND(E175/0.31,2) -> 0 | F176: =ROUND(F175/0.26,2) -> 0.08 | G176: =ROUND(G175/0.44,2) -> 0 | H176: =ROUND(H175/0.48,2) -> 0.31 | I176: =ROUND(I175/0.82,2) -> 0.49 | J176: =ROUND(J175/0.38,2) -> 2.89 | K176: =ROUND(K175/0.29,2) -> 0.21 | L176: =ROUND(L175/0.4,2) -> 0 | M176: =ROUND(M175/0.43,2) -> 1.12 | N176: =ROUND(N175/4.77,2) -> 0.51
A177: 48-1736-03 Church Buttes Gas Plant, Wyo | B177: 1.02 | C177: T | D177: T | E177: 0.59 | F177: 0.17 | G177: 0.13 | H177: 1.06 | I177: 0.54 | J177: 4.21 | K177: 0.38 | L177: 0.30 | M177: 0.64 | N177: =SUM(B177:M177) -> 9.04
A178: % of normal | B178: =ROUND(B177/0.68,2) -> 1.5 | C178: 0 | D178: 0 | E178: =ROUND(E177/0.53,2) -> 1.11 | F178: =ROUND(F177/0.31,2) -> 0.55 | G178: =ROUND(G177/0.63,2) -> 0.21 | H178: =ROUND(H177/0.9,2) -> 1.18 | I178: =ROUND(I177/1.15,2) -> 0.47 | J178: =ROUND(J177/0.71,2) -> 5.93 | K178: =ROUND(K177/0.59,2) -> 0.64 | L178: =ROUND(L177/0.67,2) -> 0.45 | M178: =ROUND(M177/0.85,2) -> 0.75 | N178: =ROUND(N177/8.08,2) -> 1.12
A179: 48-3100-03 Evanston 1E, Wyo | B179: 0.48 | C179: 0.41 | D179: 1.55 | E179: 0.00 | F179: 0.29 | G179: 1.52 | H179: 1.95 | I179: 1.27 | J179: 3.15 | K179: 0.60 | L179: 0.65 | N179: =SUM(B179:M179) -> 11.87
A180: % of normal | B180: =ROUND(B179/1.15,2) -> 0.42 | C180: =ROUND(C179/0.84,2) -> 0.49 | D180: =ROUND(D179/0.67,2) -> 2.31 | E180: =ROUND(E179/0.68,2) -> 0 | F180: =ROUND(F179/0.62,2) -> 0.47 | G180: =ROUND(G179/0.89,2) -> 1.71 | H180: =ROUND(H179/1.13,2) -> 1.73 | I180: =ROUND(I179/1.47,2) -> 0.86 | J180: =ROUND(J179/0.96,2) -> 3.28 | K180: =ROUND(K179/0.91,2) -> 0.66 | L180: =ROUND(L179/0.94,2) -> 0.69 | M180: =ROUND(M179/1.27,2) -> 0 | N180: =ROUND(N179/11.53,2) -> 1.03
A181: 48-5703-03 Lonetree No1, Wyo | B181: 0.86 | C181: 0.19 | D181: 0.28 | E181: 0.29 | F181: 0.87 | G181: 0.60 | H181: 1.75 | I181: 0.50 | K181: 1.92 | L181: 0.72 | M181: 0.86 | N181: =SUM(B181:M181) -> 8.84
A182: Normals not available | B182: NA | C182: NA | D182: NA | E182: NA | F182: NA | G182: NA | H182: NA | I182: NA | J182: NA | K182: NA | L182: NA | M182: NA | N182: NA
A183: 48-6555-03 Mountain View, Wyo | B183: 1.00 | C183: 0.15 | D183: 0.27 | E183: 0.55 | F183: 0.26 | G183: 0.57 | H183: 1.67 | I183: 0.76 | J183: 3.08 | K183: 0.77 | L183: 0.66 | M183: 0.95 | N183: =SUM(B183:M183) -> 10.69
A184: % of normal | B184: =ROUND(B183/0.92,2) -> 1.09 | C184: =ROUND(C183/0.61,2) -> 0.25 | D184: =ROUND(D183/0.82,2) -> 0.33 | E184: =ROUND(E183/0.44,2) -> 1.25 | F184: =ROUND(F183/0.37,2) -> 0.7 | G184: =ROUND(G183/0.51,2) -> 1.12 | H184: =ROUND(H183/0.95,2) -> 1.76 | I184: =ROUND(I183/1.25,2) -> 0.61 | J184: =ROUND(J183/0.96,2) -> 3.21 | K184: =ROUND(K183/0.94,2) -> 0.82 | L184: =ROUND(L183/0.87,2) -> 0.76 | M184: =ROUND(M183/1.07,2) -> 0.89 | N184: =ROUND(N183/9.31,2) -> 1.15