A1: Preliminary | B1: Oct | C1: Nov | D1: Dec | E1: Jan | F1: Feb | G1: Mar | H1: Apr | I1: May | J1: Jun | K1: Jul | L1: Aug | M1: Sep | N1: Water Yr
A2: 2006 - 2007 Water Year | B2: 2006 | C2: 2006 | D2: 2006 | E2: 2007 | F2: 2007 | G2: 2007 | H2: 2007 | I2: 2007 | J2: 2007 | K2: 2007 | L2: 2007 | M2: 2007 | N2: Total
A3: 42-0061-03 Alpine | B3: 2.30 | C3: 1.04 | D3: 1.20 | E3: 0.64 | F3: 2.08 | G3: 2.31 | H3: 1.00 | I3: 0.62 | J3: 1.03 | K3: 0.86 | L3: 0.72 | M3: 1.50 | N3: =SUM(B3:M3) -> 15.30
A4: % of normal | B4: =ROUND(B3/1.89,2) -> 1.22 | C4: =ROUND(C3/1.66,2) -> 0.63 | D4: =ROUND(D3/1.67,2) -> 0.72 | E4: =ROUND(E3/1.99,2) -> 0.32 | F4: =ROUND(F3/1.74,2) -> 1.2 | G4: =ROUND(G3/1.92,2) -> 1.2 | H4: =ROUND(H3/1.85,2) -> 0.54 | I4: =ROUND(I3/2.17,2) -> 0.29 | J4: =ROUND(J3/0.88,2) -> 1.17 | K4: =ROUND(K3/0.74,2) -> 1.16 | L4: =ROUND(L3/1,2) -> 0.72 | M4: =ROUND(M3/1.38,2) -> 1.09 | N4: =ROUND(N3/18.89,2) -> 0.81
A5: 42-0072-05 Alta | B5: 4.45 | C5: 3.55 | D5: 2.52 | E5: 1.20 | F5: 5.03 | G5: 3.55 | H5: 1.87 | I5: 1.58 | J5: 1.98 | K5: 1.94 | L5: 1.51 | M5: 3.37 | N5: =SUM(B5:M5) -> 32.55
A6: % of normal | B6: =ROUND(B5/4.08,2) -> 1.09 | C6: =ROUND(C5/5.66,2) -> 0.63 | D6: =ROUND(D5/6.01,2) -> 0.42 | E6: =ROUND(E5/5.99,2) -> 0.2 | F6: =ROUND(F5/5.88,2) -> 0.86 | G6: =ROUND(G5/6.62,2) -> 0.54 | H6: =ROUND(H5/5.34,2) -> 0.35 | I6: =ROUND(I5/4.26,2) -> 0.37 | J6: =ROUND(J5/1.89,2) -> 1.05 | K6: =ROUND(K5/1.75,2) -> 1.11 | L6: =ROUND(L5/1.96,2) -> 0.77 | M6: =ROUND(M5/2.82,2) -> 1.2 | N6: =ROUND(N5/52.26,2) -> 0.62
A7: 42-0074-06 Altamont | B7: 2.52 | C7: 0.32 | D7: 0.35 | E7: 0.42 | F7: 0.66 | G7: 0.05 | H7: 0.08 | I7: 0.69 | J7: 0.00 | K7: 0.28 | L7: 0.80 | M7: 1.59 | N7: =SUM(B7:M7) -> 7.76
A8: % of normal | B8: =ROUND(B7/1.04,2) -> 2.42 | C8: =ROUND(C7/0.62,2) -> 0.52 | D8: =ROUND(D7/0.54,2) -> 0.65 | E8: =ROUND(E7/0.69,2) -> 0.61 | F8: =ROUND(F7/0.64,2) -> 1.03 | G8: =ROUND(G7/0.64,2) -> 0.08 | H8: =ROUND(H7/0.73,2) -> 0.11 | I8: =ROUND(I7/1.01,2) -> 0.68 | J8: =ROUND(J7/0.71,2) -> 0 | K8: =ROUND(K7/0.85,2) -> 0.33 | L8: =ROUND(L7/0.86,2) -> 0.93 | M8: =ROUND(M7/1.07,2) -> 1.49 | N8: =ROUND(N7/9.4,2) -> 0.83
A9: 42-0086-04 Alton | B9: 3.80 | C9: 0.29 | D9: 1.35 | E9: 0.12 | F9: 0.74 | G9: 0.34 | H9: 0.82 | I9: 0.06 | J9: 0.18 | K9: 0.73 | L9: 1.49 | M9: 2.11 | N9: =SUM(B9:M9) -> 12.03
A10: % of normal | B10: =ROUND(B9/1.59,2) -> 2.39 | C10: =ROUND(C9/1.4,2) -> 0.21 | D10: =ROUND(D9/1.19,2) -> 1.13 | E10: =ROUND(E9/1.76,2) -> 0.07 | F10: =ROUND(F9/1.9,2) -> 0.39 | G10: =ROUND(G9/1.75,2) -> 0.19 | H10: =ROUND(H9/0.95,2) -> 0.86 | I10: =ROUND(I9/0.97,2) -> 0.06 | J10: =ROUND(J9/0.51,2) -> 0.35 | K10: =ROUND(K9/1.34,2) -> 0.54 | L10: =ROUND(L9/1.62,2) -> 0.92 | M10: =ROUND(M9/1.53,2) -> 1.38 | N10: =ROUND(N9/16.51,2) -> 0.73
A11: 42-0168-04 Angle | B11: 3.38 | C11: 0.38 | D11: 0.49 | E11: 0.20 | F11: 0.38 | G11: 0.36 | H11: 0.77 | I11: 0.27 | J11: 0.30 | K11: 2.56 | L11: 1.40 | M11: 1.23 | N11: =SUM(B11:M11) -> 11.72
A12: % of normal | B12: =ROUND(B11/0.89,2) -> 3.8 | C12: =ROUND(C11/0.38,2) -> 1 | D12: =ROUND(D11/0.29,2) -> 1.69 | E12: =ROUND(E11/0.48,2) -> 0.42 | F12: =ROUND(F11/0.35,2) -> 1.09 | G12: =ROUND(G11/0.75,2) -> 0.48 | H12: =ROUND(H11/0.69,2) -> 1.12 | I12: =ROUND(I11/0.8,2) -> 0.34 | J12: =ROUND(J11/0.59,2) -> 0.51 | K12: =ROUND(K11/0.9,2) -> 2.84 | L12: =ROUND(L11/1.3,2) -> 1.08 | M12: =ROUND(M11/0.97,2) -> 1.27 | N12: =ROUND(N11/8.39,2) -> 1.4
A13: 42-0688-07 Big Water | B13: 4.85 | C13: 0.05 | D13: 0.53 | E13: 0.15 | F13: 0.30 | G13: 0.30 | H13: 0.92 | I13: 0.33 | K13: 0.22 | L13: 1.12 | M13: 0.62 | N13: =SUM(B13:M13) -> 9.39
A14: % of normal | B14: =ROUND(B13/0.88,2) -> 5.51 | C14: =ROUND(C13/0.42,2) -> 0.12 | D14: =ROUND(D13/0.26,2) -> 2.04 | E14: =ROUND(E13/0.47,2) -> 0.32 | F14: =ROUND(F13/0.56,2) -> 0.54 | G14: =ROUND(G13/0.6,2) -> 0.5 | H14: =ROUND(H13/0.37,2) -> 2.49 | I14: =ROUND(I13/0.31,2) -> 1.06 | J14: =ROUND(J13/0.11,2) -> 0 | K14: =ROUND(K13/0.64,2) -> 0.34 | L14: =ROUND(L13/0.6,2) -> 1.87 | M14: =ROUND(M13/0.55,2) -> 1.13 | N14: =ROUND(N13/5.77,2) -> 1.63
A15: 42-0820-05 Bountiful Val Verda | B15: 2.55 | C15: 1.64 | D15: 1.21 | E15: 1.01 | F15: 2.68 | G15: 1.30 | H15: 1.18 | I15: 1.00 | J15: 1.60 | K15: 1.26 | L15: 0.22 | M15: 2.46 | N15: =SUM(B15:M15) -> 18.11
A16: % of normal | B16: =ROUND(B15/2.18,2) -> 1.17 | C16: =ROUND(C15/1.92,2) -> 0.85 | D16: =ROUND(D15/1.75,2) -> 0.69 | E16: =ROUND(E15/2,2) -> 0.51 | F16: =ROUND(F15/1.84,2) -> 1.46 | G16: =ROUND(G15/2.39,2) -> 0.54 | H16: =ROUND(H15/2.81,2) -> 0.42 | I16: =ROUND(I15/3,2) -> 0.33 | J16: =ROUND(J15/1.15,2) -> 1.39 | K16: =ROUND(K15/0.88,2) -> 1.43 | L16: =ROUND(L15/0.94,2) -> 0.23 | M16: =ROUND(M15/1.54,2) -> 1.6 | N16: =ROUND(N15/22.4,2) -> 0.81
A17: 42-0849-04 Boulder | B17: 5.78 | C17: 0.02 | D17: 0.66 | E17: 0.16 | F17: 0.47 | G17: 0.60 | H17: 0.46 | I17: 0.10 | J17: T | K17: 1.33 | L17: 2.32 | M17: 1.88 | N17: =SUM(B17:M17) -> 13.78
A18: % of normal | B18: =ROUND(B17/1.21,2) -> 4.78 | C18: =ROUND(C17/0.79,2) -> 0.03 | D18: =ROUND(D17/0.58,2) -> 1.14 | E18: =ROUND(E17/0.96,2) -> 0.17 | F18: =ROUND(F17/0.91,2) -> 0.52 | G18: =ROUND(G17/1.02,2) -> 0.59 | H18: =ROUND(H17/0.49,2) -> 0.94 | I18: =ROUND(I17/0.77,2) -> 0.13 | J18: 0 | K18: =ROUND(K17/1.06,2) -> 1.25 | L18: =ROUND(L17/1.5,2) -> 1.55 | M18: =ROUND(M17/1.2,2) -> 1.57 | N18: =ROUND(N17/10.82,2) -> 1.27
A19: 42-1008-04 Bryce Canyon N. P. HQRS | B19: 3.28 | C19: 0.23 | D19: 0.73 | E19: 0.16 | F19: 0.41 | G19: 0.36 | H19: 0.87 | I19: 0.09 | J19: 0.10 | K19: 2.78 | L19: 2.26 | M19: 1.88 | N19: =SUM(B19:M19) -> 13.15
A20: % of normal | B20: =ROUND(B19/1.7,2) -> 1.93 | C20: =ROUND(C19/1.2,2) -> 0.19 | D20: =ROUND(D19/0.97,2) -> 0.75 | E20: =ROUND(E19/1.5,2) -> 0.11 | F20: =ROUND(F19/1.66,2) -> 0.25 | G20: =ROUND(G19/1.64,2) -> 0.22 | H20: =ROUND(H19/0.84,2) -> 1.04 | I20: =ROUND(I19/1.05,2) -> 0.09 | J20: =ROUND(J19/0.6,2) -> 0.17 | K20: =ROUND(K19/1.43,2) -> 1.94 | L20: =ROUND(L19/2.16,2) -> 1.05 | M20: =ROUND(M19/1.65,2) -> 1.14 | N20: =ROUND(N19/16.4,2) -> 0.8
A21: 42-1020-07 Bullfrog Basin | B21: 3.93 | C21: 0.12 | D21: 0.81 | E21: 0.36 | F21: 0.76 | G21: 0.33 | H21: 0.78 | I21: 0.09 | J21: 0.00 | K21: 0.36 | L21: 1.09 | M21: 0.98 | N21: =SUM(B21:M21) -> 9.61
A22: % of normal | B22: =ROUND(B21/0.98,2) -> 4.01 | C22: =ROUND(C21/0.62,2) -> 0.19 | D22: =ROUND(D21/0.43,2) -> 1.88 | E22: =ROUND(E21/0.6,2) -> 0.6 | F22: =ROUND(F21/0.4,2) -> 1.9 | G22: =ROUND(G21/0.63,2) -> 0.52 | H22: =ROUND(H21/0.31,2) -> 2.52 | I22: =ROUND(I21/0.37,2) -> 0.24 | J22: =ROUND(J21/0.13,2) -> 0 | K22: =ROUND(K21/0.37,2) -> 0.97 | L22: =ROUND(L21/0.5,2) -> 2.18 | M22: =ROUND(M21/0.66,2) -> 1.48 | N22: =ROUND(N21/6,2) -> 1.6
A23: 42-1171-07 Capitol Reef N. P. | B23: 5.17 | C23: 0.01 | D23: 0.52 | E23: 0.01 | F23: 0.05 | G23: 0.74 | H23: 0.59 | I23: 0.07 | J23: 0.08 | K23: 0.63 | L23: 1.69 | M23: 0.76 | N23: =SUM(B23:M23) -> 10.32
A24: % of normal | B24: =ROUND(B23/0.76,2) -> 6.8 | C24: =ROUND(C23/0.61,2) -> 0.02 | D24: =ROUND(D23/0.27,2) -> 1.93 | E24: =ROUND(E23/0.52,2) -> 0.02 | F24: =ROUND(F23/0.38,2) -> 0.13 | G24: =ROUND(G23/0.64,2) -> 1.16 | H24: =ROUND(H23/0.52,2) -> 1.13 | I24: =ROUND(I23/0.64,2) -> 0.11 | J24: =ROUND(J23/0.37,2) -> 0.22 | K24: =ROUND(K23/0.95,2) -> 0.66 | L24: =ROUND(L23/1.19,2) -> 1.42 | M24: =ROUND(M23/0.83,2) -> 0.92 | N24: =ROUND(N23/7.68,2) -> 1.34
A25: 42-1214-07 Castledale | B25: 3.80 | C25: 0.01 | D25: 0.43 | E25: 0.40 | F25: 0.01 | G25: 0.24 | H25: 0.52 | I25: 0.40 | J25: 0.05 | K25: 0.43 | L25: 3.04 | M25: 1.22 | N25: =SUM(B25:M25) -> 10.55
A26: % of normal | B26: =ROUND(B25/0.9,2) -> 4.22 | C26: =ROUND(C25/0.52,2) -> 0.02 | D26: =ROUND(D25/0.36,2) -> 1.19 | E26: =ROUND(E25/0.64,2) -> 0.63 | F26: =ROUND(F25/0.57,2) -> 0.02 | G26: =ROUND(G25/0.68,2) -> 0.35 | H26: =ROUND(H25/0.52,2) -> 1 | I26: =ROUND(I25/0.65,2) -> 0.62 | J26: =ROUND(J25/0.41,2) -> 0.12 | K26: =ROUND(K25/0.81,2) -> 0.53 | L26: =ROUND(L25/0.97,2) -> 3.13 | M26: =ROUND(M25/0.86,2) -> 1.42 | N26: =ROUND(N25/7.89,2) -> 1.34
A27: 42-1432-04 Circleville | B27: 2.77 | C27: M | D27: M | E27: M | F27: M | G27: M | H27: 0.33 | I27: 0.12 | J27: 0.60 | K27: 1.49 | L27: 0.49 | M27: 1.20 | N27: =SUM(B27:M27) -> 7.00
A28: % of normal | B28: =ROUND(B27/0.9,2) -> 3.08 | C28: M | D28: M | E28: M | F28: M | G28: M | H28: =ROUND(H27/0.64,2) -> 0.52 | I28: =ROUND(I27/0.9,2) -> 0.13 | J28: =ROUND(J27/0.57,2) -> 1.05 | K28: =ROUND(K27/0.86,2) -> 1.73 | L28: =ROUND(L27/1.42,2) -> 0.35 | M28: =ROUND(M27/0.95,2) -> 1.26 | N28: M
A29: 42-1446-05 City Creek Water Plant | B29: 3.16 | C29: 2.50 | D29: 1.10 | E29: 0.70 | F29: 2.72 | G29: 1.14 | H29: 1.16 | I29: 1.06 | J29: 2.04 | K29: 1.48 | L29: 0.91 | M29: 2.00 | N29: =SUM(B29:M29) -> 19.97
A30: % of normal | B30: =ROUND(B29/2.64,2) -> 1.2 | C30: =ROUND(C29/2.68,2) -> 0.93 | D30: =ROUND(D29/2.52,2) -> 0.44 | E30: =ROUND(E29/2.82,2) -> 0.25 | F30: =ROUND(F29/2.61,2) -> 1.04 | G30: =ROUND(G29/3.35,2) -> 0.34 | H30: =ROUND(H29/3.4,2) -> 0.34 | I30: =ROUND(I29/3.16,2) -> 0.34 | J30: =ROUND(J29/1.42,2) -> 1.44 | K30: =ROUND(K29/1.02,2) -> 1.45 | L30: =ROUND(L29/1.01,2) -> 0.9 | M30: =ROUND(M29/2.21,2) -> 0.9 | N30: =ROUND(N29/28.84,2) -> 0.69
A31: 42-1588-05 Coalville | B31: 2.36 | C31: 2.47 | D31: 1.03 | E31: 0.75 | F31: 1.02 | G31: 1.07 | H31: 0.54 | I31: 0.74 | J31: 0.47 | K31: 0.99 | L31: 0.95 | M31: 1.80 | N31: =SUM(B31:M31) -> 14.19
A32: % of normal | B32: =ROUND(B31/1.61,2) -> 1.47 | C32: =ROUND(C31/1.62,2) -> 1.52 | D32: =ROUND(D31/1.15,2) -> 0.9 | E32: =ROUND(E31/1.31,2) -> 0.57 | F32: =ROUND(F31/1.22,2) -> 0.84 | G32: =ROUND(G31/1.62,2) -> 0.66 | H32: =ROUND(H31/1.84,2) -> 0.29 | I32: =ROUND(I31/2.02,2) -> 0.37 | J32: =ROUND(J31/1.13,2) -> 0.42 | K32: =ROUND(K31/1,2) -> 0.99 | L32: =ROUND(L31/1.08,2) -> 0.88 | M32: =ROUND(M31/1.37,2) -> 1.31 | N32: =ROUND(N31/16.97,2) -> 0.84
A33: 42-1590-05 Coalville 13E | B33: 2.44 | C33: 1.62 | D33: 1.73 | E33: 1.40 | F33: 1.20 | G33: 1.12 | H33: 1.50 | I33: 0.69 | J33: 0.50 | K33: 0.99 | L33: 0.95 | M33: 1.96 | N33: =SUM(B33:M33) -> 16.10
A34: % of normal | B34: =ROUND(B33/1.56,2) -> 1.56 | C34: =ROUND(C33/1.39,2) -> 1.17 | D34: =ROUND(D33/0.88,2) -> 1.97 | E34: =ROUND(E33/0.98,2) -> 1.43 | F34: =ROUND(F33/0.91,2) -> 1.32 | G34: =ROUND(G33/1.36,2) -> 0.82 | H34: =ROUND(H33/1.7,2) -> 0.88 | I34: =ROUND(I33/1.81,2) -> 0.38 | J34: =ROUND(J33/1.01,2) -> 0.5 | K34: =ROUND(K33/1.02,2) -> 0.97 | L34: =ROUND(L33/0.84,2) -> 1.13 | M34: =ROUND(M33/1.5,2) -> 1.31 | N34: =ROUND(N33/14.96,2) -> 1.08
A35: 42-1759-03 Cottonwood Weir | B35: 3.50 | C35: 1.82 | D35: 2.13 | E35: 1.31 | F35: 4.09 | G35: 1.48 | H35: 1.21 | I35: 1.10 | J35: 2.23 | K35: 0.98 | L35: 0.39 | M35: 2.16 | N35: =SUM(B35:M35) -> 22.40
A36: % of normal | B36: =ROUND(B35/2.62,2) -> 1.34 | C36: =ROUND(C35/2.45,2) -> 0.74 | D36: =ROUND(D35/2.03,2) -> 1.05 | E36: =ROUND(E35/2.05,2) -> 0.64 | F36: =ROUND(F35/2.19,2) -> 1.87 | G36: =ROUND(G35/2.92,2) -> 0.51 | H36: =ROUND(H35/3.17,2) -> 0.38 | I36: =ROUND(I35/3.06,2) -> 0.36 | J36: =ROUND(J35/1.27,2) -> 1.76 | K36: =ROUND(K35/1.11,2) -> 0.88 | L36: =ROUND(L35/1.2,2) -> 0.33 | M36: =ROUND(M35/2.12,2) -> 1.02 | N36: =ROUND(N35/26.19,2) -> 0.86
A37: 42-2057-05 Deer Creek Dam | B37: 2.45 | C37: 2.76 | D37: 1.44 | E37: 0.50 | F37: 2.81 | G37: 1.72 | H37: 0.29 | I37: 0.69 | J37: 1.50 | K37: 0.98 | L37: 0.77 | M37: 1.85 | N37: =SUM(B37:M37) -> 17.76
A38: % of normal | B38: =ROUND(B37/2.09,2) -> 1.17 | C38: =ROUND(C37/2.3,2) -> 1.2 | D38: =ROUND(D37/2.32,2) -> 0.62 | E38: =ROUND(E37/3.12,2) -> 0.16 | F38: =ROUND(F37/2.86,2) -> 0.98 | G38: =ROUND(G37/2.42,2) -> 0.71 | H38: =ROUND(H37/1.76,2) -> 0.16 | I38: =ROUND(I37/1.92,2) -> 0.36 | J38: =ROUND(J37/1.01,2) -> 1.49 | K38: =ROUND(K37/0.91,2) -> 1.08 | L38: =ROUND(L37/1.12,2) -> 0.69 | M38: =ROUND(M37/1.58,2) -> 1.17 | N38: =ROUND(N37/23.41,2) -> 0.76
A39: 42-2235-03 Draper - Point of the Mountain | B39: 1.75 | C39: 1.26 | D39: 1.20 | E39: 0.49 | F39: 1.17 | G39: 0.80 | H39: 0.82 | I39: 0.52 | J39: 0.42 | K39: 1.10 | L39: 1.82 | M39: 1.64 | N39: =SUM(B39:M39) -> 12.99
A40: % of normal | B40: =ROUND(B39/1.73,2) -> 1.01 | C40: =ROUND(C39/1.32,2) -> 0.95 | D40: =ROUND(D39/0.96,2) -> 1.25 | E40: =ROUND(E39/1.51,2) -> 0.32 | F40: =ROUND(F39/1.22,2) -> 0.96 | G40: =ROUND(G39/1.58,2) -> 0.51 | H40: =ROUND(H39/1.82,2) -> 0.45 | I40: =ROUND(I39/1.79,2) -> 0.29 | J40: =ROUND(J39/0.85,2) -> 0.49 | K40: =ROUND(K39/0.95,2) -> 1.16 | L40: =ROUND(L39/0.95,2) -> 1.92 | M40: =ROUND(M39/1.08,2) -> 1.52 | N40: =ROUND(N39/15.76,2) -> 0.82
A41: 42-2253-06 Duchesne | B41: 2.17 | C41: 0.46 | D41: 0.47 | E41: 0.52 | F41: 0.15 | G41: 0.29 | H41: 0.33 | I41: 0.38 | J41: T | K41: 0.58 | L41: 1.32 | M41: 1.25 | N41: =SUM(B41:M41) -> 7.92
A42: % of normal | B42: =ROUND(B41/0.94,2) -> 2.31 | C42: =ROUND(C41/0.49,2) -> 0.94 | D42: =ROUND(D41/0.54,2) -> 0.87 | E42: =ROUND(E41/0.51,2) -> 1.02 | F42: =ROUND(F41/0.57,2) -> 0.26 | G42: =ROUND(G41/0.69,2) -> 0.42 | H42: =ROUND(H41/0.9,2) -> 0.37 | I42: =ROUND(I41/1.1,2) -> 0.35 | J42: 0 | K42: =ROUND(K41/1,2) -> 0.58 | L42: =ROUND(L41/1.19,2) -> 1.11 | M42: =ROUND(M41/1.12,2) -> 1.12 | N42: =ROUND(N41/9.73,2) -> 0.81
A43: 42-2385-05 Echo Dam | B43: 2.46 | C43: 1.99 | D43: 0.85 | E43: 0.66 | F43: 0.75 | G43: 0.79 | H43: 0.68 | I43: 0.73 | J43: 0.55 | K43: 1.18 | L43: 1.37 | M43: 1.23 | N43: =SUM(B43:M43) -> 13.24
A44: % of normal | B44: =ROUND(B43/1.52,2) -> 1.62 | C44: =ROUND(C43/1.53,2) -> 1.3 | D44: =ROUND(D43/1.03,2) -> 0.83 | E44: =ROUND(E43/1.14,2) -> 0.58 | F44: =ROUND(F43/1.03,2) -> 0.73 | G44: =ROUND(G43/1.38,2) -> 0.57 | H44: =ROUND(H43/1.52,2) -> 0.45 | I44: =ROUND(I43/1.97,2) -> 0.37 | J44: =ROUND(J43/1.05,2) -> 0.52 | K44: =ROUND(K43/0.85,2) -> 1.39 | L44: =ROUND(L43/0.8,2) -> 1.71 | M44: =ROUND(M43/1.38,2) -> 0.89 | N44: =ROUND(N43/15.2,2) -> 0.87
A45: 42-2424-05 Electric Lake UP&L | B45: 3.49 | C45: 2.52 | D45: 1.06 | E45: 0.43 | F45: 2.48 | G45: 1.80 | H45: 1.40 | I45: 1.44 | J45: 0.73 | K45: 1.70 | L45: 2.18 | M45: 1.62 | N45: =SUM(B45:M45) -> 20.85
A46: % of normal | B46: =ROUND(B45/1.91,2) -> 1.83 | C46: =ROUND(C45/2.23,2) -> 1.13 | D46: =ROUND(D45/2.32,2) -> 0.46 | E46: =ROUND(E45/2.78,2) -> 0.15 | F46: =ROUND(F45/2.69,2) -> 0.92 | G46: =ROUND(G45/2.75,2) -> 0.65 | H46: =ROUND(H45/2.2,2) -> 0.64 | I46: =ROUND(I45/1.92,2) -> 0.75 | J46: =ROUND(J45/1.16,2) -> 0.63 | K46: =ROUND(K45/1.16,2) -> 1.47 | L46: =ROUND(L45/1.61,2) -> 1.35 | M46: =ROUND(M45/1.74,2) -> 0.93 | N46: =ROUND(N45/24.47,2) -> 0.85
A47: 42-2578-04 Ephraim Sorensens Field | B47: 2.81 | C47: 0.76 | D47: 0.87 | E47: 0.29 | F47: 0.45 | G47: 0.42 | H47: 0.65 | I47: 0.91 | J47: 0.24 | K47: 0.55 | L47: 1.27 | M47: 1.08 | N47: =SUM(B47:M47) -> 10.30
A48: % of normal | B48: =ROUND(B47/1.34,2) -> 2.1 | C48: =ROUND(C47/1.1,2) -> 0.69 | D48: =ROUND(D47/0.88,2) -> 0.99 | E48: =ROUND(E47/1.01,2) -> 0.29 | F48: =ROUND(F47/1.08,2) -> 0.42 | G48: =ROUND(G47/1.39,2) -> 0.3 | H48: =ROUND(H47/1.14,2) -> 0.57 | I48: =ROUND(I47/1.29,2) -> 0.71 | J48: =ROUND(J47/0.67,2) -> 0.36 | K48: =ROUND(K47/0.76,2) -> 0.72 | L48: =ROUND(L47/0.85,2) -> 1.49 | M48: =ROUND(M47/1.19,2) -> 0.91 | N48: =ROUND(N47/12.7,2) -> 0.81
A49: 42-2592-04 Escalante | B49: 4.70 | C49: 0.08 | D49: 0.41 | E49: 0.03 | F49: 0.06 | G49: 0.36 | H49: 0.33 | I49: 0.17 | J49: 0.23 | K49: 2.48 | L49: 1.15 | M49: 1.01 | N49: =SUM(B49:M49) -> 11.01
A50: % of normal | B50: =ROUND(B49/1.16,2) -> 4.05 | C50: =ROUND(C49/0.77,2) -> 0.1 | D50: =ROUND(D49/0.54,2) -> 0.76 | E50: =ROUND(E49/0.9,2) -> 0.03 | F50: =ROUND(F49/0.79,2) -> 0.08 | G50: =ROUND(G49/0.92,2) -> 0.39 | H50: =ROUND(H49/0.49,2) -> 0.67 | I50: =ROUND(I49/0.65,2) -> 0.26 | J50: =ROUND(J49/0.37,2) -> 0.62 | K50: =ROUND(K49/0.76,2) -> 3.26 | L50: =ROUND(L49/1.52,2) -> 0.76 | M50: =ROUND(M49/1.12,2) -> 0.9 | N50: =ROUND(N49/9.99,2) -> 1.1
A51: 42-2696-03 Fairfield | B51: 1.92 | C51: 0.25 | D51: 0.76 | E51: 0.74 | F51: 0.83 | G51: 0.95 | H51: 0.21 | I51: 0.20 | J51: 0.23 | K51: 0.37 | L51: 0.24 | M51: 1.08 | N51: =SUM(B51:M51) -> 7.78
A52: % of normal | B52: =ROUND(B51/1.31,2) -> 1.47 | C52: =ROUND(C51/1.04,2) -> 0.24 | D52: =ROUND(D51/0.84,2) -> 0.9 | E52: =ROUND(E51/1.15,2) -> 0.64 | F52: =ROUND(F51/1.17,2) -> 0.71 | G52: =ROUND(G51/1.19,2) -> 0.8 | H52: =ROUND(H51/1.16,2) -> 0.18 | I52: =ROUND(I51/1.29,2) -> 0.16 | J52: =ROUND(J51/0.72,2) -> 0.32 | K52: =ROUND(K51/1.09,2) -> 0.34 | L52: =ROUND(L51/1.09,2) -> 0.22 | M52: =ROUND(M51/1.06,2) -> 1.02 | N52: =ROUND(N51/13.11,2) -> 0.59
A53: 42-2702-05 Fairview 8N | B53: 2.21 | C53: 1.29 | D53: 0.79 | E53: 0.25 | F53: 1.52 | G53: 1.04 | H53: 1.00 | I53: 1.09 | J53: 0.65 | K53: 0.64 | L53: 1.28 | M53: 2.73 | N53: =SUM(B53:M53) -> 14.49
A54: % of normal | B54: =ROUND(B53/1.66,2) -> 1.33 | C54: =ROUND(C53/1.41,2) -> 0.91 | D54: =ROUND(D53/1.27,2) -> 0.62 | E54: =ROUND(E53/1.58,2) -> 0.16 | F54: =ROUND(F53/1.45,2) -> 1.05 | G54: =ROUND(G53/1.58,2) -> 0.66 | H54: =ROUND(H53/1.2,2) -> 0.83 | I54: =ROUND(I53/1.77,2) -> 0.62 | J54: =ROUND(J53/1.02,2) -> 0.64 | K54: =ROUND(K53/1.02,2) -> 0.63 | L54: =ROUND(L53/1.22,2) -> 1.05 | M54: =ROUND(M53/1.51,2) -> 1.81 | N54: =ROUND(N53/16.69,2) -> 0.87
A55: 42-2726-03 Farmington 3NW | B55: 1.99 | C55: 1.82 | D55: 0.83 | E55: 0.74 | F55: 1.85 | G55: 1.34 | H55: 1.25 | I55: 1.02 | J55: 2.42 | K55: 0.19 | L55: 0.41 | M55: 3.17 | N55: =SUM(B55:M55) -> 17.03
A56: % of normal | B56: =ROUND(B55/2.15,2) -> 0.93 | C56: =ROUND(C55/2.03,2) -> 0.9 | D56: =ROUND(D55/1.89,2) -> 0.44 | E56: =ROUND(E55/2.18,2) -> 0.34 | F56: =ROUND(F55/2.08,2) -> 0.89 | G56: =ROUND(G55/2.62,2) -> 0.51 | H56: =ROUND(H55/2.68,2) -> 0.47 | I56: =ROUND(I55/2.98,2) -> 0.34 | J56: =ROUND(J55/1.27,2) -> 1.91 | K56: =ROUND(K55/0.92,2) -> 0.21 | L56: =ROUND(L55/0.88,2) -> 0.47 | M56: =ROUND(M55/1.58,2) -> 2.01 | N56: =ROUND(N55/23.26,2) -> 0.73
A57: 42-2798-07 Ferron | B57: 4.71 | C57: 0.02 | D57: 0.37 | E57: 0.20 | F57: T | G57: 0.42 | H57: 0.39 | I57: 0.41 | J57: 0.07 | K57: 0.74 | L57: 0.90 | M57: 1.66 | N57: =SUM(B57:M57) -> 9.89
A58: % of normal | B58: =ROUND(B57/0.98,2) -> 4.81 | C58: =ROUND(C57/0.57,2) -> 0.04 | D58: =ROUND(D57/0.39,2) -> 0.95 | E58: =ROUND(E57/0.66,2) -> 0.3 | F58: 0 | G58: =ROUND(G57/0.74,2) -> 0.57 | H58: =ROUND(H57/0.51,2) -> 0.76 | I58: =ROUND(I57/0.74,2) -> 0.55 | J58: =ROUND(J57/0.41,2) -> 0.17 | K58: =ROUND(K57/1.04,2) -> 0.71 | L58: =ROUND(L57/0.97,2) -> 0.93 | M58: =ROUND(M57/1.02,2) -> 1.63 | N58: =ROUND(N57/8.67,2) -> 1.14
A59: 42-3012-04 Fremont Indian State Park | B59: 5.18 | C59: 0.66 | D59: 1.22 | E59: 0.37 | F59: 0.48 | G59: 0.28 | H59: 1.30 | I59: 0.63 | J59: 0.35 | K59: 0.47 | L59: 0.79 | M59: 1.12 | N59: =SUM(B59:M59) -> 12.85
A60: % of normal | B60: =ROUND(B59/1.38,2) -> 3.75 | C60: =ROUND(C59/0.79,2) -> 0.84 | D60: =ROUND(D59/0.65,2) -> 1.88 | E60: =ROUND(E59/0.78,2) -> 0.47 | F60: =ROUND(F59/0.78,2) -> 0.62 | G60: =ROUND(G59/1.02,2) -> 0.27 | H60: =ROUND(H59/1,2) -> 1.3 | I60: =ROUND(I59/1.12,2) -> 0.56 | J60: =ROUND(J59/0.75,2) -> 0.47 | K60: =ROUND(K59/1.05,2) -> 0.45 | L60: =ROUND(L59/1.69,2) -> 0.47 | M60: =ROUND(M59/0.93,2) -> 1.2 | N60: =ROUND(N59/11.94,2) -> 1.08
A61: 42-3097-03 Garfield | B61: 1.75 | C61: 1.26 | D61: 1.01 | E61: 0.94 | F61: 1.65 | G61: 1.14 | H61: 0.45 | I61: 1.38 | J61: 1.20 | K61: 1.08 | L61: 1.08 | M61: 1.82 | N61: =SUM(B61:M61) -> 14.76
A62: % of normal | B62: =ROUND(B61/1.98,2) -> 0.88 | C62: =ROUND(C61/1.73,2) -> 0.73 | D62: =ROUND(D61/1.2,2) -> 0.84 | E62: =ROUND(E61/1.3,2) -> 0.72 | F62: =ROUND(F61/1.38,2) -> 1.2 | G62: =ROUND(G61/1.98,2) -> 0.58 | H62: =ROUND(H61/2.22,2) -> 0.2 | I62: =ROUND(I61/2.43,2) -> 0.57 | J62: =ROUND(J61/0.95,2) -> 1.26 | K62: =ROUND(K61/1.03,2) -> 1.05 | L62: =ROUND(L61/0.93,2) -> 1.16 | M62: =ROUND(M61/1.63,2) -> 1.12 | N62: =ROUND(N61/18.76,2) -> 0.79
A63: 42-3254-07 Goblin Valley State Park | B63: 5.00 | C63: 0.04 | D63: 0.16 | E63: 0.08 | F63: T | G63: 0.24 | H63: 0.81 | I63: 0.06 | J63: T | K63: 0.11 | L63: 0.56 | M63: 0.02 | N63: =SUM(B63:M63) -> 7.08
A64: Normals not available | B64: NA | C64: NA | D64: NA | E64: NA | F64: NA | G64: NA | H64: NA | I64: NA | J64: NA | K64: NA | L64: NA | M64: NA | N64: NA
A65: 42-3418-07 Green River Aviation | B65: 4.03 | C65: 0.03 | D65: 0.18 | E65: 0.10 | F65: T | G65: 0.50 | H65: 0.80 | I65: 0.20 | J65: 0.00 | K65: 0.70 | L65: 1.70 | M65: 0.79 | N65: =SUM(B65:M65) -> 9.03
A66: % of normal | B66: =ROUND(B65/0.98,2) -> 4.11 | C66: =ROUND(C65/0.46,2) -> 0.07 | D66: =ROUND(D65/0.32,2) -> 0.56 | E66: =ROUND(E65/0.5,2) -> 0.2 | F66: 0 | G66: =ROUND(G65/0.67,2) -> 0.75 | H66: =ROUND(H65/0.6,2) -> 1.33 | I66: =ROUND(I65/0.65,2) -> 0.31 | J66: =ROUND(J65/0.34,2) -> 0 | K66: =ROUND(K65/0.76,2) -> 0.92 | L66: =ROUND(L65/0.68,2) -> 2.5 | M66: =ROUND(M65/0.72,2) -> 1.1 | N66: =ROUND(N65/7.11,2) -> 1.27
A67: 42-3600-07 Hans Flat Ranger Station | B67: 5.04 | C67: 0.83 | D67: 0.38 | E67: 0.89 | F67: 0.87 | G67: 1.02 | H67: 1.38 | I67: 0.70 | J67: 0.03 | K67: 1.10 | L67: 1.42 | M67: 0.86 | N67: =SUM(B67:M67) -> 14.52
A68: % of normal | B68: =ROUND(B67/1.18,2) -> 4.27 | C68: =ROUND(C67/0.78,2) -> 1.06 | D68: =ROUND(D67/0.54,2) -> 0.7 | E68: =ROUND(E67/0.66,2) -> 1.35 | F68: =ROUND(F67/0.47,2) -> 1.85 | G68: =ROUND(G67/0.81,2) -> 1.26 | H68: =ROUND(H67/0.64,2) -> 2.16 | I68: =ROUND(I67/0.61,2) -> 1.15 | J68: =ROUND(J67/0.44,2) -> 0.07 | K68: =ROUND(K67/1.16,2) -> 0.95 | L68: =ROUND(L67/0.96,2) -> 1.48 | M68: =ROUND(M67/0.91,2) -> 0.95 | N68: =ROUND(N67/9.16,2) -> 1.59
A69: 42-3611-07 Hanksville | B69: 5.70 | C69: 0.08 | D69: 0.14 | E69: 0.09 | F69: 0.28 | G69: 0.31 | H69: 0.53 | I69: 0.03 | J69: T | K69: 0.32 | L69: 0.72 | M69: 0.55 | N69: =SUM(B69:M69) -> 8.75
A70: % of normal | B70: =ROUND(B69/0.71,2) -> 8.03 | C70: =ROUND(C69/0.41,2) -> 0.2 | D70: =ROUND(D69/0.27,2) -> 0.52 | E70: =ROUND(E69/0.5,2) -> 0.18 | F70: =ROUND(F69/0.25,2) -> 1.12 | G70: =ROUND(G69/0.55,2) -> 0.56 | H70: =ROUND(H69/0.45,2) -> 1.18 | I70: =ROUND(I69/0.52,2) -> 0.06 | J70: 0 | K70: =ROUND(K69/0.49,2) -> 0.65 | L70: =ROUND(L69/0.55,2) -> 1.31 | M70: =ROUND(M69/0.79,2) -> 0.7 | N70: =ROUND(N69/5.72,2) -> 1.53
A71: 42-3776-04 Hatch | B71: 2.41 | C71: 0.12 | D71: 1.21 | E71: 0.46 | F71: 0.76 | G71: 0.68 | H71: 0.97 | I71: 0.16 | J71: 0.07 | K71: 1.25 | L71: 2.53 | M71: 1.59 | N71: =SUM(B71:M71) -> 12.21
A72: % of normal | B72: =ROUND(B71/1.26,2) -> 1.91 | C72: =ROUND(C71/0.96,2) -> 0.13 | D72: =ROUND(D71/0.66,2) -> 1.83 | E72: =ROUND(E71/0.86,2) -> 0.53 | F72: =ROUND(F71/1.07,2) -> 0.71 | G72: =ROUND(G71/1.18,2) -> 0.58 | H72: =ROUND(H71/0.72,2) -> 1.35 | I72: =ROUND(I71/0.89,2) -> 0.18 | J72: =ROUND(J71/0.55,2) -> 0.13 | K72: =ROUND(K71/1.25,2) -> 1 | L72: =ROUND(L71/1.69,2) -> 1.5 | M72: =ROUND(M71/1.17,2) -> 1.36 | N72: =ROUND(N71/12.26,2) -> 1
A73: 42-3809-05 Heber | B73: 1.17 | C73: 1.01 | D73: 0.95 | E73: 0.12 | F73: 1.62 | G73: 0.78 | H73: 0.14 | I73: 0.35 | J73: 0.14 | K73: 0.75 | L73: 0.25 | M73: 2.04 | N73: =SUM(B73:M73) -> 9.32
A74: % of normal | B74: =ROUND(B73/1.62,2) -> 0.72 | C74: =ROUND(C73/1.5,2) -> 0.67 | D74: =ROUND(D73/1.39,2) -> 0.68 | E74: =ROUND(E73/1.86,2) -> 0.06 | F74: =ROUND(F73/1.71,2) -> 0.95 | G74: =ROUND(G73/1.47,2) -> 0.53 | H74: =ROUND(H73/1.28,2) -> 0.11 | I74: =ROUND(I73/1.48,2) -> 0.24 | J74: =ROUND(J73/0.84,2) -> 0.17 | K74: =ROUND(K73/0.83,2) -> 0.9 | L74: =ROUND(L73/0.97,2) -> 0.26 | M74: =ROUND(M73/1.27,2) -> 1.61 | N74: =ROUND(N73/16.22,2) -> 0.57
A75: 42-3836-05 Helper-Carbon UP&L | B75: 2.82 | C75: 1.28 | D75: T | E75: T | F75: 0.11 | G75: 0.34 | H75: 1.78 | I75: 0.35 | J75: T | K75: 0.45 | L75: 1.03 | M75: 0.75 | N75: =SUM(B75:M75) -> 8.91
A76: % of normal | B76: =ROUND(B75/1.64,2) -> 1.72 | C76: =ROUND(C75/0.94,2) -> 1.36 | D76: 0 | E76: 0 | F76: =ROUND(F75/1.27,2) -> 0.09 | G76: =ROUND(G75/1.48,2) -> 0.23 | H76: =ROUND(H75/1.09,2) -> 1.63 | I76: =ROUND(I75/1.03,2) -> 0.34 | J76: 0 | K76: =ROUND(K75/1,2) -> 0.45 | L76: =ROUND(L75/1.2,2) -> 0.86 | M76: =ROUND(M75/1.58,2) -> 0.47 | N76: =ROUND(N75/13.77,2) -> 0.65
A77: 42-3980-07 Hite Ranger Station | B77: 4.36 | C77: 0.11 | D77: 0.12 | E77: M | F77: M | G77: M | H77: 0.35 | I77: 0.00 | J77: 0.00 | K77: 1.26 | L77: 0.55 | M77: 0.92 | N77: =SUM(B77:M77) -> 7.67
A78: % of normal | B78: =ROUND(B77/1.33,2) -> 3.28 | C78: =ROUND(C77/0.67,2) -> 0.16 | D78: =ROUND(D77/0.55,2) -> 0.22 | E78: M | F78: M | G78: M | H78: =ROUND(H77/0.49,2) -> 0.71 | I78: =ROUND(I77/0.47,2) -> 0 | J78: =ROUND(J77/0.26,2) -> 0 | K78: =ROUND(K77/0.63,2) -> 2 | L78: =ROUND(L77/0.46,2) -> 1.2 | M78: =ROUND(M77/0.8,2) -> 1.15 | N78: M
A79: 42-4135-05 Huntsville Monastery | B79: 1.24 | C79: 2.02 | D79: 0.85 | E79: 0.68 | F79: 2.45 | G79: 1.22 | H79: 0.80 | I79: 0.60 | J79: 0.73 | K79: 0.91 | L79: 0.70 | M79: 1.32 | N79: =SUM(B79:M79) -> 13.52
A80: % of normal | B80: =ROUND(B79/1.97,2) -> 0.63 | C80: =ROUND(C79/2.2,2) -> 0.92 | D80: =ROUND(D79/2.06,2) -> 0.41 | E80: =ROUND(E79/2.64,2) -> 0.26 | F80: =ROUND(F79/2.1,2) -> 1.17 | G80: =ROUND(G79/2.21,2) -> 0.55 | H80: =ROUND(H79/2.01,2) -> 0.4 | I80: =ROUND(I79/2.21,2) -> 0.27 | J80: =ROUND(J79/1.29,2) -> 0.57 | K80: =ROUND(K79/0.87,2) -> 1.05 | L80: =ROUND(L79/0.84,2) -> 0.83 | M80: =ROUND(M79/1.69,2) -> 0.78 | N80: =ROUND(N79/22.09,2) -> 0.61
A81: 42-4467-05 Kamas | B81: 2.32 | C81: 1.94 | D81: 0.98 | E81: 0.83 | F81: 1.42 | G81: 1.10 | H81: 0.95 | I81: 1.06 | J81: 1.25 | K81: 1.54 | L81: 0.64 | M81: 1.99 | N81: =SUM(B81:M81) -> 16.02
A82: % of normal | B82: =ROUND(B81/1.74,2) -> 1.33 | C82: =ROUND(C81/1.52,2) -> 1.28 | D82: =ROUND(D81/1.28,2) -> 0.77 | E82: =ROUND(E81/1.58,2) -> 0.53 | F82: =ROUND(F81/1.45,2) -> 0.98 | G82: =ROUND(G81/1.59,2) -> 0.69 | H82: =ROUND(H81/1.55,2) -> 0.61 | I82: =ROUND(I81/1.64,2) -> 0.65 | J82: =ROUND(J81/0.94,2) -> 1.33 | K82: =ROUND(K81/1.06,2) -> 1.45 | L82: =ROUND(L81/1.06,2) -> 0.6 | M82: =ROUND(M81/1.48,2) -> 1.34 | N82: =ROUND(N81/16.89,2) -> 0.95
A83: 42-4508-04 Kanab | B83: 2.12 | C83: 0.20 | D83: 0.63 | E83: 0.25 | F83: 0.37 | G83: 0.24 | H83: 1.02 | I83: 0.03 | J83: 0.03 | K83: 0.49 | L83: 1.65 | M83: 1.52 | N83: =SUM(B83:M83) -> 8.55
A84: % of normal | B84: =ROUND(B83/1.35,2) -> 1.57 | C84: =ROUND(C83/1.18,2) -> 0.17 | D84: =ROUND(D83/1.01,2) -> 0.62 | E84: =ROUND(E83/1.86,2) -> 0.13 | F84: =ROUND(F83/1.73,2) -> 0.21 | G84: =ROUND(G83/1.91,2) -> 0.13 | H84: =ROUND(H83/0.95,2) -> 1.07 | I84: =ROUND(I83/0.68,2) -> 0.04 | J84: =ROUND(J83/0.4,2) -> 0.08 | K84: =ROUND(K83/1.05,2) -> 0.47 | L84: =ROUND(L83/1.45,2) -> 1.14 | M84: =ROUND(M83/1.37,2) -> 1.11 | N84: =ROUND(N83/14.94,2) -> 0.57
A85: 42-4755-04 Kodachrome Basin Park | B85: 3.58 | C85: 0.08 | D85: 0.52 | E85: 0.23 | F85: 0.23 | G85: 0.28 | H85: 0.62 | I85: 0.09 | J85: 0.02 | K85: 0.40 | L85: 2.97 | M85: 1.06 | N85: =SUM(B85:M85) -> 10.08
A86: % of normal | B86: =ROUND(B85/1.34,2) -> 2.67 | C86: =ROUND(C85/0.72,2) -> 0.11 | D86: =ROUND(D85/0.63,2) -> 0.83 | E86: =ROUND(E85/1.03,2) -> 0.22 | F86: =ROUND(F85/1.12,2) -> 0.21 | G86: =ROUND(G85/1.12,2) -> 0.25 | H86: =ROUND(H85/0.66,2) -> 0.94 | I86: =ROUND(I85/0.67,2) -> 0.13 | J86: =ROUND(J85/0.37,2) -> 0.05 | K86: =ROUND(K85/1.02,2) -> 0.39 | L86: =ROUND(L85/1.57,2) -> 1.89 | M86: =ROUND(M85/1.2,2) -> 0.88 | N86: =ROUND(N85/11.45,2) -> 0.88
A87: 42-4764-04 Koosharem | B87: 3.31 | C87: 0.48 | D87: 0.63 | E87: 0.15 | F87: 0.20 | G87: 0.57 | H87: 0.50 | I87: 0.39 | J87: 0.36 | K87: 2.58 | L87: 1.10 | M87: 1.21 | N87: =SUM(B87:M87) -> 11.48
A88: % of normal | B88: =ROUND(B87/0.97,2) -> 3.41 | C88: =ROUND(C87/0.56,2) -> 0.86 | D88: =ROUND(D87/0.51,2) -> 1.24 | E88: =ROUND(E87/0.64,2) -> 0.23 | F88: =ROUND(F87/0.57,2) -> 0.35 | G88: =ROUND(G87/0.78,2) -> 0.73 | H88: =ROUND(H87/0.6,2) -> 0.83 | I88: =ROUND(I87/0.88,2) -> 0.44 | J88: =ROUND(J87/0.59,2) -> 0.61 | K88: =ROUND(K87/1.08,2) -> 2.39 | L88: =ROUND(L87/1.35,2) -> 0.81 | M88: =ROUND(M87/0.96,2) -> 1.26 | N88: =ROUND(N87/9.49,2) -> 1.21
A89: 42-4970-03 Layton | B89: 2.10 | C89: 1.62 | D89: 0.81 | E89: 0.63 | F89: 1.70 | G89: 1.00 | H89: 0.90 | I89: 0.86 | J89: 2.17 | K89: T | L89: 0.29 | M89: 1.59 | N89: =SUM(B89:M89) -> 13.67
A90: Normals not available | B90: NA | C90: NA | D90: NA | E90: NA | F90: NA | G90: NA | H90: NA | I90: NA | J90: NA | K90: NA | L90: NA | M90: NA | N90: NA
A91: 42-5148-04 Loa | B91: 2.96 | C91: 0.27 | D91: 0.16 | E91: T | F91: 0.09 | G91: 0.38 | H91: 0.55 | I91: 0.22 | J91: 0.20 | K91: 1.17 | L91: 2.54 | M91: 0.76 | N91: =SUM(B91:M91) -> 9.30
A92: % of normal | B92: =ROUND(B91/0.73,2) -> 4.05 | C92: =ROUND(C91/0.37,2) -> 0.73 | D92: =ROUND(D91/0.27,2) -> 0.59 | E92: 0 | F92: =ROUND(F91/0.32,2) -> 0.28 | G92: =ROUND(G91/0.55,2) -> 0.69 | H92: =ROUND(H91/0.44,2) -> 1.25 | I92: =ROUND(I91/0.82,2) -> 0.27 | J92: =ROUND(J91/0.57,2) -> 0.35 | K92: =ROUND(K91/0.89,2) -> 1.31 | L92: =ROUND(L91/1.39,2) -> 1.83 | M92: =ROUND(M91/0.94,2) -> 0.81 | N92: =ROUND(N91/7.75,2) -> 1.2
A93: 42-5186-03 Logan Utah State Univ | B93: 2.17 | C93: 1.50 | D93: 0.60 | E93: 0.34 | F93: 2.40 | G93: 1.28 | H93: 0.89 | I93: 1.36 | J93: 1.48 | K93: 0.41 | L93: 1.06 | M93: 1.09 | N93: =SUM(B93:M93) -> 14.58
A94: % of normal | B94: =ROUND(B93/2.06,2) -> 1.05 | C94: =ROUND(C93/1.56,2) -> 0.96 | D94: =ROUND(D93/1.58,2) -> 0.38 | E94: =ROUND(E93/1.56,2) -> 0.22 | F94: =ROUND(F93/1.61,2) -> 1.49 | G94: =ROUND(G93/2.15,2) -> 0.6 | H94: =ROUND(H93/2.12,2) -> 0.42 | I94: =ROUND(I93/2.39,2) -> 0.57 | J94: =ROUND(J93/1.34,2) -> 1.1 | K94: =ROUND(K93/0.98,2) -> 0.42 | L94: =ROUND(L93/0.98,2) -> 1.08 | M94: =ROUND(M93/1.56,2) -> 0.7 | N94: =ROUND(N93/19.89,2) -> 0.73
A95: 42-5194-03 Logan 5SW Exp Farm | B95: 1.48 | C95: 1.41 | D95: 0.52 | E95: 0.19 | F95: 1.93 | G95: 1.49 | H95: 0.85 | I95: 1.23 | J95: 0.74 | K95: 0.64 | L95: 0.56 | M95: 1.15 | N95: =SUM(B95:M95) -> 12.19
A96: % of normal | B96: =ROUND(B95/1.89,2) -> 0.78 | C96: =ROUND(C95/1.54,2) -> 0.92 | D96: =ROUND(D95/1.48,2) -> 0.35 | E96: =ROUND(E95/1.67,2) -> 0.11 | F96: =ROUND(F95/1.69,2) -> 1.14 | G96: =ROUND(G95/1.86,2) -> 0.8 | H96: =ROUND(H95/1.96,2) -> 0.43 | I96: =ROUND(I95/2.17,2) -> 0.57 | J96: =ROUND(J95/1.26,2) -> 0.59 | K96: =ROUND(K95/0.88,2) -> 0.73 | L96: =ROUND(L95/0.95,2) -> 0.59 | M96: =ROUND(M95/1.44,2) -> 0.8 | N96: =ROUND(N95/18.79,2) -> 0.65
A97: 42-5402-04 Manti | B97: 2.54 | C97: 0.55 | D97: 0.60 | E97: 0.52 | F97: 0.75 | G97: 0.38 | H97: 0.95 | I97: 1.21 | J97: 0.51 | K97: 0.41 | L97: 1.28 | M97: 1.27 | N97: =SUM(B97:M97) -> 10.97
A98: % of normal | B98: =ROUND(B97/1.45,2) -> 1.75 | C98: =ROUND(C97/1.15,2) -> 0.48 | D98: =ROUND(D97/0.91,2) -> 0.66 | E98: =ROUND(E97/1.08,2) -> 0.48 | F98: =ROUND(F97/1.07,2) -> 0.7 | G98: =ROUND(G97/1.46,2) -> 0.26 | H98: =ROUND(H97/1.31,2) -> 0.73 | I98: =ROUND(I97/1.52,2) -> 0.8 | J98: =ROUND(J97/0.77,2) -> 0.66 | K98: =ROUND(K97/0.79,2) -> 0.52 | L98: =ROUND(L97/0.89,2) -> 1.44 | M98: =ROUND(M97/1.31,2) -> 0.97 | N98: =ROUND(N97/13.71,2) -> 0.8
A99: 42-5477-04 Marysvale | B99: 2.42 | C99: 0.73 | D99: 0.62 | E99: 0.55 | F99: 0.77 | G99: 0.08 | H99: 0.85 | I99: 0.13 | J99: 0.20 | K99: 0.78 | L99: 0.52 | M99: 0.72 | N99: =SUM(B99:M99) -> 8.37
A100: % of normal | B100: =ROUND(B99/0.87,2) -> 2.78 | C100: =ROUND(C99/0.59,2) -> 1.24 | D100: =ROUND(D99/0.44,2) -> 1.41 | E100: =ROUND(E99/0.59,2) -> 0.93 | F100: =ROUND(F99/0.54,2) -> 1.43 | G100: =ROUND(G99/0.76,2) -> 0.11 | H100: =ROUND(H99/0.61,2) -> 1.39 | I100: =ROUND(I99/0.75,2) -> 0.17 | J100: =ROUND(J99/0.44,2) -> 0.45 | K100: =ROUND(K99/0.76,2) -> 1.03 | L100: =ROUND(L99/1,2) -> 0.52 | M100: =ROUND(M99/0.8,2) -> 0.9 | N100: =ROUND(N99/8.15,2) -> 1.03
A101: 42-5826-05 Morgan Power & Light | B101: 1.76 | C101: 2.35 | D101: 0.82 | E101: 0.52 | F101: 1.55 | G101: 1.06 | H101: 1.02 | I101: 1.29 | J101: 1.02 | K101: 0.84 | L101: 0.47 | M101: 1.33 | N101: =SUM(B101:M101) -> 14.03
A102: % of normal | B102: =ROUND(B101/1.71,2) -> 1.03 | C102: =ROUND(C101/1.85,2) -> 1.27 | D102: =ROUND(D101/1.58,2) -> 0.52 | E102: =ROUND(E101/1.85,2) -> 0.28 | F102: =ROUND(F101/1.77,2) -> 0.88 | G102: =ROUND(G101/1.88,2) -> 0.56 | H102: =ROUND(H101/2.1,2) -> 0.49 | I102: =ROUND(I101/2.03,2) -> 0.64 | J102: =ROUND(J101/1.13,2) -> 0.9 | K102: =ROUND(K101/0.75,2) -> 1.12 | L102: =ROUND(L101/0.83,2) -> 0.57 | M102: =ROUND(M101/1.54,2) -> 0.86 | N102: =ROUND(N101/19.02,2) -> 0.74
A103: 42-5837-04 Moroni | B103: 1.68 | C103: 0.61 | D103: 0.83 | E103: 0.18 | F103: 0.73 | G103: 0.53 | H103: 0.99 | I103: 1.20 | J103: 0.12 | K103: 0.42 | M103: 0.75 | N103: =SUM(B103:M103) -> 8.04
A104: % of normal | B104: =ROUND(B103/1.07,2) -> 1.57 | C104: =ROUND(C103/0.86,2) -> 0.71 | D104: =ROUND(D103/0.83,2) -> 1 | E104: =ROUND(E103/0.93,2) -> 0.19 | F104: =ROUND(F103/0.9,2) -> 0.81 | G104: =ROUND(G103/0.97,2) -> 0.55 | H104: =ROUND(H103/0.69,2) -> 1.43 | I104: =ROUND(I103/0.86,2) -> 1.4 | J104: =ROUND(J103/0.54,2) -> 0.22 | K104: =ROUND(K103/0.73,2) -> 0.58 | L104: =ROUND(L103/0.81,2) -> 0 | M104: =ROUND(M103/0.93,2) -> 0.81 | N104: =ROUND(N103/10.12,2) -> 0.79
A105: 42-5892-05 Mountain Dell Dam | B105: 3.57 | C105: 2.13 | D105: 0.92 | E105: 0.56 | F105: 2.62 | G105: 1.63 | H105: 2.23 | I105: 0.99 | J105: 2.86 | K105: 0.41 | L105: 0.69 | M105: 2.95 | N105: =SUM(B105:M105) -> 21.56
A106: % of normal | B106: =ROUND(B105/2.65,2) -> 1.35 | C106: =ROUND(C105/2.12,2) -> 1 | D106: =ROUND(D105/1.99,2) -> 0.46 | E106: =ROUND(E105/1.97,2) -> 0.28 | F106: =ROUND(F105/1.96,2) -> 1.34 | G106: =ROUND(G105/2.5,2) -> 0.65 | H106: =ROUND(H105/2.47,2) -> 0.9 | I106: =ROUND(I105/2.74,2) -> 0.36 | J106: =ROUND(J105/1.39,2) -> 2.06 | K106: =ROUND(K105/1.08,2) -> 0.38 | L106: =ROUND(L105/1.14,2) -> 0.61 | M106: =ROUND(M105/2.03,2) -> 1.45 | N106: =ROUND(N105/24.04,2) -> 0.9
A107: 42-5969-06 Myton | B107: 1.59 | C107: 0.15 | D107: 0.22 | E107: 0.31 | F107: 0.30 | G107: 0.22 | H107: 0.16 | I107: 0.47 | J107: 0.00 | K107: 0.25 | L107: 0.51 | M107: 2.80 | N107: =SUM(B107:M107) -> 6.98
A108: % of normal | B108: =ROUND(B107/0.88,2) -> 1.81 | C108: =ROUND(C107/0.41,2) -> 0.37 | D108: =ROUND(D107/0.25,2) -> 0.88 | E108: =ROUND(E107/0.34,2) -> 0.91 | F108: =ROUND(F107/0.34,2) -> 0.88 | G108: =ROUND(G107/0.5,2) -> 0.44 | H108: =ROUND(H107/0.72,2) -> 0.22 | I108: =ROUND(I107/0.93,2) -> 0.51 | J108: =ROUND(J107/0.55,2) -> 0 | K108: =ROUND(K107/0.61,2) -> 0.41 | L108: =ROUND(L107/0.72,2) -> 0.71 | M108: =ROUND(M107/0.79,2) -> 3.54 | N108: =ROUND(N107/7.04,2) -> 0.99
A109: 42-6123-06 Neola | B109: 3.20 | C109: 0.54 | D109: 0.18 | E109: 0.16 | F109: 0.36 | G109: T | H109: 0.24 | I109: 0.50 | J109: 0.00 | K109: 0.70 | L109: 0.55 | M109: 1.73 | N109: =SUM(B109:M109) -> 8.16
A110: % of normal | B110: =ROUND(B109/1.19,2) -> 2.69 | C110: =ROUND(C109/0.6,2) -> 0.9 | D110: =ROUND(D109/0.42,2) -> 0.43 | E110: =ROUND(E109/0.57,2) -> 0.28 | F110: =ROUND(F109/0.54,2) -> 0.67 | G110: 0 | H110: =ROUND(H109/0.81,2) -> 0.3 | I110: =ROUND(I109/1.17,2) -> 0.43 | J110: =ROUND(J109/0.67,2) -> 0 | K110: =ROUND(K109/0.75,2) -> 0.93 | L110: =ROUND(L109/0.84,2) -> 0.65 | M110: =ROUND(M109/1.1,2) -> 1.57 | N110: =ROUND(N109/9.3,2) -> 0.88
A111: 42-6404-03 Ogden Pioneer PH | B111: 1.81 | C111: 2.05 | D111: 0.46 | E111: 0.58 | F111: 1.95 | G111: 1.69 | H111: 0.83 | I111: 0.50 | J111: 2.15 | K111: 0.09 | L111: 0.76 | M111: 2.00 | N111: =SUM(B111:M111) -> 14.87
A112: % of normal | B112: =ROUND(B111/2.27,2) -> 0.8 | C112: =ROUND(C111/2.01,2) -> 1.02 | D112: =ROUND(D111/1.97,2) -> 0.23 | E112: =ROUND(E111/2.32,2) -> 0.25 | F112: =ROUND(F111/2.13,2) -> 0.92 | G112: =ROUND(G111/2.44,2) -> 0.69 | H112: =ROUND(H111/2.45,2) -> 0.34 | I112: =ROUND(I111/2.9,2) -> 0.17 | J112: =ROUND(J111/1.47,2) -> 1.46 | K112: =ROUND(K111/0.94,2) -> 0.1 | L112: =ROUND(L111/1.02,2) -> 0.75 | M112: =ROUND(M111/1.75,2) -> 1.14 | N112: =ROUND(N111/23.67,2) -> 0.63
A113: 42-6414-03 Ogden Sugar Factory | B113: 1.10 | C113: 1.60 | D113: 0.60 | E113: 0.45 | F113: 1.55 | G113: 1.32 | I113: 0.50 | N113: =SUM(B113:M113) -> 7.12
A114: % of normal | B114: =ROUND(B113/1.91,2) -> 0.58 | C114: =ROUND(C113/1.59,2) -> 1.01 | D114: =ROUND(D113/1.37,2) -> 0.44 | E114: =ROUND(E113/1.72,2) -> 0.26 | F114: =ROUND(F113/1.54,2) -> 1.01 | G114: =ROUND(G113/1.95,2) -> 0.68 | H114: 0 | I114: =ROUND(I113/2.23,2) -> 0.22 | J114: 0 | K114: 0 | L114: 0 | M114: =ROUND(M113/1.41,2) -> 0 | N114: =ROUND(N113/18.42,2) -> 0.39
A115: 42-6534-04 Orderville | B115: 2.86 | C115: 0.10 | D115: 1.09 | E115: 0.15 | F115: 1.06 | G115: 0.50 | H115: 0.88 | I115: 0.06 | J115: 0.04 | K115: 0.68 | L115: 2.09 | M115: 1.36 | N115: =SUM(B115:M115) -> 10.87
A116: % of normal | B116: =ROUND(B115/1.27,2) -> 2.25 | C116: =ROUND(C115/1.21,2) -> 0.08 | D116: =ROUND(D115/1.08,2) -> 1.01 | E116: =ROUND(E115/1.82,2) -> 0.08 | F116: =ROUND(F115/1.91,2) -> 0.55 | G116: =ROUND(G115/2.05,2) -> 0.24 | H116: =ROUND(H115/0.98,2) -> 0.9 | I116: =ROUND(I115/0.89,2) -> 0.07 | J116: =ROUND(J115/0.58,2) -> 0.07 | K116: =ROUND(K115/1.15,2) -> 0.59 | L116: =ROUND(L115/1.65,2) -> 1.27 | M116: =ROUND(M115/1.15,2) -> 1.18 | N116: =ROUND(N115/15.74,2) -> 0.69
A117: 42-6538-03 Orem Treatment Plant | B117: 1.63 | C117: 0.88 | D117: 0.63 | E117: 0.47 | F117: 1.16 | G117: 0.98 | H117: 0.58 | I117: 0.63 | J117: 0.54 | K117: 0.23 | L117: 0.27 | M117: 1.00 | N117: =SUM(B117:M117) -> 9.00
A118: % of normal | B118: =ROUND(B117/1.49,2) -> 1.09 | C118: =ROUND(C117/1.03,2) -> 0.85 | D118: =ROUND(D117/0.79,2) -> 0.8 | E118: =ROUND(E117/1.22,2) -> 0.39 | F118: =ROUND(F117/1.11,2) -> 1.05 | G118: =ROUND(G117/1.15,2) -> 0.85 | H118: =ROUND(H117/1.3,2) -> 0.45 | I118: =ROUND(I117/1.38,2) -> 0.46 | J118: =ROUND(J117/0.78,2) -> 0.69 | K118: =ROUND(K117/0.67,2) -> 0.34 | L118: =ROUND(L117/0.77,2) -> 0.35 | M118: =ROUND(M117/1.15,2) -> 0.87 | N118: =ROUND(N117/12.84,2) -> 0.7
A119: 42-6601-04 Panguitch | B119: M | C119: M | D119: M | E119: M | F119: M | G119: M | H119: M | I119: M | J119: M | K119: M | L119: M | M119: M | N119: M
A120: % of normal | B120: M | C120: M | D120: M | E120: M | F120: M | G120: M | H120: M | I120: M | J120: M | K120: M | L120: M | M120: M | N120: M
A121: 42-6640-04 Paria Ranger Station | B121: 4.17 | C121: 0.15 | D121: 0.23 | E121: 0.14 | F121: 0.39 | G121: M | H121: M | I121: 0.39 | J121: 0.00 | K121: 0.38 | L121: 0.94 | M121: 0.57 | N121: =SUM(B121:M121) -> 7.36
A122: Normals not available | B122: NA | C122: NA | D122: NA | E122: NA | F122: NA | G122: NA | H122: NA | I122: NA | J122: NA | K122: NA | L122: NA | M122: NA | N122: NA
A123: 42-6644-05 Park City | B123: 2.78 | C123: 2.22 | D123: 1.39 | E123: 0.65 | F123: 4.04 | G123: 1.19 | H123: 1.16 | I123: 0.73 | J123: 0.93 | K123: 1.97 | L123: 1.33 | M123: 1.81 | N123: =SUM(B123:M123) -> 20.20
A124: Normals not available | B124: NA | C124: NA | D124: NA | E124: NA | F124: NA | G124: NA | H124: NA | I124: NA | J124: NA | K124: NA | L124: NA | M124: NA | N124: NA
A125: 42-6869-05 Pine View Dam | B125: 2.93 | C125: 3.33 | D125: 1.40 | E125: 0.77 | F125: 3.66 | G125: 2.04 | H125: 2.19 | I125: 1.19 | J125: 1.89 | K125: 0.31 | L125: 1.76 | M125: 2.44 | N125: =SUM(B125:M125) -> 23.91
A126: % of normal | B126: =ROUND(B125/2.91,2) -> 1.01 | C126: =ROUND(C125/3.15,2) -> 1.06 | D126: =ROUND(D125/3.34,2) -> 0.42 | E126: =ROUND(E125/3.89,2) -> 0.2 | F126: =ROUND(F125/3.25,2) -> 1.13 | G126: =ROUND(G125/3.45,2) -> 0.59 | H126: =ROUND(H125/2.94,2) -> 0.74 | I126: =ROUND(I125/3.4,2) -> 0.35 | J126: =ROUND(J125/1.74,2) -> 1.09 | K126: =ROUND(K125/1.15,2) -> 0.27 | L126: =ROUND(L125/1.13,2) -> 1.56 | M126: =ROUND(M125/2.03,2) -> 1.2 | N126: =ROUND(N125/32.38,2) -> 0.74
A127: 42-6919-03 Pleasant Grove | B127: 2.12 | C127: 1.26 | D127: 1.00 | E127: 0.38 | F127: 1.54 | G127: 1.58 | H127: 0.71 | I127: 0.67 | J127: 1.27 | K127: 0.25 | L127: 0.53 | M127: 1.21 | N127: =SUM(B127:M127) -> 12.52
A128: % of normal | B128: =ROUND(B127/1.78,2) -> 1.19 | C128: =ROUND(C127/1.51,2) -> 0.83 | D128: =ROUND(D127/1.44,2) -> 0.69 | E128: =ROUND(E127/1.84,2) -> 0.21 | F128: =ROUND(F127/1.76,2) -> 0.88 | G128: =ROUND(G127/1.87,2) -> 0.84 | H128: =ROUND(H127/1.65,2) -> 0.43 | I128: =ROUND(I127/1.85,2) -> 0.36 | J128: =ROUND(J127/0.9,2) -> 1.41 | K128: =ROUND(K127/0.86,2) -> 0.29 | L128: =ROUND(L127/0.88,2) -> 0.6 | M128: =ROUND(M127/1.32,2) -> 0.92 | N128: =ROUND(N127/17.66,2) -> 0.71
A129: 42-7026-07 Price BLM | B129: 2.46 | C129: 0.11 | D129: 0.42 | E129: 0.21 | F129: 0.14 | G129: 0.11 | H129: 0.46 | I129: 0.44 | J129: 0.00 | K129: 0.03 | L129: 0.88 | M129: 1.79 | N129: =SUM(B129:M129) -> 7.05
A130: % of normal | B130: =ROUND(B129/1.24,2) -> 1.98 | C130: =ROUND(C129/0.6,2) -> 0.18 | D130: =ROUND(D129/0.48,2) -> 0.88 | E130: =ROUND(E129/0.76,2) -> 0.28 | F130: =ROUND(F129/0.8,2) -> 0.18 | G130: =ROUND(G129/0.79,2) -> 0.14 | H130: =ROUND(H129/0.59,2) -> 0.78 | I130: =ROUND(I129/0.8,2) -> 0.55 | J130: =ROUND(J129/0.55,2) -> 0 | K130: =ROUND(K129/0.89,2) -> 0.03 | L130: =ROUND(L129/1.1,2) -> 0.8 | M130: =ROUND(M129/1.14,2) -> 1.57 | N130: =ROUND(N129/9.74,2) -> 0.72
A131: 42-7064-03 Provo BYU | B131: 1.90 | C131: 0.85 | D131: 1.56 | E131: 0.69 | F131: 1.77 | G131: 1.45 | H131: 0.93 | I131: 1.26 | J131: 1.05 | K131: 0.28 | L131: 0.41 | M131: 1.70 | N131: =SUM(B131:M131) -> 13.85
A132: % of normal | B132: =ROUND(B131/2.03,2) -> 0.94 | C132: =ROUND(C131/1.79,2) -> 0.47 | D132: =ROUND(D131/1.65,2) -> 0.95 | E132: =ROUND(E131/2.13,2) -> 0.32 | F132: =ROUND(F131/1.93,2) -> 0.92 | G132: =ROUND(G131/2.02,2) -> 0.72 | H132: =ROUND(H131/1.85,2) -> 0.5 | I132: =ROUND(I131/2.03,2) -> 0.62 | J132: =ROUND(J131/1.13,2) -> 0.93 | K132: =ROUND(K131/0.89,2) -> 0.31 | L132: =ROUND(L131/1.14,2) -> 0.36 | M132: =ROUND(M131/1.54,2) -> 1.1 | N132: =ROUND(N131/20.13,2) -> 0.69
A133: 42-7260-04 Richfield Radio KSVC | B133: 2.80 | C133: 0.44 | D133: 0.53 | E133: 0.25 | F133: 0.38 | G133: 0.01 | H133: 0.53 | I133: 0.39 | J133: 0.16 | K133: 0.11 | L133: 0.85 | M133: 0.82 | N133: =SUM(B133:M133) -> 7.27
A134: % of normal | B134: =ROUND(B133/0.99,2) -> 2.83 | C134: =ROUND(C133/0.65,2) -> 0.68 | D134: =ROUND(D133/0.45,2) -> 1.18 | E134: =ROUND(E133/0.62,2) -> 0.4 | F134: =ROUND(F133/0.5,2) -> 0.76 | G134: =ROUND(G133/0.77,2) -> 0.01 | H134: =ROUND(H133/0.63,2) -> 0.84 | I134: =ROUND(I133/1.04,2) -> 0.38 | J134: =ROUND(J133/0.59,2) -> 0.27 | K134: =ROUND(K133/0.72,2) -> 0.15 | L134: =ROUND(L133/0.69,2) -> 1.23 | M134: =ROUND(M133/0.86,2) -> 0.95 | N134: =ROUND(N133/8.51,2) -> 0.85
A135: 42-7557-04 Salina | B135: 4.06 | C135: 0.56 | D135: 1.00 | E135: 0.26 | F135: 0.77 | G135: 1.01 | H135: 1.28 | I135: 1.59 | J135: 0.68 | K135: 0.43 | L135: 1.61 | M135: 1.37 | N135: =SUM(B135:M135) -> 14.62
A136: % of normal | B136: =ROUND(B135/1.03,2) -> 3.94 | C136: =ROUND(C135/0.81,2) -> 0.69 | D136: =ROUND(D135/0.58,2) -> 1.72 | E136: =ROUND(E135/0.69,2) -> 0.38 | F136: =ROUND(F135/0.64,2) -> 1.2 | G136: =ROUND(G135/1.18,2) -> 0.86 | H136: =ROUND(H135/0.93,2) -> 1.38 | I136: =ROUND(I135/1.14,2) -> 1.39 | J136: =ROUND(J135/0.5,2) -> 1.36 | K136: =ROUND(K135/0.63,2) -> 0.68 | L136: =ROUND(L135/0.75,2) -> 2.15 | M136: =ROUND(M135/1,2) -> 1.37 | N136: =ROUND(N135/9.88,2) -> 1.48
A137: 42-7559-04 Salina 24E | B137: 4.44 | C137: 0.52 | D137: 0.75 | E137: 0.07 | F137: 0.54 | G137: 0.60 | H137: 0.45 | I137: 0.34 | J137: 0.20 | K137: 0.60 | L137: 0.95 | M137: 1.12 | N137: =SUM(B137:M137) -> 10.58
A138: % of normal | B138: =ROUND(B137/1.36,2) -> 3.26 | C138: =ROUND(C137/1.01,2) -> 0.51 | D138: =ROUND(D137/0.85,2) -> 0.88 | E138: =ROUND(E137/1.03,2) -> 0.07 | F138: =ROUND(F137/0.9,2) -> 0.6 | G138: =ROUND(G137/1.25,2) -> 0.48 | H138: =ROUND(H137/1.01,2) -> 0.45 | I138: =ROUND(I137/1.2,2) -> 0.28 | J138: =ROUND(J137/0.79,2) -> 0.25 | K138: =ROUND(K137/1.39,2) -> 0.43 | L138: =ROUND(L137/1.71,2) -> 0.56 | M138: =ROUND(M137/1.69,2) -> 0.66 | N138: =ROUND(N137/14.19,2) -> 0.75
A139: 42-7598-03 Salt Lake City Intl Airport | B139: 1.02 | C139: 1.13 | D139: 0.91 | E139: 0.73 | F139: 1.53 | G139: 1.11 | H139: 0.53 | I139: 0.57 | J139: 0.80 | K139: 0.53 | L139: 0.10 | M139: 1.74 | N139: =SUM(B139:M139) -> 10.70
A140: % of normal | B140: =ROUND(B139/1.57,2) -> 0.65 | C140: =ROUND(C139/1.4,2) -> 0.81 | D140: =ROUND(D139/1.23,2) -> 0.74 | E140: =ROUND(E139/1.37,2) -> 0.53 | F140: =ROUND(F139/1.33,2) -> 1.15 | G140: =ROUND(G139/1.91,2) -> 0.58 | H140: =ROUND(H139/2.02,2) -> 0.26 | I140: =ROUND(I139/2.09,2) -> 0.27 | J140: =ROUND(J139/0.77,2) -> 1.04 | K140: =ROUND(K139/0.72,2) -> 0.74 | L140: =ROUND(L139/0.76,2) -> 0.13 | M140: =ROUND(M139/1.33,2) -> 1.31 | N140: =ROUND(N139/16.5,2) -> 0.65
A141: 42-7606-03 Salt Lake Triad Center | B141: 1.15 | C141: 1.09 | D141: 1.13 | E141: 0.62 | F141: 1.77 | G141: 1.25 | H141: 0.55 | I141: 0.74 | J141: 1.00 | K141: 0.36 | L141: 0.07 | M141: 1.74 | N141: =SUM(B141:M141) -> 11.47
A142: % of normal | B142: =ROUND(B141/1.69,2) -> 0.68 | C142: =ROUND(C141/1.65,2) -> 0.66 | D142: =ROUND(D141/1.26,2) -> 0.9 | E142: =ROUND(E141/1.58,2) -> 0.39 | F142: =ROUND(F141/1.63,2) -> 1.09 | G142: =ROUND(G141/2.02,2) -> 0.62 | H142: =ROUND(H141/2.18,2) -> 0.25 | I142: =ROUND(I141/2.31,2) -> 0.32 | J142: =ROUND(J141/0.84,2) -> 1.19 | K142: =ROUND(K141/0.71,2) -> 0.51 | L142: =ROUND(L141/0.64,2) -> 0.11 | M142: =ROUND(M141/1.24,2) -> 1.4 | N142: =ROUND(N141/17.75,2) -> 0.65
A143: 42-7686-03 Santaquin Chlorinator | B143: 3.16 | C143: 0.62 | D143: 1.81 | E143: 0.95 | F143: 2.00 | G143: 1.30 | H143: 0.50 | I143: 1.66 | J143: 0.80 | K143: 0.45 | L143: 0.67 | M143: 1.24 | N143: =SUM(B143:M143) -> 15.16
A144: % of normal | B144: =ROUND(B143/2.06,2) -> 1.53 | C144: =ROUND(C143/1.8,2) -> 0.34 | D144: =ROUND(D143/1.33,2) -> 1.36 | E144: =ROUND(E143/1.54,2) -> 0.62 | F144: =ROUND(F143/1.58,2) -> 1.27 | G144: =ROUND(G143/1.91,2) -> 0.68 | H144: =ROUND(H143/1.94,2) -> 0.26 | I144: =ROUND(I143/2.09,2) -> 0.79 | J144: =ROUND(J143/0.83,2) -> 0.96 | K144: =ROUND(K143/0.74,2) -> 0.61 | L144: =ROUND(L143/0.98,2) -> 0.68 | M144: =ROUND(M143/1.42,2) -> 0.87 | N144: =ROUND(N143/18.22,2) -> 0.83
A145: 42-7729-05 Scofield-Skyline Mine | B145: 4.19 | C145: 2.24 | D145: 1.01 | E145: 0.54 | F145: 2.81 | G145: 2.13 | H145: 2.21 | I145: 1.66 | J145: 0.76 | K145: 1.41 | L145: 2.38 | M145: 2.03 | N145: =SUM(B145:M145) -> 23.37
A146: % of normal | B146: =ROUND(B145/1.96,2) -> 2.14 | C146: =ROUND(C145/2.4,2) -> 0.93 | D146: =ROUND(D145/2.15,2) -> 0.47 | E146: =ROUND(E145/2.6,2) -> 0.21 | F146: =ROUND(F145/2.72,2) -> 1.03 | G146: =ROUND(G145/2.91,2) -> 0.73 | H146: =ROUND(H145/2.11,2) -> 1.05 | I146: 1.66E-2 | J146: =ROUND(J145/1.24,2) -> 0.61 | K146: =ROUND(K145/1.43,2) -> 0.99 | L146: =ROUND(L145/1.32,2) -> 1.8 | M146: =ROUND(M145/2.05,2) -> 0.99 | N146: =ROUND(N145/24.58,2) -> 0.95
A147: 42-7846-05 Silver Lake Brighton | B147: 4.97 | C147: 4.81 | D147: 2.92 | E147: 1.47 | F147: 5.15 | G147: 2.44 | H147: 2.25 | I147: 1.47 | J147: 1.39 | K147: 1.01 | L147: 3.52 | M147: 2.60 | N147: =SUM(B147:M147) -> 34.00
A148: % of normal | B148: =ROUND(B147/3.59,2) -> 1.38 | C148: =ROUND(C147/4.81,2) -> 1 | D148: =ROUND(D147/4.63,2) -> 0.63 | E148: =ROUND(E147/5.06,2) -> 0.29 | F148: =ROUND(F147/4.88,2) -> 1.06 | G148: =ROUND(G147/5.28,2) -> 0.46 | H148: =ROUND(H147/4.15,2) -> 0.54 | I148: =ROUND(I147/3.45,2) -> 0.43 | J148: =ROUND(J147/1.52,2) -> 0.91 | K148: =ROUND(K147/1.65,2) -> 0.61 | L148: =ROUND(L147/1.85,2) -> 1.9 | M148: =ROUND(M147/2.55,2) -> 1.02 | N148: =ROUND(N147/43.42,2) -> 0.78
A149: 42-7909-05 Snake Creek Powerhouse | B149: 1.25 | C149: 1.94 | D149: 2.34 | E149: 0.45 | F149: 2.54 | G149: 1.52 | H149: 0.49 | I149: 0.49 | J149: 0.78 | K149: 0.41 | L149: 0.92 | M149: 1.76 | N149: =SUM(B149:M149) -> 14.89
A150: % of normal | B150: =ROUND(B149/1.92,2) -> 0.65 | C150: =ROUND(C149/2.23,2) -> 0.87 | D150: =ROUND(D149/2.32,2) -> 1.01 | E150: =ROUND(E149/2.88,2) -> 0.16 | F150: =ROUND(F149/2.67,2) -> 0.95 | G150: =ROUND(G149/1.9,2) -> 0.8 | H150: =ROUND(H149/1.61,2) -> 0.3 | I150: =ROUND(I149/1.89,2) -> 0.26 | J150: =ROUND(J149/0.91,2) -> 0.86 | K150: =ROUND(K149/1.08,2) -> 0.38 | L150: =ROUND(L149/1.2,2) -> 0.77 | M150: =ROUND(M149/1.52,2) -> 1.16 | N150: =ROUND(N149/22.13,2) -> 0.67
A151: 42-7942-05 Snyderville | B151: 2.54 | C151: 2.70 | D151: 1.76 | E151: 0.75 | F151: 2.60 | G151: 1.24 | H151: 1.12 | I151: 0.52 | J151: 0.88 | K151: 1.54 | L151: 1.02 | M151: 1.82 | N151: =SUM(B151:M151) -> 18.49
A152: Normals not available | B152: NA | C152: NA | D152: NA | E152: NA | F152: NA | G152: NA | H152: NA | I152: NA | J152: NA | K152: NA | L152: NA | M152: NA | N152: NA
A153: 42-8119-03 Spanish Fork Power House | B153: 2.73 | C153: 1.22 | D153: 0.98 | E153: 1.18 | F153: 2.79 | G153: 1.17 | H153: 0.41 | I153: 1.17 | J153: 1.29 | K153: 0.14 | L153: 0.64 | M153: 2.31 | N153: =SUM(B153:M153) -> 16.03
A154: % of normal | B154: =ROUND(B153/2.16,2) -> 1.26 | C154: =ROUND(C153/2.21,2) -> 0.55 | D154: =ROUND(D153/1.78,2) -> 0.55 | E154: =ROUND(E153/1.87,2) -> 0.63 | F154: =ROUND(F153/2.1,2) -> 1.33 | G154: =ROUND(G153/2.35,2) -> 0.5 | H154: =ROUND(H153/2.28,2) -> 0.18 | I154: =ROUND(I153/2.25,2) -> 0.52 | J154: =ROUND(J153/1.09,2) -> 1.18 | K154: =ROUND(K153/0.91,2) -> 0.15 | L154: =ROUND(L153/1.03,2) -> 0.62 | M154: =ROUND(M153/1.52,2) -> 1.52 | N154: =ROUND(N153/21.55,2) -> 0.74
A155: 42-8465-05 Sundance | B155: 3.61 | C155: 3.86 | D155: 2.49 | E155: 1.01 | F155: 5.95 | G155: 3.50 | H155: 1.65 | I155: 1.31 | J155: 3.25 | K155: 0.63 | L155: 0.73 | M155: 1.98 | N155: =SUM(B155:M155) -> 29.97
A156: Normals not available | B156: NA | C156: NA | D156: NA | E156: NA | F156: NA | G156: NA | H156: NA | I156: NA | J156: NA | K156: NA | L156: NA | M156: NA | N156: NA
A157: 42-8478-07 Sunnyside City Center | B157: 4.80 | C157: 0.39 | D157: 0.35 | E157: 0.34 | F157: 0.57 | G157: 0.32 | H157: 0.86 | I157: 1.31 | J157: 0.00 | K157: 1.73 | L157: 2.68 | M157: 2.45 | N157: =SUM(B157:M157) -> 15.80
A158: % of normal | B158: =ROUND(B157/1.45,2) -> 3.31 | C158: =ROUND(C157/0.57,2) -> 0.68 | D158: =ROUND(D157/0.52,2) -> 0.67 | E158: =ROUND(E157/0.82,2) -> 0.41 | F158: =ROUND(F157/0.78,2) -> 0.73 | G158: =ROUND(G157/1.08,2) -> 0.3 | H158: =ROUND(H157/1.09,2) -> 0.79 | I158: =ROUND(I157/1.17,2) -> 1.12 | J158: =ROUND(J157/0.74,2) -> 0 | K158: =ROUND(K157/1.42,2) -> 1.22 | L158: =ROUND(L157/1.05,2) -> 2.55 | M158: =ROUND(M157/1.87,2) -> 1.31 | N158: =ROUND(N157/12.56,2) -> 1.26
A159: 42-8733-03 Timpanogos Cave | B159: 2.64 | C159: 1.26 | D159: 0.71 | E159: 0.27 | F159: 1.84 | G159: 1.72 | H159: 1.09 | I159: 0.59 | J159: 1.57 | K159: 0.35 | L159: 0.54 | M159: 1.15 | N159: =SUM(B159:M159) -> 13.73
A160: % of normal | B160: =ROUND(B159/2.54,2) -> 1.04 | C160: =ROUND(C159/2.02,2) -> 0.62 | D160: =ROUND(D159/1.96,2) -> 0.36 | E160: =ROUND(E159/2.41,2) -> 0.11 | F160: =ROUND(F159/2.34,2) -> 0.79 | G160: =ROUND(G159/2.82,2) -> 0.61 | H160: =ROUND(H159/2.26,2) -> 0.48 | I160: =ROUND(I159/3.06,2) -> 0.19 | J160: =ROUND(J159/1.48,2) -> 1.06 | K160: =ROUND(K159/1.08,2) -> 0.32 | L160: =ROUND(L159/1.44,2) -> 0.38 | M160: =ROUND(M159/2.05,2) -> 0.56 | N160: =ROUND(N159/25.46,2) -> 0.54
A161: 42-8973-03 Utah Lake Lehi | B161: 1.84 | C161: 0.40 | D161: 0.98 | E161: 0.48 | F161: 1.25 | G161: 1.26 | H161: 0.36 | I161: 0.63 | K161: 0.17 | L161: 0.82 | M161: 1.24 | N161: =SUM(B161:M161) -> 9.43
A162: % of normal | B162: =ROUND(B161/1.33,2) -> 1.38 | C162: =ROUND(C161/1.13,2) -> 0.35 | D162: =ROUND(D161/0.69,2) -> 1.42 | E162: =ROUND(E161/0.98,2) -> 0.49 | F162: =ROUND(F161/1,2) -> 1.25 | G162: =ROUND(G161/1.12,2) -> 1.13 | H162: =ROUND(H161/1.3,2) -> 0.28 | I162: =ROUND(I161/1.4,2) -> 0.45 | J162: =ROUND(J161/0.66,2) -> 0 | K162: =ROUND(K161/0.67,2) -> 0.25 | L162: =ROUND(L161/0.98,2) -> 0.84 | M162: =ROUND(M161/1.15,2) -> 1.08 | N162: =ROUND(N161/12.41,2) -> 0.76
A163: 42-9165-05 Wanship Dam | B163: 2.09 | C163: 2.13 | D163: 0.90 | E163: 0.66 | F163: 0.94 | G163: 1.11 | H163: 0.80 | I163: 0.73 | J163: 0.74 | K163: 1.19 | L163: 1.20 | M163: 2.57 | N163: =SUM(B163:M163) -> 15.06
A164: % of normal | B164: =ROUND(B163/1.71,2) -> 1.22 | C164: =ROUND(C163/1.68,2) -> 1.27 | D164: =ROUND(D163/1.05,2) -> 0.86 | E164: =ROUND(E163/1.22,2) -> 0.54 | F164: =ROUND(F163/1.08,2) -> 0.87 | G164: =ROUND(G163/1.5,2) -> 0.74 | H164: =ROUND(H163/1.76,2) -> 0.45 | I164: =ROUND(I163/2.02,2) -> 0.36 | J164: =ROUND(J163/1.01,2) -> 0.73 | K164: =ROUND(K163/1.07,2) -> 1.11 | L164: =ROUND(L163/1.03,2) -> 1.17 | M164: =ROUND(M163/1.49,2) -> 1.72 | N164: =ROUND(N163/16.62,2) -> 0.91
A165: 42-9346-03 Weber Basin Pump Plant 3 | B165: 3.23 | C165: 1.93 | D165: 0.65 | E165: 0.71 | F165: 3.22 | G165: 1.70 | H165: 1.89 | I165: 1.21 | J165: 3.11 | K165: 1.68 | L165: 0.57 | M165: 2.10 | N165: =SUM(B165:M165) -> 22.00
A166: % of normal | B166: =ROUND(B165/2.37,2) -> 1.36 | C166: =ROUND(C165/2.2,2) -> 0.88 | D166: =ROUND(D165/2.26,2) -> 0.29 | E166: =ROUND(E165/2.61,2) -> 0.27 | F166: =ROUND(F165/2.46,2) -> 1.31 | G166: =ROUND(G165/2.82,2) -> 0.6 | H166: =ROUND(H165/2.89,2) -> 0.65 | I166: =ROUND(I165/3.17,2) -> 0.38 | J166: =ROUND(J165/1.47,2) -> 2.12 | K166: =ROUND(K165/1.02,2) -> 1.65 | L166: =ROUND(L165/1.13,2) -> 0.5 | M166: =ROUND(M165/1.79,2) -> 1.17 | N166: =ROUND(N165/26.19,2) -> 0.84
A167: 42-9368-07 Wellington 3E | B167: 1.16 | C167: 0.14 | D167: 0.21 | E167: 0.07 | F167: 0.10 | G167: 0.15 | H167: 0.55 | I167: 0.41 | J167: 0.00 | K167: 0.10 | L167: 0.39 | M167: 1.25 | N167: =SUM(B167:M167) -> 4.53
A168: % of normal | B168: =ROUND(B167/0.88,2) -> 1.32 | C168: =ROUND(C167/0.47,2) -> 0.3 | D168: =ROUND(D167/0.42,2) -> 0.5 | E168: =ROUND(E167/0.58,2) -> 0.12 | F168: =ROUND(F167/0.51,2) -> 0.2 | G168: =ROUND(G167/0.79,2) -> 0.19 | H168: =ROUND(H167/0.68,2) -> 0.81 | I168: =ROUND(I167/0.79,2) -> 0.52 | J168: =ROUND(J167/0.42,2) -> 0 | K168: =ROUND(K167/0.84,2) -> 0.12 | L168: =ROUND(L167/0.9,2) -> 0.43 | M168: =ROUND(M167/1.22,2) -> 1.02 | N168: =ROUND(N167/8.5,2) -> 0.53
A169: 42-9382-01 Wendover Ut | B169: 0.00 | C169: 0.00 | D169: 0.10 | E169: 0.03 | F169: 0.44 | G169: 0.82 | H169: 0.07 | I169: 0.00 | J169: 0.14 | K169: 0.46 | L169: 0.00 | M169: 0.00 | N169: =SUM(B169:M169) -> 2.06
A170: % of normal | B170: =ROUND(B169/0.53,2) -> 0 | C170: =ROUND(C169/0.27,2) -> 0 | D170: =ROUND(D169/0.16,2) -> 0.63 | E170: =ROUND(E169/0.31,2) -> 0.1 | F170: =ROUND(F169/0.26,2) -> 1.69 | G170: =ROUND(G169/0.44,2) -> 1.86 | H170: =ROUND(H169/0.48,2) -> 0.15 | I170: =ROUND(I169/0.82,2) -> 0 | J170: =ROUND(J169/0.38,2) -> 0.37 | K170: =ROUND(K169/0.29,2) -> 1.59 | L170: =ROUND(L169/0.4,2) -> 0 | M170: 0 | N170: =ROUND(N169/4.77,2) -> 0.43
A171: 48-1736-03 Church Buttes Gas Plant, Wyo | B171: 0.83 | C171: 0.39 | D171: 0.47 | E171: 0.16 | F171: 0.17 | G171: 0.89 | H171: 0.13 | I171: 1.06 | J171: 0.16 | K171: 0.55 | L171: 1.89 | M171: 1.79 | N171: =SUM(B171:M171) -> 8.49
A172: % of normal | B172: =ROUND(B171/0.68,2) -> 1.22 | C172: =ROUND(C171/0.64,2) -> 0.61 | D172: =ROUND(D171/0.42,2) -> 1.12 | E172: =ROUND(E171/0.53,2) -> 0.3 | F172: =ROUND(F171/0.31,2) -> 0.55 | G172: =ROUND(G171/0.63,2) -> 1.41 | H172: =ROUND(H171/0.9,2) -> 0.14 | I172: =ROUND(I171/1.15,2) -> 0.92 | J172: =ROUND(J171/0.71,2) -> 0.23 | K172: =ROUND(K171/0.59,2) -> 0.93 | L172: =ROUND(L171/0.67,2) -> 2.82 | M172: =ROUND(M171/0.85,2) -> 2.11 | N172: =ROUND(N171/8.08,2) -> 1.05
A173: 48-3100-03 Evanston 1E, Wyo | B173: 0.99 | C173: 1.68 | D173: 0.79 | E173: 1.71 | F173: 0.80 | G173: 0.40 | H173: 0.70 | I173: 1.01 | J173: 0.16 | K173: 0.54 | L173: 0.78 | M173: 0.80 | N173: =SUM(B173:M173) -> 10.36
A174: % of normal | B174: =ROUND(B173/1.15,2) -> 0.86 | C174: =ROUND(C173/0.84,2) -> 2 | D174: =ROUND(D173/0.67,2) -> 1.18 | E174: =ROUND(E173/0.68,2) -> 2.51 | F174: =ROUND(F173/0.62,2) -> 1.29 | G174: =ROUND(G173/0.89,2) -> 0.45 | H174: =ROUND(H173/1.13,2) -> 0.62 | I174: =ROUND(I173/1.47,2) -> 0.69 | J174: =ROUND(J173/0.96,2) -> 0.17 | K174: =ROUND(K173/0.91,2) -> 0.59 | L174: =ROUND(L173/0.94,2) -> 0.83 | M174: =ROUND(M173/1.27,2) -> 0.63 | N174: =ROUND(N173/11.53,2) -> 0.9
A175: 48-5703-03 Lonetree No1, Wyo | B175: 1.66 | C175: 0.26 | D175: 1.30 | E175: 1.06 | F175: 0.40 | G175: 0.90 | H175: 0.28 | I175: 0.83 | J175: T | K175: 0.65 | L175: 1.59 | M175: 1.13 | N175: =SUM(B175:M175) -> 10.06
A176: Normals not available | B176: NA | C176: NA | D176: NA | E176: NA | F176: NA | G176: NA | H176: NA | I176: NA | J176: NA | K176: NA | L176: NA | M176: NA | N176: NA
A177: 48-6555-03 Mountain View, Wyo | B177: 1.34 | C177: 0.80 | D177: 0.93 | E177: 0.80 | F177: 0.51 | G177: 0.74 | H177: 0.58 | I177: 1.11 | J177: 0.01 | K177: 0.14 | L177: 0.77 | M177: 1.36 | N177: =SUM(B177:M177) -> 9.09
A178: % of normal | B178: =ROUND(B177/0.92,2) -> 1.46 | C178: =ROUND(C177/0.61,2) -> 1.31 | D178: =ROUND(D177/0.82,2) -> 1.13 | E178: =ROUND(E177/0.44,2) -> 1.82 | F178: =ROUND(F177/0.37,2) -> 1.38 | G178: =ROUND(G177/0.51,2) -> 1.45 | H178: =ROUND(H177/0.95,2) -> 0.61 | I178: =ROUND(I177/1.25,2) -> 0.89 | J178: =ROUND(J177/0.96,2) -> 0.01 | K178: M | L178: =ROUND(L177/0.87,2) -> 0.89 | M178: =ROUND(M177/1.07,2) -> 1.27 | N178: M