B1: Oct | C1: Nov | D1: Dec | E1: Jan | F1: Feb | G1: Mar | H1: Apr | I1: May | J1: Jun | K1: Jul | L1: Aug | M1: Sep | N1: Water Yr
A2: 2007 - 2008 Water Year | B2: 2007 | C2: 2007 | D2: 2007 | E2: 2008 | F2: 2008 | G2: 2008 | H2: 2008 | I2: 2008 | J2: 2008 | K2: 2008 | L2: 2008 | M2: 2008 | N2: Total
A3: 42-0061-03 Alpine | B3: 2.18 | C3: 0.25 | D3: 5.01 | E3: 2.86 | F3: 2.99 | G3: 0.96 | H3: 1.05 | I3: 1.64 | J3: 0.49 | K3: 0.05 | L3: 0.23 | M3: 1.80 | N3: =SUM(B3:M3) -> 19.51
A4: % of normal | B4: =ROUND(B3/1.89,2) -> 1.15 | C4: =ROUND(C3/1.66,2) -> 0.15 | D4: =ROUND(D3/1.67,2) -> 3 | E4: =ROUND(E3/1.99,2) -> 1.44 | F4: =ROUND(F3/1.74,2) -> 1.72 | G4: =ROUND(G3/1.92,2) -> 0.5 | H4: =ROUND(H3/1.85,2) -> 0.57 | I4: =ROUND(I3/2.17,2) -> 0.76 | J4: =ROUND(J3/0.88,2) -> 0.56 | K4: =ROUND(K3/0.74,2) -> 0.07 | L4: =ROUND(L3/1,2) -> 0.23 | M4: =ROUND(M3/1.38,2) -> 1.3 | N4: =ROUND(N3/18.89,2) -> 1.03
A5: 42-0072-05 Alta | B5: 4.80 | C5: 3.14 | D5: 9.48 | E5: 14.70 | F5: 9.63 | G5: 6.40 | H5: 5.03 | I5: 3.21 | J5: 0.81 | K5: 0.29 | L5: 1.34 | M5: 3.57 | N5: =SUM(B5:M5) -> 62.40
A6: % of normal | B6: =ROUND(B5/4.08,2) -> 1.18 | C6: =ROUND(C5/5.66,2) -> 0.55 | D6: =ROUND(D5/6.01,2) -> 1.58 | E6: =ROUND(E5/5.99,2) -> 2.45 | F6: =ROUND(F5/5.88,2) -> 1.64 | G6: =ROUND(G5/6.62,2) -> 0.97 | H6: =ROUND(H5/5.34,2) -> 0.94 | I6: =ROUND(I5/4.26,2) -> 0.75 | J6: =ROUND(J5/1.89,2) -> 0.43 | K6: =ROUND(K5/1.75,2) -> 0.17 | L6: =ROUND(L5/1.96,2) -> 0.68 | M6: =ROUND(M5/2.82,2) -> 1.27 | N6: =ROUND(N5/52.26,2) -> 1.19
A7: 42-0074-06 Altamont | B7: 0.43 | C7: 0.00 | D7: 1.72 | E7: 0.99 | F7: 2.31 | G7: 0.72 | H7: 0.05 | I7: 1.56 | J7: 0.38 | K7: 0.30 | L7: 0.62 | M7: 1.14 | N7: =SUM(B7:M7) -> 10.22
A8: % of normal | B8: =ROUND(B7/1.04,2) -> 0.41 | C8: =ROUND(C7/0.62,2) -> 0 | D8: =ROUND(D7/0.54,2) -> 3.19 | E8: =ROUND(E7/0.69,2) -> 1.43 | F8: =ROUND(F7/0.64,2) -> 3.61 | G8: =ROUND(G7/0.64,2) -> 1.13 | H8: =ROUND(H7/0.73,2) -> 0.07 | I8: =ROUND(I7/1.01,2) -> 1.54 | J8: =ROUND(J7/0.71,2) -> 0.54 | K8: =ROUND(K7/0.85,2) -> 0.35 | L8: =ROUND(L7/0.86,2) -> 0.72 | M8: =ROUND(M7/1.07,2) -> 1.07 | N8: =ROUND(N7/9.4,2) -> 1.09
A9: 42-0086-04 Alton | B9: 0.34 | C9: 0.75 | D9: 3.01 | E9: 4.51 | F9: 2.52 | G9: 0.46 | H9: 0.04 | I9: 0.52 | J9: 0.19 | K9: 1.12 | L9: 1.36 | M9: M | N9: =SUM(B9:M9) -> 14.82
A10: % of normal | B10: =ROUND(B9/1.59,2) -> 0.21 | C10: =ROUND(C9/1.4,2) -> 0.54 | D10: =ROUND(D9/1.19,2) -> 2.53 | E10: =ROUND(E9/1.76,2) -> 2.56 | F10: =ROUND(F9/1.9,2) -> 1.33 | G10: =ROUND(G9/1.75,2) -> 0.26 | H10: =ROUND(H9/0.95,2) -> 0.04 | I10: =ROUND(I9/0.97,2) -> 0.54 | J10: =ROUND(J9/0.51,2) -> 0.37 | K10: =ROUND(K9/1.34,2) -> 0.84 | L10: =ROUND(L9/1.62,2) -> 0.84 | M10: =ROUND(M9/1.53,2) -> ##### | N10: =ROUND(N9/16.51,2) -> 0.9
A11: 42-0168-04 Angle | B11: 0.52 | C11: 0.04 | D11: 1.37 | E11: 0.30 | F11: 0.67 | G11: 0.08 | H11: 0.00 | I11: 1.09 | J11: 0.21 | K11: 0.63 | L11: M | M11: M | N11: =SUM(B11:M11) -> 4.91
A12: % of normal | B12: =ROUND(B11/0.89,2) -> 0.58 | C12: =ROUND(C11/0.38,2) -> 0.11 | D12: =ROUND(D11/0.29,2) -> 4.72 | E12: =ROUND(E11/0.48,2) -> 0.63 | F12: =ROUND(F11/0.35,2) -> 1.91 | G12: =ROUND(G11/0.75,2) -> 0.11 | H12: =ROUND(H11/0.69,2) -> 0 | I12: =ROUND(I11/0.8,2) -> 1.36 | J12: =ROUND(J11/0.59,2) -> 0.36 | K12: =ROUND(K11/0.9,2) -> 0.7 | L12: =ROUND(L11/1.3,2) -> ##### | M12: =ROUND(M11/0.97,2) -> ##### | N12: =ROUND(N11/8.39,2) -> 0.59
A13: 42-0688-07 Big Water | B13: 0.09 | C13: 0.02 | D13: 1.11 | E13: 1.11 | F13: 1.17 | G13: 0.23 | H13: 0.11 | I13: 0.21 | J13: 0.02 | K13: 0.17 | L13: 0.45 | M13: M | N13: =SUM(B13:M13) -> 4.69
A14: % of normal | B14: =ROUND(B13/0.88,2) -> 0.1 | C14: =ROUND(C13/0.42,2) -> 0.05 | D14: =ROUND(D13/0.26,2) -> 4.27 | E14: =ROUND(E13/0.47,2) -> 2.36 | F14: =ROUND(F13/0.56,2) -> 2.09 | G14: =ROUND(G13/0.6,2) -> 0.38 | H14: =ROUND(H13/0.37,2) -> 0.3 | I14: =ROUND(I13/0.31,2) -> 0.68 | J14: =ROUND(J13/0.11,2) -> 0.18 | K14: =ROUND(K13/0.64,2) -> 0.27 | L14: =ROUND(L13/0.6,2) -> 0.75 | M14: =ROUND(M13/0.55,2) -> ##### | N14: =ROUND(N13/5.77,2) -> 0.81
A15: 42-0820-05 Bountiful Val Verda | B15: 2.94 | C15: 0.67 | D15: 4.28 | E15: 2.19 | F15: 1.87 | G15: 1.86 | H15: 1.42 | I15: 1.59 | J15: 0.92 | K15: 0.26 | L15: 0.00 | M15: 1.65 | N15: =SUM(B15:M15) -> 19.65
A16: % of normal | B16: =ROUND(B15/2.18,2) -> 1.35 | C16: =ROUND(C15/1.92,2) -> 0.35 | D16: =ROUND(D15/1.75,2) -> 2.45 | E16: =ROUND(E15/2,2) -> 1.1 | F16: =ROUND(F15/1.84,2) -> 1.02 | G16: =ROUND(G15/2.39,2) -> 0.78 | H16: =ROUND(H15/2.81,2) -> 0.51 | I16: =ROUND(I15/3,2) -> 0.53 | J16: =ROUND(J15/1.15,2) -> 0.8 | K16: =ROUND(K15/0.88,2) -> 0.3 | L16: =ROUND(L15/0.94,2) -> 0 | M16: =ROUND(M15/1.54,2) -> 1.07 | N16: =ROUND(N15/22.4,2) -> 0.88
A17: 42-0849-04 Boulder | B17: 0.63 | C17: 0.08 | D17: 1.15 | E17: 1.41 | F17: 1.05 | G17: 0.58 | H17: 0.00 | I17: 0.28 | J17: 0.01 | K17: 0.35 | L17: 1.62 | M17: 0.33 | N17: =SUM(B17:M17) -> 7.49
A18: % of normal | B18: =ROUND(B17/1.21,2) -> 0.52 | C18: =ROUND(C17/0.79,2) -> 0.1 | D18: =ROUND(D17/0.58,2) -> 1.98 | E18: =ROUND(E17/0.96,2) -> 1.47 | F18: =ROUND(F17/0.91,2) -> 1.15 | G18: =ROUND(G17/1.02,2) -> 0.57 | H18: =ROUND(H17/0.49,2) -> 0 | I18: =ROUND(I17/0.77,2) -> 0.36 | J18: =ROUND(J17/0.33,2) -> 0.03 | K18: =ROUND(K17/1.06,2) -> 0.33 | L18: =ROUND(L17/1.5,2) -> 1.08 | M18: =ROUND(M17/1.2,2) -> 0.28 | N18: =ROUND(N17/10.82,2) -> 0.69
A19: 42-1008-04 Bryce Canyon N. P. HQRS | B19: 0.36 | C19: 0.70 | D19: 1.40 | E19: 2.10 | F19: 1.10 | G19: 0.40 | H19: T | I19: 0.70 | J19: 0.20 | K19: 1.70 | L19: 1.20 | M19: 0.30 | N19: =SUM(B19:M19) -> 10.16
A20: % of normal | B20: =ROUND(B19/1.7,2) -> 0.21 | C20: =ROUND(C19/1.2,2) -> 0.58 | D20: =ROUND(D19/0.97,2) -> 1.44 | E20: =ROUND(E19/1.5,2) -> 1.4 | F20: =ROUND(F19/1.66,2) -> 0.66 | G20: =ROUND(G19/1.64,2) -> 0.24 | H20: 0 | I20: =ROUND(I19/1.05,2) -> 0.67 | J20: =ROUND(J19/0.6,2) -> 0.33 | K20: =ROUND(K19/1.43,2) -> 1.19 | L20: =ROUND(L19/2.16,2) -> 0.56 | M20: =ROUND(M19/1.65,2) -> 0.18 | N20: =ROUND(N19/16.4,2) -> 0.62
A21: 42-1020-07 Bullfrog Basin | B21: 0.46 | C21: 0.04 | D21: 1.17 | E21: 0.57 | F21: M | G21: 0.21 | H21: 0.31 | I21: 0.55 | J21: 0.45 | K21: 0.06 | L21: 0.64 | M21: 0.05 | N21: =SUM(B21:M21) -> 4.51
A22: % of normal | B22: =ROUND(B21/0.98,2) -> 0.47 | C22: =ROUND(C21/0.62,2) -> 0.06 | D22: =ROUND(D21/0.43,2) -> 2.72 | E22: =ROUND(E21/0.6,2) -> 0.95 | F22: =ROUND(F21/0.4,2) -> ##### | G22: =ROUND(G21/0.63,2) -> 0.33 | H22: =ROUND(H21/0.31,2) -> 1 | I22: =ROUND(I21/0.37,2) -> 1.49 | J22: =ROUND(J21/0.13,2) -> 3.46 | K22: =ROUND(K21/0.37,2) -> 0.16 | L22: =ROUND(L21/0.5,2) -> 1.28 | M22: =ROUND(M21/0.66,2) -> 0.08 | N22: =ROUND(N21/6,2) -> 0.75
A23: 42-1171-07 Capitol Reef N. P. | B23: 0.05 | C23: 0.09 | D23: 0.64 | E23: 0.36 | F23: 0.07 | G23: 0.49 | H23: 0.01 | I23: 0.46 | J23: 0.01 | K23: 0.31 | L23: 0.57 | M23: 0.04 | N23: =SUM(B23:M23) -> 3.10
A24: % of normal | B24: =ROUND(B23/0.76,2) -> 0.07 | C24: =ROUND(C23/0.61,2) -> 0.15 | D24: =ROUND(D23/0.27,2) -> 2.37 | E24: =ROUND(E23/0.52,2) -> 0.69 | F24: =ROUND(F23/0.38,2) -> 0.18 | G24: =ROUND(G23/0.64,2) -> 0.77 | H24: =ROUND(H23/0.52,2) -> 0.02 | I24: =ROUND(I23/0.64,2) -> 0.72 | J24: =ROUND(J23/0.37,2) -> 0.03 | K24: =ROUND(K23/0.95,2) -> 0.33 | L24: =ROUND(L23/1.19,2) -> 0.48 | M24: =ROUND(M23/0.83,2) -> 0.05 | N24: =ROUND(N23/7.68,2) -> 0.4
A25: 42-1214-07 Castledale | B25: 0.43 | C25: 0.03 | D25: 1.33 | E25: 0.51 | F25: 0.93 | G25: 0.00 | H25: 0.11 | I25: 0.50 | J25: 0.35 | K25: 0.03 | L25: 0.29 | M25: 0.68 | N25: =SUM(B25:M25) -> 5.19
A26: % of normal | B26: =ROUND(B25/0.9,2) -> 0.48 | C26: =ROUND(C25/0.52,2) -> 0.06 | D26: =ROUND(D25/0.36,2) -> 3.69 | E26: =ROUND(E25/0.64,2) -> 0.8 | F26: =ROUND(F25/0.57,2) -> 1.63 | G26: =ROUND(G25/0.68,2) -> 0 | H26: =ROUND(H25/0.52,2) -> 0.21 | I26: =ROUND(I25/0.65,2) -> 0.77 | J26: =ROUND(J25/0.41,2) -> 0.85 | K26: =ROUND(K25/0.81,2) -> 0.04 | L26: =ROUND(L25/0.97,2) -> 0.3 | M26: =ROUND(M25/0.86,2) -> 0.79 | N26: =ROUND(N25/7.89,2) -> 0.66
A27: 42-1432-04 Circleville | B27: 0.12 | C27: 0.23 | D27: 1.39 | E27: 0.29 | F27: 0.05 | G27: 1.00 | H27: 0.05 | I27: 0.49 | J27: 0.29 | K27: 3.33 | L27: 0.47 | M27: 0.21 | N27: =SUM(B27:M27) -> 7.92
A28: % of normal | B28: =ROUND(B27/0.9,2) -> 0.13 | C28: =ROUND(C27/0.5,2) -> 0.46 | D28: =ROUND(D27/0.42,2) -> 3.31 | E28: =ROUND(E27/0.61,2) -> 0.48 | F28: =ROUND(F27/0.54,2) -> 0.09 | G28: =ROUND(G27/0.76,2) -> 1.32 | H28: =ROUND(H27/0.64,2) -> 0.08 | I28: =ROUND(I27/0.9,2) -> 0.54 | J28: =ROUND(J27/0.57,2) -> 0.51 | K28: =ROUND(K27/0.86,2) -> 3.87 | L28: =ROUND(L27/1.42,2) -> 0.33 | M28: =ROUND(M27/0.95,2) -> 0.22 | N28: =ROUND(N27/9.07,2) -> 0.87
A29: 42-1446-05 City Creek Water Plant | B29: 4.58 | C29: 0.53 | D29: 4.59 | E29: 3.18 | F29: 2.81 | G29: 2.44 | H29: 0.41 | I29: 2.42 | J29: 1.78 | K29: 0.21 | L29: 0.06 | M29: 2.39 | N29: =SUM(B29:M29) -> 25.40
A30: % of normal | B30: =ROUND(B29/2.64,2) -> 1.73 | C30: =ROUND(C29/2.68,2) -> 0.2 | D30: =ROUND(D29/2.52,2) -> 1.82 | E30: =ROUND(E29/2.82,2) -> 1.13 | F30: =ROUND(F29/2.61,2) -> 1.08 | G30: =ROUND(G29/3.35,2) -> 0.73 | H30: =ROUND(H29/3.4,2) -> 0.12 | I30: =ROUND(I29/3.16,2) -> 0.77 | J30: =ROUND(J29/1.42,2) -> 1.25 | K30: =ROUND(K29/1.02,2) -> 0.21 | L30: =ROUND(L29/1.01,2) -> 0.06 | M30: =ROUND(M29/2.21,2) -> 1.08 | N30: =ROUND(N29/28.84,2) -> 0.88
A31: 42-1588-05 Coalville | B31: 1.38 | C31: 0.17 | D31: 3.27 | E31: 2.05 | F31: 2.12 | G31: 1.14 | H31: 1.02 | I31: 1.62 | J31: 1.15 | K31: 0.08 | L31: 0.01 | M31: 1.23 | N31: =SUM(B31:M31) -> 15.24
A32: % of normal | B32: =ROUND(B31/1.61,2) -> 0.86 | C32: =ROUND(C31/1.62,2) -> 0.1 | D32: =ROUND(D31/1.15,2) -> 2.84 | E32: =ROUND(E31/1.31,2) -> 1.56 | F32: =ROUND(F31/1.22,2) -> 1.74 | G32: =ROUND(G31/1.62,2) -> 0.7 | H32: =ROUND(H31/1.84,2) -> 0.55 | I32: =ROUND(I31/2.02,2) -> 0.8 | J32: =ROUND(J31/1.13,2) -> 1.02 | K32: =ROUND(K31/1,2) -> 0.08 | L32: =ROUND(L31/1.08,2) -> 0.01 | M32: =ROUND(M31/1.37,2) -> 0.9 | N32: =ROUND(N31/16.97,2) -> 0.9
A33: 42-1590-05 Coalville 13E | B33: 2.30 | C33: 0.30 | D33: 2.10 | E33: 1.70 | F33: 1.30 | G33: 1.20 | H33: 1.30 | I33: 2.10 | J33: 0.80 | K33: 0.20 | L33: 2.10 | M33: 0.62 | N33: =SUM(B33:M33) -> 16.02
A34: % of normal | B34: =ROUND(B33/1.56,2) -> 1.47 | C34: =ROUND(C33/1.39,2) -> 0.22 | D34: =ROUND(D33/0.88,2) -> 2.39 | E34: =ROUND(E33/0.98,2) -> 1.73 | F34: =ROUND(F33/0.91,2) -> 1.43 | G34: =ROUND(G33/1.36,2) -> 0.88 | H34: =ROUND(H33/1.7,2) -> 0.76 | I34: =ROUND(I33/1.81,2) -> 1.16 | J34: =ROUND(J33/1.01,2) -> 0.79 | K34: =ROUND(K33/1.02,2) -> 0.2 | L34: =ROUND(L33/0.84,2) -> 2.5 | M34: =ROUND(M33/1.5,2) -> 0.41 | N34: =ROUND(N33/14.96,2) -> 1.07
A35: 42-1759-03 Cottonwood Weir | B35: 3.32 | C35: 0.58 | D35: 3.59 | E35: 2.22 | F35: 1.96 | G35: 2.12 | H35: 2.18 | I35: 3.07 | J35: 1.35 | K35: T | L35: 0.11 | M35: 2.38 | N35: =SUM(B35:M35) -> 22.88
A36: % of normal | B36: =ROUND(B35/2.62,2) -> 1.27 | C36: =ROUND(C35/2.45,2) -> 0.24 | D36: =ROUND(D35/2.03,2) -> 1.77 | E36: =ROUND(E35/2.05,2) -> 1.08 | F36: =ROUND(F35/2.19,2) -> 0.89 | G36: =ROUND(G35/2.92,2) -> 0.73 | H36: =ROUND(H35/3.17,2) -> 0.69 | I36: =ROUND(I35/3.06,2) -> 1 | J36: =ROUND(J35/1.27,2) -> 1.06 | K36: 0 | L36: =ROUND(L35/1.2,2) -> 0.09 | M36: =ROUND(M35/2.12,2) -> 1.12 | N36: =ROUND(N35/26.19,2) -> 0.87
A37: 42-2057-05 Deer Creek Dam | B37: 2.07 | C37: 0.09 | D37: 5.07 | E37: 2.69 | F37: 3.52 | G37: 0.97 | H37: 0.56 | I37: 2.55 | J37: 0.70 | K37: 0.38 | L37: 0.10 | M37: 2.93 | N37: =SUM(B37:M37) -> 21.63
A38: % of normal | B38: =ROUND(B37/2.09,2) -> 0.99 | C38: =ROUND(C37/2.3,2) -> 0.04 | D38: =ROUND(D37/2.32,2) -> 2.19 | E38: =ROUND(E37/3.12,2) -> 0.86 | F38: =ROUND(F37/2.86,2) -> 1.23 | G38: =ROUND(G37/2.42,2) -> 0.4 | H38: =ROUND(H37/1.76,2) -> 0.32 | I38: =ROUND(I37/1.92,2) -> 1.33 | J38: =ROUND(J37/1.01,2) -> 0.69 | K38: =ROUND(K37/0.91,2) -> 0.42 | L38: =ROUND(L37/1.12,2) -> 0.09 | M38: =ROUND(M37/1.58,2) -> 1.85 | N38: =ROUND(N37/23.41,2) -> 0.92
A39: 42-2090-01 Delta | B39: 0.55 | C39: 0.23 | D39: 1.38 | E39: 0.36 | F39: 0.63 | G39: 0.51 | H39: 0.10 | I39: 0.81 | J39: 0.68 | K39: 0.21 | L39: 0.50 | M39: 0.89 | N39: =SUM(B39:M39) -> 6.85
A40: % of normal | B40: =ROUND(B39/1.01,2) -> 0.54 | C40: =ROUND(C39/0.61,2) -> 0.38 | D40: =ROUND(D39/0.43,2) -> 3.21 | E40: =ROUND(E39/0.6,2) -> 0.6 | F40: =ROUND(F39/0.65,2) -> 0.97 | G40: =ROUND(G39/0.85,2) -> 0.6 | H40: =ROUND(H39/0.83,2) -> 0.12 | I40: =ROUND(I39/0.99,2) -> 0.82 | J40: =ROUND(J39/0.48,2) -> 1.42 | K40: =ROUND(K39/0.56,2) -> 0.38 | L40: =ROUND(L39/0.64,2) -> 0.78 | M40: =ROUND(M39/0.78,2) -> 1.14 | N40: =ROUND(N39/8.43,2) -> 0.81
A41: 42-2235-03 Draper - Point of the Mountain | B41: 1.20 | C41: 0.35 | D41: 2.63 | E41: 1.69 | F41: 1.53 | G41: 0.40 | H41: 0.86 | I41: 1.51 | J41: 0.98 | K41: 0.02 | L41: 1.49 | M41: 1.60 | N41: =SUM(B41:M41) -> 14.26
A42: % of normal | B42: =ROUND(B41/1.73,2) -> 0.69 | C42: =ROUND(C41/1.32,2) -> 0.27 | D42: =ROUND(D41/0.96,2) -> 2.74 | E42: =ROUND(E41/1.51,2) -> 1.12 | F42: =ROUND(F41/1.22,2) -> 1.25 | G42: =ROUND(G41/1.58,2) -> 0.25 | H42: =ROUND(H41/1.82,2) -> 0.47 | I42: =ROUND(I41/1.79,2) -> 0.84 | J42: =ROUND(J41/0.85,2) -> 1.15 | K42: =ROUND(K41/0.95,2) -> 0.02 | L42: =ROUND(L41/0.95,2) -> 1.57 | M42: =ROUND(M41/1.08,2) -> 1.48 | N42: =ROUND(N41/15.76,2) -> 0.9
A43: 42-2253-06 Duchesne | B43: 0.58 | C43: 0.05 | D43: 1.46 | E43: 0.53 | F43: 1.60 | G43: 0.66 | H43: 0.11 | I43: 0.81 | J43: 0.52 | K43: 0.62 | L43: 1.05 | M43: 0.63 | N43: =SUM(B43:M43) -> 8.62
A44: % of normal | B44: =ROUND(B43/0.94,2) -> 0.62 | C44: =ROUND(C43/0.49,2) -> 0.1 | D44: =ROUND(D43/0.54,2) -> 2.7 | E44: =ROUND(E43/0.51,2) -> 1.04 | F44: =ROUND(F43/0.57,2) -> 2.81 | G44: =ROUND(G43/0.69,2) -> 0.96 | H44: =ROUND(H43/0.9,2) -> 0.12 | I44: =ROUND(I43/1.1,2) -> 0.74 | J44: =ROUND(J43/0.68,2) -> 0.76 | K44: =ROUND(K43/1,2) -> 0.62 | L44: =ROUND(L43/1.19,2) -> 0.88 | M44: =ROUND(M43/1.12,2) -> 0.56 | N44: =ROUND(N43/9.73,2) -> 0.89
A45: 42-2385-05 Echo Dam | B45: 1.46 | C45: 0.26 | D45: 1.77 | E45: 1.67 | F45: 1.81 | G45: 0.77 | H45: 0.50 | I45: 1.15 | J45: 0.98 | K45: 0.14 | L45: T | M45: 1.92 | N45: =SUM(B45:M45) -> 12.43
A46: % of normal | B46: =ROUND(B45/1.52,2) -> 0.96 | C46: =ROUND(C45/1.53,2) -> 0.17 | D46: =ROUND(D45/1.03,2) -> 1.72 | E46: =ROUND(E45/1.14,2) -> 1.46 | F46: =ROUND(F45/1.03,2) -> 1.76 | G46: =ROUND(G45/1.38,2) -> 0.56 | H46: =ROUND(H45/1.52,2) -> 0.33 | I46: =ROUND(I45/1.97,2) -> 0.58 | J46: =ROUND(J45/1.05,2) -> 0.93 | K46: =ROUND(K45/0.85,2) -> 0.16 | L46: =ROUND(L45/0.8,2) -> ##### | M46: =ROUND(M45/1.38,2) -> 1.39 | N46: =ROUND(N45/15.2,2) -> 0.82
A47: 42-2424-05 Electric Lake UP&L | B47: 2.45 | C47: 1.60 | D47: 4.07 | E47: M | F47: M | G47: M | H47: M | I47: M | J47: M | K47: 1.47 | L47: 0.30 | M47: 0.87 | N47: =SUM(B47:M47) -> 10.76
A48: % of normal | B48: =ROUND(B47/1.91,2) -> 1.28 | C48: =ROUND(C47/2.23,2) -> 0.72 | D48: =ROUND(D47/2.32,2) -> 1.75 | E48: M | F48: M | G48: M | H48: M | I48: M | J48: M | K48: =ROUND(K47/1.16,2) -> 1.27 | L48: =ROUND(L47/1.61,2) -> 0.19 | M48: =ROUND(M47/1.74,2) -> 0.5 | N48: M
A49: 42-2578-04 Ephraim USFS | B49: 1.05 | C49: 0.00 | D49: 2.47 | E49: 1.38 | F49: 0.66 | G49: 0.43 | H49: 0.47 | I49: 1.35 | J49: 0.95 | K49: 0.22 | L49: 0.22 | M49: 0.53 | N49: =SUM(B49:M49) -> 9.73
A50: % of normal | B50: =ROUND(B49/1.34,2) -> 0.78 | C50: =ROUND(C49/1.1,2) -> 0 | D50: =ROUND(D49/0.88,2) -> 2.81 | E50: =ROUND(E49/1.01,2) -> 1.37 | F50: =ROUND(F49/1.08,2) -> 0.61 | G50: =ROUND(G49/1.39,2) -> 0.31 | H50: =ROUND(H49/1.14,2) -> 0.41 | I50: =ROUND(I49/1.29,2) -> 1.05 | J50: =ROUND(J49/0.67,2) -> 1.42 | K50: =ROUND(K49/0.76,2) -> 0.29 | L50: =ROUND(L49/0.85,2) -> 0.26 | M50: =ROUND(M49/1.19,2) -> 0.45 | N50: =ROUND(N49/12.7,2) -> 0.77
A51: 42-2592-04 Escalante | B51: 0.80 | C51: 0.39 | D51: 0.66 | E51: 2.21 | F51: 2.54 | G51: 0.27 | H51: 0.00 | I51: 0.12 | J51: 0.01 | K51: 0.25 | L51: 1.91 | M51: 0.10 | N51: =SUM(B51:M51) -> 9.26
A52: % of normal | B52: =ROUND(B51/1.16,2) -> 0.69 | C52: =ROUND(C51/0.77,2) -> 0.51 | D52: =ROUND(D51/0.54,2) -> 1.22 | E52: =ROUND(E51/0.9,2) -> 2.46 | F52: =ROUND(F51/0.79,2) -> 3.22 | G52: =ROUND(G51/0.92,2) -> 0.29 | H52: =ROUND(H51/0.49,2) -> 0 | I52: =ROUND(I51/0.65,2) -> 0.18 | J52: =ROUND(J51/0.37,2) -> 0.03 | K52: =ROUND(K51/0.76,2) -> 0.33 | L52: =ROUND(L51/1.52,2) -> 1.26 | M52: =ROUND(M51/1.12,2) -> 0.09 | N52: =ROUND(N51/9.99,2) -> 0.93
A53: 42-2696-03 Fairfield | B53: 0.46 | C53: 0.09 | D53: 1.52 | E53: 0.60 | F53: 0.53 | G53: 0.44 | H53: 0.26 | I53: 1.90 | J53: 0.13 | K53: 0.76 | L53: 0.16 | M53: 1.07 | N53: =SUM(B53:M53) -> 7.92
A54: % of normal | B54: =ROUND(B53/1.31,2) -> 0.35 | C54: =ROUND(C53/1.04,2) -> 0.09 | D54: =ROUND(D53/0.84,2) -> 1.81 | E54: =ROUND(E53/1.15,2) -> 0.52 | F54: =ROUND(F53/1.17,2) -> 0.45 | G54: =ROUND(G53/1.19,2) -> 0.37 | H54: =ROUND(H53/1.16,2) -> 0.22 | I54: =ROUND(I53/1.29,2) -> 1.47 | J54: =ROUND(J53/0.72,2) -> 0.18 | K54: =ROUND(K53/1.09,2) -> 0.7 | L54: =ROUND(L53/1.09,2) -> 0.15 | M54: =ROUND(M53/1.06,2) -> 1.01 | N54: =ROUND(N53/13.11,2) -> 0.6
A55: 42-2702-05 Fairview 8N | B55: 1.78 | C55: 0.31 | D55: 3.95 | E55: 3.14 | F55: 2.81 | G55: 0.80 | H55: 1.77 | I55: 2.33 | J55: 1.47 | K55: 0.79 | L55: 1.48 | M55: 1.05 | N55: =SUM(B55:M55) -> 21.68
A56: % of normal | B56: =ROUND(B55/1.66,2) -> 1.07 | C56: =ROUND(C55/1.41,2) -> 0.22 | D56: =ROUND(D55/1.27,2) -> 3.11 | E56: =ROUND(E55/1.58,2) -> 1.99 | F56: =ROUND(F55/1.45,2) -> 1.94 | G56: =ROUND(G55/1.58,2) -> 0.51 | H56: =ROUND(H55/1.2,2) -> 1.48 | I56: =ROUND(I55/1.77,2) -> 1.32 | J56: =ROUND(J55/1.02,2) -> 1.44 | K56: =ROUND(K55/1.02,2) -> 0.77 | L56: =ROUND(L55/1.22,2) -> 1.21 | M56: =ROUND(M55/1.51,2) -> 0.7 | N56: =ROUND(N55/16.69,2) -> 1.3
A57: 42-2726-03 Farmington 3NW | B57: 3.10 | C57: 0.45 | D57: 3.64 | E57: 2.06 | F57: 1.52 | G57: 0.70 | H57: 0.80 | I57: 1.20 | J57: 0.80 | K57: T | L57: 0.80 | M57: M | N57: =SUM(B57:M57) -> 15.07
A58: % of normal | B58: =ROUND(B57/2.15,2) -> 1.44 | C58: =ROUND(C57/2.03,2) -> 0.22 | D58: =ROUND(D57/1.89,2) -> 1.93 | E58: =ROUND(E57/2.18,2) -> 0.94 | F58: =ROUND(F57/2.08,2) -> 0.73 | G58: =ROUND(G57/2.62,2) -> 0.27 | H58: =ROUND(H57/2.68,2) -> 0.3 | I58: =ROUND(I57/2.98,2) -> 0.4 | J58: =ROUND(J57/1.27,2) -> 0.63 | K58: 0 | L58: =ROUND(L57/0.88,2) -> 0.91 | M58: =ROUND(M57/1.58,2) -> ##### | N58: =ROUND(N57/23.26,2) -> 0.65
A59: 42-2798-07 Ferron | B59: 0.62 | C59: T | D59: 1.31 | E59: 0.44 | F59: 1.34 | G59: 0.02 | H59: T | I59: 0.54 | J59: 0.34 | K59: 0.13 | L59: 0.34 | M59: 0.39 | N59: =SUM(B59:M59) -> 5.47
A60: % of normal | B60: =ROUND(B59/0.98,2) -> 0.63 | C60: 0 | D60: =ROUND(D59/0.39,2) -> 3.36 | E60: =ROUND(E59/0.66,2) -> 0.67 | F60: =ROUND(F59/0.64,2) -> 2.09 | G60: =ROUND(G59/0.74,2) -> 0.03 | H60: 0 | I60: =ROUND(I59/0.74,2) -> 0.73 | J60: =ROUND(J59/0.41,2) -> 0.83 | K60: =ROUND(K59/1.04,2) -> 0.13 | L60: =ROUND(L59/0.97,2) -> 0.35 | M60: =ROUND(M59/1.02,2) -> 0.38 | N60: =ROUND(N59/8.67,2) -> 0.63
A61: 42-2828-04 Fillmore | B61: 1.60 | C61: 0.05 | D61: 3.77 | E61: 0.90 | F61: 1.65 | G61: 0.81 | H61: 0.33 | I61: 2.24 | J61: 2.10 | K61: 0.66 | L61: 0.31 | M61: 0.53 | N61: =SUM(B61:M61) -> 14.95
A62: % of normal | B62: =ROUND(B61/1.69,2) -> 0.95 | C62: =ROUND(C61/1.5,2) -> 0.03 | D62: =ROUND(D61/1.21,2) -> 3.12 | E62: =ROUND(E61/1.42,2) -> 0.63 | F62: =ROUND(F61/1.39,2) -> 1.19 | G62: =ROUND(G61/1.98,2) -> 0.41 | H62: =ROUND(H61/1.82,2) -> 0.18 | I62: =ROUND(I61/1.68,2) -> 1.33 | J62: =ROUND(J61/0.7,2) -> 3 | K62: =ROUND(K61/0.8,2) -> 0.83 | L62: =ROUND(L61/0.83,2) -> 0.37 | M62: =ROUND(M61/1.09,2) -> 0.49 | N62: =ROUND(N61/16.11,2) -> 0.93
A63: 42-3012-04 Fremont Indian State Park | B63: 0.49 | C63: 0.00 | D63: 2.41 | E63: 1.51 | F63: 1.03 | G63: 0.70 | H63: 0.15 | I63: 1.27 | J63: 0.93 | K63: 0.90 | L63: 0.59 | M63: 0.11 | N63: =SUM(B63:M63) -> 10.09
A64: % of normal | B64: =ROUND(B63/1.38,2) -> 0.36 | C64: =ROUND(C63/0.79,2) -> 0 | D64: =ROUND(D63/0.65,2) -> 3.71 | E64: =ROUND(E63/0.78,2) -> 1.94 | F64: =ROUND(F63/0.78,2) -> 1.32 | G64: =ROUND(G63/1.02,2) -> 0.69 | H64: =ROUND(H63/1,2) -> 0.15 | I64: =ROUND(I63/1.12,2) -> 1.13 | J64: =ROUND(J63/0.75,2) -> 1.24 | K64: 1.66 | L64: =ROUND(L63/1.69,2) -> 0.35 | M64: =ROUND(M63/0.93,2) -> 0.12 | N64: =ROUND(N63/11.94,2) -> 0.85
A65: 42-3097-03 Garfield | B65: 2.21 | C65: 0.43 | D65: 2.00 | E65: 1.58 | F65: 1.17 | G65: 0.73 | H65: 0.61 | I65: 2.20 | J65: 1.81 | K65: T | L65: 0.12 | M65: 0.43 | N65: =SUM(B65:M65) -> 13.29
A66: % of normal | B66: =ROUND(B65/1.98,2) -> 1.12 | C66: =ROUND(C65/1.73,2) -> 0.25 | D66: =ROUND(D65/1.2,2) -> 1.67 | E66: =ROUND(E65/1.3,2) -> 1.22 | F66: =ROUND(F65/1.38,2) -> 0.85 | G66: =ROUND(G65/1.98,2) -> 0.37 | H66: =ROUND(H65/2.22,2) -> 0.27 | I66: =ROUND(I65/2.43,2) -> 0.91 | J66: =ROUND(J65/0.95,2) -> 1.91 | K66: 0 | L66: =ROUND(L65/0.93,2) -> 0.13 | M66: =ROUND(M65/1.63,2) -> 0.26 | N66: =ROUND(N65/18.76,2) -> 0.71
A67: 42-3254-07 Goblin Valley State Park | B67: 0.06 | C67: 0.02 | D67: 1.96 | E67: 0.20 | F67: 0.22 | G67: 0.11 | H67: 0.07 | I67: 0.35 | J67: 0.25 | K67: 0.24 | L67: 0.55 | M67: 0.40 | N67: =SUM(B67:M67) -> 4.43
A68: Normals not available | B68: NA | C68: NA | D68: NA | E68: NA | F68: NA | G68: NA | H68: NA | I68: NA | J68: NA | K68: NA | L68: NA | M68: NA | N68: NA
A69: 42-3418-07 Green River Aviation | B69: 0.10 | C69: 0.50 | D69: 1.00 | E69: 0.60 | F69: 1.00 | G69: T | H69: T | I69: 0.30 | J69: 0.30 | K69: 0.20 | L69: 0.60 | M69: M | N69: =SUM(B69:M69) -> 4.60
A70: % of normal | B70: =ROUND(B69/0.98,2) -> 0.1 | C70: =ROUND(C69/0.46,2) -> 1.09 | D70: =ROUND(D69/0.32,2) -> 3.13 | E70: =ROUND(E69/0.5,2) -> 1.2 | F70: =ROUND(F69/0.43,2) -> 2.33 | G70: 0 | H70: 0 | I70: =ROUND(I69/0.65,2) -> 0.46 | J70: =ROUND(J69/0.34,2) -> 0.88 | K70: =ROUND(K69/0.76,2) -> 0.26 | L70: =ROUND(L69/0.68,2) -> 0.88 | M70: =ROUND(M69/0.72,2) -> ##### | N70: =ROUND(N69/7.11,2) -> 0.65
A71: 42-3600-07 Hans Flat Ranger Station | B71: 0.78 | C71: 0.20 | D71: 1.97 | E71: 0.84 | F71: 1.18 | G71: 0.43 | H71: 0.21 | I71: 0.64 | J71: 0.59 | K71: 0.83 | L71: 2.76 | M71: 0.17 | N71: =SUM(B71:M71) -> 10.60
A72: % of normal | B72: =ROUND(B71/1.18,2) -> 0.66 | C72: =ROUND(C71/0.78,2) -> 0.26 | D72: =ROUND(D71/0.54,2) -> 3.65 | E72: =ROUND(E71/0.66,2) -> 1.27 | F72: =ROUND(F71/0.47,2) -> 2.51 | G72: =ROUND(G71/0.81,2) -> 0.53 | H72: =ROUND(H71/0.64,2) -> 0.33 | I72: =ROUND(I71/0.61,2) -> 1.05 | J72: =ROUND(J71/0.44,2) -> 1.34 | K72: =ROUND(K71/1.16,2) -> 0.72 | L72: =ROUND(L71/0.96,2) -> 2.88 | M72: =ROUND(M71/0.91,2) -> 0.19 | N72: =ROUND(N71/9.16,2) -> 1.16
A73: 42-3611-07 Hanksville | B73: 0.00 | C73: 0.17 | D73: 0.65 | E73: 0.32 | F73: 0.42 | G73: 0.20 | H73: 0.07 | I73: 0.33 | J73: 0.18 | K73: 0.13 | L73: 1.87 | M73: 0.05 | N73: =SUM(B73:M73) -> 4.39
A74: % of normal | B74: =ROUND(B73/0.71,2) -> 0 | C74: =ROUND(C73/0.41,2) -> 0.41 | D74: =ROUND(D73/0.27,2) -> 2.41 | E74: =ROUND(E73/0.5,2) -> 0.64 | F74: =ROUND(F73/0.25,2) -> 1.68 | G74: =ROUND(G73/0.55,2) -> 0.36 | H74: =ROUND(H73/0.45,2) -> 0.16 | I74: =ROUND(I73/0.52,2) -> 0.63 | J74: =ROUND(J73/0.23,2) -> 0.78 | K74: =ROUND(K73/0.49,2) -> 0.27 | L74: =ROUND(L73/0.55,2) -> 3.4 | M74: =ROUND(M73/0.79,2) -> 0.06 | N74: =ROUND(N73/5.72,2) -> 0.77
A75: 42-3776-04 Hatch | B75: 0.25 | C75: 0.31 | D75: 2.64 | E75: 2.95 | F75: 1.24 | G75: 0.74 | H75: 0.08 | I75: 0.69 | J75: 0.23 | K75: 2.52 | L75: 2.24 | M75: 0.20 | N75: =SUM(B75:M75) -> 14.09
A76: % of normal | B76: =ROUND(B75/1.26,2) -> 0.2 | C76: =ROUND(C75/0.96,2) -> 0.32 | D76: =ROUND(D75/0.66,2) -> 4 | E76: =ROUND(E75/0.86,2) -> 3.43 | F76: =ROUND(F75/1.07,2) -> 1.16 | G76: =ROUND(G75/1.18,2) -> 0.63 | H76: =ROUND(H75/0.72,2) -> 0.11 | I76: =ROUND(I75/0.89,2) -> 0.78 | J76: =ROUND(J75/0.55,2) -> 0.42 | K76: 0 | L76: =ROUND(L75/1.69,2) -> 1.33 | M76: =ROUND(M75/1.17,2) -> 0.17 | N76: =ROUND(N75/12.26,2) -> 1.15
A77: 42-3809-05 Heber | B77: 1.96 | C77: 0.22 | D77: 2.16 | E77: 3.29 | F77: 1.71 | G77: 0.98 | H77: 0.46 | I77: 1.00 | J77: 0.44 | K77: 0.00 | L77: 0.08 | M77: 1.35 | N77: =SUM(B77:M77) -> 13.65
A78: % of normal | B78: =ROUND(B77/1.62,2) -> 1.21 | C78: =ROUND(C77/1.5,2) -> 0.15 | D78: =ROUND(D77/1.39,2) -> 1.55 | E78: =ROUND(E77/1.86,2) -> 1.77 | F78: =ROUND(F77/1.71,2) -> 1 | G78: =ROUND(G77/1.47,2) -> 0.67 | H78: =ROUND(H77/1.28,2) -> 0.36 | I78: =ROUND(I77/1.48,2) -> 0.68 | J78: =ROUND(J77/0.84,2) -> 0.52 | K78: =ROUND(K77/0.83,2) -> 0 | L78: =ROUND(L77/0.97,2) -> 0.08 | M78: =ROUND(M77/1.27,2) -> 1.06 | N78: =ROUND(N77/16.22,2) -> 0.84
A79: 42-3836-05 Helper-Carbon UP&L | B79: 0.71 | C79: 0.26 | D79: 1.56 | E79: M | F79: M | G79: M | H79: M | I79: M | J79: M | K79: M | L79: M | M79: M | N79: =SUM(B79:M79) -> 2.53
A80: % of normal | B80: =ROUND(B79/1.64,2) -> 0.43 | C80: =ROUND(C79/0.94,2) -> 0.28 | D80: =ROUND(D79/0.73,2) -> 2.14 | E80: M | F80: M | G80: M | H80: M | I80: M | J80: M | K80: M | L80: =ROUND(L79/1.2,2) -> ##### | M80: =ROUND(M79/1.58,2) -> ##### | N80: =ROUND(N79/13.77,2) -> 0.18
A81: 42-3980-07 Hite Ranger Station | B81: M | C81: M | D81: 1.39 | E81: 0.46 | F81: 1.28 | G81: 0.27 | H81: 0.00 | I81: M | J81: 0.70 | K81: 0.01 | L81: 0.76 | M81: 0.05 | N81: =SUM(B81:M81) -> 4.92
A82: % of normal | B82: M | C82: M | D82: =ROUND(D81/0.55,2) -> 2.53 | E82: =ROUND(E81/0.7,2) -> 0.66 | F82: =ROUND(F81/0.37,2) -> 3.46 | G82: =ROUND(G81/0.69,2) -> 0.39 | H82: =ROUND(H81/0.49,2) -> 0 | I82: M | J82: =ROUND(J81/0.26,2) -> 2.69 | K82: =ROUND(K81/0.63,2) -> 0.02 | L82: =ROUND(L81/0.46,2) -> 1.65 | M82: =ROUND(M81/0.8,2) -> 0.06 | N82: =ROUND(N81/7.42,2) -> 0.66
A83: 42-4135-05 Huntsville Monastery | B83: 1.60 | C83: 0.32 | D83: 3.11 | E83: 3.68 | F83: 4.97 | G83: 1.03 | H83: 0.41 | I83: 0.42 | J83: 0.86 | K83: 0.17 | L83: 0.00 | M83: 1.95 | N83: =SUM(B83:M83) -> 18.52
A84: % of normal | B84: =ROUND(B83/1.97,2) -> 0.81 | C84: =ROUND(C83/2.2,2) -> 0.15 | D84: =ROUND(D83/2.06,2) -> 1.51 | E84: =ROUND(E83/2.64,2) -> 1.39 | F84: =ROUND(F83/2.1,2) -> 2.37 | G84: =ROUND(G83/2.21,2) -> 0.47 | H84: =ROUND(H83/2.01,2) -> 0.2 | I84: =ROUND(I83/2.21,2) -> 0.19 | J84: =ROUND(J83/1.29,2) -> 0.67 | K84: =ROUND(K83/0.87,2) -> 0.2 | L84: =ROUND(L83/0.84,2) -> 0 | M84: =ROUND(M83/1.69,2) -> 1.15 | N84: =ROUND(N83/22.09,2) -> 0.84
A85: 42-4467-05 Kamas | B85: 1.78 | C85: 0.16 | D85: 2.14 | E85: 2.79 | F85: 1.88 | G85: M | H85: 0.86 | I85: 2.16 | J85: 0.53 | K85: M | L85: 0.85 | M85: 1.72 | N85: =SUM(B85:M85) -> 14.87
A86: % of normal | B86: =ROUND(B85/1.74,2) -> 1.02 | C86: =ROUND(C85/1.52,2) -> 0.11 | D86: =ROUND(D85/1.28,2) -> 1.67 | E86: =ROUND(E85/1.58,2) -> 1.77 | F86: =ROUND(F85/1.45,2) -> 1.3 | G86: =ROUND(G85/1.59,2) -> ##### | H86: =ROUND(H85/1.55,2) -> 0.55 | I86: =ROUND(I85/1.64,2) -> 1.32 | J86: =ROUND(J85/0.94,2) -> 0.56 | K86: =ROUND(K85/1.06,2) -> ##### | L86: =ROUND(L85/1.06,2) -> 0.8 | M86: =ROUND(M85/1.48,2) -> 1.16 | N86: =ROUND(N85/16.89,2) -> 0.88
A87: 42-4508-04 Kanab | B87: 0.01 | C87: 0.75 | D87: 2.55 | E87: 2.83 | F87: 2.46 | G87: 0.14 | H87: 0.02 | I87: 0.13 | J87: 0.02 | K87: 0.23 | L87: 1.58 | M87: 0.14 | N87: =SUM(B87:M87) -> 10.86
A88: % of normal | B88: =ROUND(B87/1.35,2) -> 0.01 | C88: =ROUND(C87/1.18,2) -> 0.64 | D88: =ROUND(D87/1.01,2) -> 2.52 | E88: =ROUND(E87/1.86,2) -> 1.52 | F88: =ROUND(F87/1.73,2) -> 1.42 | G88: =ROUND(G87/1.91,2) -> 0.07 | H88: =ROUND(H87/0.95,2) -> 0.02 | I88: =ROUND(I87/0.68,2) -> 0.19 | J88: =ROUND(J87/0.4,2) -> 0.05 | K88: =ROUND(K87/1.05,2) -> 0.22 | L88: =ROUND(L87/1.45,2) -> 1.09 | M88: =ROUND(M87/1.37,2) -> 0.1 | N88: =ROUND(N87/14.94,2) -> 0.73
A89: 42-4527-04 Kanosh | B89: 0.71 | C89: 0.26 | D89: 3.52 | E89: 0.79 | F89: 1.15 | G89: 0.60 | H89: 0.74 | I89: 1.99 | J89: 2.37 | K89: 0.67 | L89: 1.06 | M89: 0.00 | N89: =SUM(B89:M89) -> 13.86
A90: % of normal | B90: =ROUND(B89/1.66,2) -> 0.43 | C90: =ROUND(C89/1.5,2) -> 0.17 | D90: =ROUND(D89/1.21,2) -> 2.91 | E90: =ROUND(E89/1.38,2) -> 0.57 | F90: =ROUND(F89/1.25,2) -> 0.92 | G90: =ROUND(G89/1.91,2) -> 0.31 | H90: =ROUND(H89/1.82,2) -> 0.41 | I90: =ROUND(I89/1.58,2) -> 1.26 | J90: =ROUND(J89/0.67,2) -> 3.54 | K90: =ROUND(K89/0.89,2) -> 0.75 | L90: =ROUND(L89/1.14,2) -> 0.93 | M90: =ROUND(M89/1.05,2) -> 0 | N90: =ROUND(N89/16.06,2) -> 0.86
A91: 42-4755-04 Kodachrome Basin Park | B91: 0.16 | C91: 0.40 | D91: 2.44 | E91: 2.44 | F91: 1.23 | G91: 0.26 | H91: 0.02 | I91: 0.36 | J91: T | K91: 0.29 | L91: 2.06 | M91: 0.01 | N91: =SUM(B91:M91) -> 9.67
A92: % of normal | B92: =ROUND(B91/1.34,2) -> 0.12 | C92: =ROUND(C91/0.72,2) -> 0.56 | D92: =ROUND(D91/0.63,2) -> 3.87 | E92: =ROUND(E91/1.03,2) -> 2.37 | F92: =ROUND(F91/1.12,2) -> 1.1 | G92: =ROUND(G91/1.12,2) -> 0.23 | H92: =ROUND(H91/0.66,2) -> 0.03 | I92: =ROUND(I91/0.67,2) -> 0.54 | J92: 0 | K92: =ROUND(K91/1.02,2) -> 0.28 | L92: =ROUND(L91/1.57,2) -> 1.31 | M92: =ROUND(M91/1.2,2) -> 0.01 | N92: =ROUND(N91/11.45,2) -> 0.84
A93: 42-4764-04 Koosharem | B93: 0.55 | C93: 0.83 | D93: 1.32 | E93: 1.21 | F93: 0.99 | G93: 0.31 | H93: M | I93: 0.10 | J93: 0.25 | K93: M | L93: M | M93: 0.33 | N93: =SUM(B93:M93) -> 5.89
A94: % of normal | B94: =ROUND(B93/0.97,2) -> 0.57 | C94: =ROUND(C93/0.56,2) -> 1.48 | D94: =ROUND(D93/0.51,2) -> 2.59 | E94: =ROUND(E93/0.64,2) -> 1.89 | F94: =ROUND(F93/0.57,2) -> 1.74 | G94: =ROUND(G93/0.78,2) -> 0.4 | H94: =ROUND(H93/0.6,2) -> ##### | I94: =ROUND(I93/0.88,2) -> 0.11 | J94: =ROUND(J93/0.59,2) -> 0.42 | K94: =ROUND(K93/1.08,2) -> ##### | L94: =ROUND(L93/1.35,2) -> ##### | M94: =ROUND(M93/0.96,2) -> 0.34 | N94: =ROUND(N93/9.49,2) -> 0.62
A95: 42-4970-03 Layton | B95: 2.90 | C95: 0.48 | D95: 3.42 | E95: 2.25 | F95: 1.47 | G95: 1.29 | H95: 0.71 | I95: 0.89 | J95: 0.90 | K95: 0.26 | L95: 0.04 | M95: 1.30 | N95: =SUM(B95:M95) -> 15.91
A96: Normals not available | B96: NA | C96: NA | D96: NA | E96: NA | F96: NA | G96: NA | H96: NA | I96: NA | J96: NA | K96: NA | L96: NA | M96: NA | N96: NA
A97: 42-5065-04 Levan | B97: 1.30 | C97: 1.00 | D97: 2.02 | E97: 0.40 | F97: M | G97: M | H97: M | I97: M | J97: M | K97: M | L97: M | M97: M | N97: =SUM(B97:M97) -> 4.72
A98: % of normal | B98: =ROUND(B97/1.62,2) -> 0.8 | C98: =ROUND(C97/1.24,2) -> 0.81 | D98: =ROUND(D97/1.12,2) -> 1.8 | E98: =ROUND(E97/1.35,2) -> 0.3 | F98: M | G98: M | H98: M | I98: M | J98: M | K98: M | L98: M | M98: M | N98: M
A99: 42-5148-04 Loa | B99: 0.22 | C99: 0.00 | D99: 1.28 | E99: 0.50 | F99: 0.21 | G99: 0.27 | H99: T | I99: 0.19 | J99: 0.13 | K99: 0.62 | L99: 0.88 | M99: 0.03 | N99: =SUM(B99:M99) -> 4.33
A100: % of normal | B100: =ROUND(B99/0.73,2) -> 0.3 | C100: =ROUND(C99/0.37,2) -> 0 | D100: =ROUND(D99/0.27,2) -> 4.74 | E100: =ROUND(E99/0.46,2) -> 1.09 | F100: =ROUND(F99/0.32,2) -> 0.66 | G100: =ROUND(G99/0.55,2) -> 0.49 | H100: 0 | I100: =ROUND(I99/0.82,2) -> 0.23 | J100: =ROUND(J99/0.57,2) -> 0.23 | K100: =ROUND(K99/0.89,2) -> 0.7 | L100: =ROUND(L99/1.39,2) -> 0.63 | M100: =ROUND(M99/0.94,2) -> 0.03 | N100: =ROUND(N99/7.75,2) -> 0.56
A101: 42-5186-03 Logan Utah State Univ | B101: 1.72 | C101: 0.44 | D101: 1.68 | E101: 2.35 | F101: 2.13 | G101: 1.52 | H101: 0.90 | I101: 2.44 | J101: 0.94 | K101: 0.09 | L101: 0.22 | M101: 1.15 | N101: =SUM(B101:M101) -> 15.58
A102: % of normal | B102: =ROUND(B101/2.06,2) -> 0.83 | C102: =ROUND(C101/1.56,2) -> 0.28 | D102: =ROUND(D101/1.58,2) -> 1.06 | E102: =ROUND(E101/1.56,2) -> 1.51 | F102: =ROUND(F101/1.61,2) -> 1.32 | G102: =ROUND(G101/2.15,2) -> 0.71 | H102: =ROUND(H101/2.12,2) -> 0.42 | I102: 1.84E-2 | J102: =ROUND(J101/1.34,2) -> 0.7 | K102: =ROUND(K101/0.98,2) -> 0.09 | L102: =ROUND(L101/0.98,2) -> 0.22 | M102: =ROUND(M101/1.56,2) -> 0.74 | N102: =ROUND(N101/19.89,2) -> 0.78
A103: 42-5194-03 Logan 5SW Exp Farm | B103: 1.29 | C103: 0.37 | D103: 1.97 | E103: 2.38 | F103: 1.64 | G103: 1.07 | H103: 0.67 | I103: 1.84 | J103: 0.81 | K103: 0.07 | L103: 1.12 | M103: 1.34 | N103: =SUM(B103:M103) -> 14.57
A104: % of normal | B104: =ROUND(B103/1.89,2) -> 0.68 | C104: =ROUND(C103/1.54,2) -> 0.24 | D104: =ROUND(D103/1.48,2) -> 1.33 | E104: =ROUND(E103/1.67,2) -> 1.43 | F104: =ROUND(F103/1.69,2) -> 0.97 | G104: =ROUND(G103/1.86,2) -> 0.58 | H104: =ROUND(H103/1.96,2) -> 0.34 | I104: =ROUND(I103/2.17,2) -> 0.85 | J104: =ROUND(J103/1.26,2) -> 0.64 | K104: =ROUND(K103/0.88,2) -> 0.08 | L104: =ROUND(L103/0.95,2) -> 1.18 | M104: =ROUND(M103/1.44,2) -> 0.93 | N104: =ROUND(N103/18.79,2) -> 0.78
A105: 42-5402-04 Manti | B105: 1.20 | C105: 0.47 | D105: 2.83 | E105: 1.12 | F105: 1.23 | G105: 0.43 | H105: 0.68 | I105: 1.94 | J105: 1.02 | K105: 0.97 | L105: 0.40 | M105: 0.55 | N105: =SUM(B105:M105) -> 12.84
A106: % of normal | B106: =ROUND(B105/1.45,2) -> 0.83 | C106: =ROUND(C105/1.15,2) -> 0.41 | D106: =ROUND(D105/0.91,2) -> 3.11 | E106: =ROUND(E105/1.08,2) -> 1.04 | F106: =ROUND(F105/1.07,2) -> 1.15 | G106: =ROUND(G105/1.46,2) -> 0.29 | H106: =ROUND(H105/1.31,2) -> 0.52 | I106: =ROUND(I105/1.52,2) -> 1.28 | J106: =ROUND(J105/0.77,2) -> 1.32 | K106: =ROUND(K105/0.79,2) -> 1.23 | L106: =ROUND(L105/0.89,2) -> 0.45 | M106: =ROUND(M105/1.31,2) -> 0.42 | N106: =ROUND(N105/13.71,2) -> 0.94
A107: 42-5477-04 Marysvale | B107: T | C107: 0.11 | D107: 1.59 | E107: 1.09 | F107: 0.34 | G107: 0.71 | H107: 0.04 | I107: 0.53 | J107: 0.21 | K107: 2.50 | L107: 0.37 | M107: 0.17 | N107: =SUM(B107:M107) -> 7.66
A108: % of normal | B108: 0 | C108: =ROUND(C107/0.59,2) -> 0.19 | D108: =ROUND(D107/0.44,2) -> 3.61 | E108: =ROUND(E107/0.59,2) -> 1.85 | F108: =ROUND(F107/0.54,2) -> 0.63 | G108: =ROUND(G107/0.76,2) -> 0.93 | H108: =ROUND(H107/0.61,2) -> 0.07 | I108: =ROUND(I107/0.75,2) -> 0.71 | J108: =ROUND(J107/0.44,2) -> 0.48 | K108: =ROUND(K107/0.76,2) -> 3.29 | L108: =ROUND(L107/1,2) -> 0.37 | M108: =ROUND(M107/0.8,2) -> 0.21 | N108: =ROUND(N107/8.15,2) -> 0.94
A109: 42-5826-05 Morgan Power & Light | B109: 1.72 | C109: 0.28 | D109: 2.91 | E109: 2.46 | F109: 4.04 | G109: 0.97 | H109: 0.60 | I109: 0.99 | J109: 0.73 | K109: 0.00 | L109: 0.61 | M109: 1.05 | N109: =SUM(B109:M109) -> 16.36
A110: % of normal | B110: =ROUND(B109/1.71,2) -> 1.01 | C110: =ROUND(C109/1.85,2) -> 0.15 | D110: =ROUND(D109/1.58,2) -> 1.84 | E110: =ROUND(E109/1.85,2) -> 1.33 | F110: =ROUND(F109/1.77,2) -> 2.28 | G110: =ROUND(G109/1.88,2) -> 0.52 | H110: =ROUND(H109/2.1,2) -> 0.29 | I110: =ROUND(I109/2.03,2) -> 0.49 | J110: =ROUND(J109/1.13,2) -> 0.65 | K110: =ROUND(K109/0.75,2) -> 0 | L110: =ROUND(L109/0.83,2) -> 0.73 | M110: =ROUND(M109/1.54,2) -> 0.68 | N110: =ROUND(N109/19.02,2) -> 0.86
A111: 42-5837-04 Moroni | B111: 0.69 | C111: 0.45 | D111: 2.09 | E111: 1.37 | F111: 1.76 | G111: 0.75 | H111: 0.32 | I111: M | J111: 0.98 | K111: 0.53 | L111: 0.25 | M111: M | N111: =SUM(B111:M111) -> 9.19
A112: % of normal | B112: =ROUND(B111/1.07,2) -> 0.64 | C112: =ROUND(C111/0.86,2) -> 0.52 | D112: =ROUND(D111/0.83,2) -> 2.52 | E112: =ROUND(E111/0.93,2) -> 1.47 | F112: =ROUND(F111/0.9,2) -> 1.96 | G112: =ROUND(G111/0.97,2) -> 0.77 | H112: =ROUND(H111/0.69,2) -> 0.46 | I112: =ROUND(I111/0.86,2) -> ##### | J112: =ROUND(J111/0.54,2) -> 1.81 | K112: =ROUND(K111/0.73,2) -> 0.73 | L112: =ROUND(L111/0.81,2) -> 0.31 | M112: =ROUND(M111/0.93,2) -> ##### | N112: =ROUND(N111/10.12,2) -> 0.91
A113: 42-5892-05 Mountain Dell Dam | B113: 3.65 | C113: 0.38 | D113: 2.96 | E113: 3.19 | F113: 2.56 | G113: 1.59 | H113: M | I113: 2.10 | J113: 1.36 | K113: 0.04 | L113: 0.01 | M113: 2.04 | N113: =SUM(B113:M113) -> 19.88
A114: % of normal | B114: =ROUND(B113/2.65,2) -> 1.38 | C114: =ROUND(C113/2.12,2) -> 0.18 | D114: =ROUND(D113/1.99,2) -> 1.49 | E114: =ROUND(E113/1.97,2) -> 1.62 | F114: =ROUND(F113/1.96,2) -> 1.31 | G114: =ROUND(G113/2.5,2) -> 0.64 | H114: =ROUND(H113/2.47,2) -> ##### | I114: =ROUND(I113/2.74,2) -> 0.77 | J114: =ROUND(J113/1.39,2) -> 0.98 | K114: =ROUND(K113/1.08,2) -> 0.04 | L114: =ROUND(L113/1.14,2) -> 0.01 | M114: =ROUND(M113/2.03,2) -> 1 | N114: =ROUND(N113/24.04,2) -> 0.83
A115: 42-5969-06 Myton | B115: 0.00 | C115: 0.00 | D115: 1.29 | E115: 0.25 | F115: 0.96 | G115: 0.19 | H115: 0.22 | I115: 0.52 | J115: 0.88 | K115: 0.30 | L115: 0.31 | M115: 1.12 | N115: =SUM(B115:M115) -> 6.04
A116: % of normal | B116: =ROUND(B115/0.88,2) -> 0 | C116: =ROUND(C115/0.41,2) -> 0 | D116: =ROUND(D115/0.25,2) -> 5.16 | E116: =ROUND(E115/0.34,2) -> 0.74 | F116: =ROUND(F115/0.34,2) -> 2.82 | G116: =ROUND(G115/0.5,2) -> 0.38 | H116: =ROUND(H115/0.72,2) -> 0.31 | I116: =ROUND(I115/0.93,2) -> 0.56 | J116: =ROUND(J115/0.55,2) -> 1.6 | K116: =ROUND(K115/0.61,2) -> 0.49 | L116: =ROUND(L115/0.72,2) -> 0.43 | M116: =ROUND(M115/0.79,2) -> 1.42 | N116: =ROUND(N115/7.04,2) -> 0.86
A117: 42-6123-06 Neola | B117: 0.32 | C117: 0.40 | D117: 1.55 | E117: 0.47 | F117: 1.20 | G117: 0.64 | H117: M | I117: 0.76 | J117: 0.63 | K117: 0.00 | L117: 0.49 | M117: M | N117: =SUM(B117:M117) -> 6.46
A118: % of normal | B118: =ROUND(B117/1.19,2) -> 0.27 | C118: =ROUND(C117/0.6,2) -> 0.67 | D118: =ROUND(D117/0.42,2) -> 3.69 | E118: =ROUND(E117/0.57,2) -> 0.82 | F118: =ROUND(F117/0.54,2) -> 2.22 | G118: =ROUND(G117/0.64,2) -> 1 | H118: =ROUND(H117/0.81,2) -> ##### | I118: =ROUND(I117/1.17,2) -> 0.65 | J118: =ROUND(J117/0.67,2) -> 0.94 | K118: =ROUND(K117/0.75,2) -> 0 | L118: =ROUND(L117/0.84,2) -> 0.58 | M118: =ROUND(M117/1.1,2) -> ##### | N118: =ROUND(N117/9.3,2) -> 0.69
A119: 42-6135-04 Nephi | B119: 1.37 | C119: 0.35 | D119: 2.23 | E119: 0.79 | F119: 1.18 | G119: 0.65 | H119: 0.20 | I119: 2.12 | J119: 1.18 | K119: 0.44 | L119: 0.77 | M119: 0.70 | N119: =SUM(B119:M119) -> 11.98
A120: % of normal | B120: =ROUND(B119/1.55,2) -> 0.88 | C120: =ROUND(C119/1.41,2) -> 0.25 | D120: =ROUND(D119/1.13,2) -> 1.97 | E120: =ROUND(E119/1.36,2) -> 0.58 | F120: =ROUND(F119/1.36,2) -> 0.87 | G120: =ROUND(G119/1.76,2) -> 0.37 | H120: =ROUND(H119/1.57,2) -> 0.13 | I120: =ROUND(I119/1.57,2) -> 1.35 | J120: =ROUND(J119/0.82,2) -> 1.44 | K120: =ROUND(K119/0.85,2) -> 0.52 | L120: =ROUND(L119/1,2) -> 0.77 | M120: =ROUND(M119/1.16,2) -> 0.6 | N120: =ROUND(N119/15.54,2) -> 0.77
A121: 42-6404-03 Ogden Pioneer PH | B121: 3.92 | C121: 0.60 | D121: 3.25 | E121: 3.40 | F121: 2.20 | G121: 0.48 | H121: 0.55 | I121: 1.02 | J121: 0.22 | K121: 0.00 | L121: 1.02 | M121: 0.67 | N121: =SUM(B121:M121) -> 17.33
A122: % of normal | B122: =ROUND(B121/2.27,2) -> 1.73 | C122: =ROUND(C121/2.01,2) -> 0.3 | D122: =ROUND(D121/1.97,2) -> 1.65 | E122: =ROUND(E121/2.32,2) -> 1.47 | F122: =ROUND(F121/2.13,2) -> 1.03 | G122: =ROUND(G121/2.44,2) -> 0.2 | H122: =ROUND(H121/2.45,2) -> 0.22 | I122: =ROUND(I121/2.9,2) -> 0.35 | J122: =ROUND(J121/1.47,2) -> 0.15 | K122: =ROUND(K121/0.94,2) -> 0 | L122: =ROUND(L121/1.02,2) -> 1 | M122: =ROUND(M121/1.75,2) -> 0.38 | N122: =ROUND(N121/23.67,2) -> 0.73
A123: 42-6414-03 Ogden Sugar Factory | B123: M | C123: M | D123: M | E123: M | F123: M | G123: M | H123: 0.49 | I123: 0.82 | J123: M | K123: M | L123: M | M123: 1.43 | N123: =SUM(B123:M123) -> 2.74
A124: % of normal | B124: M | C124: M | D124: M | E124: M | F124: M | G124: M | H124: =ROUND(H123/1.98,2) -> 0.25 | I124: =ROUND(I123/2.23,2) -> 0.37 | J124: =ROUND(J123/1.27,2) -> ##### | K124: =ROUND(K123/0.62,2) -> ##### | L124: =ROUND(L123/0.83,2) -> ##### | M124: =ROUND(M123/1.41,2) -> 1.01 | N124: M
A125: 42-6534-04 Orderville | B125: 0.00 | C125: 1.50 | D125: 3.10 | E125: 2.56 | F125: 2.06 | G125: 0.90 | H125: 0.00 | I125: M | J125: 0.15 | K125: 0.96 | L125: 0.71 | M125: 0.60 | N125: =SUM(B125:M125) -> 12.54
A126: % of normal | B126: =ROUND(B125/1.27,2) -> 0 | C126: =ROUND(C125/1.21,2) -> 1.24 | D126: =ROUND(D125/1.08,2) -> 2.87 | E126: =ROUND(E125/1.82,2) -> 1.41 | F126: =ROUND(F125/1.91,2) -> 1.08 | G126: =ROUND(G125/2.05,2) -> 0.44 | H126: =ROUND(H125/0.98,2) -> 0 | I126: =ROUND(I125/0.89,2) -> ##### | J126: =ROUND(J125/0.58,2) -> 0.26 | K126: =ROUND(K125/1.15,2) -> 0.83 | L126: =ROUND(L125/1.65,2) -> 0.43 | M126: =ROUND(M125/1.15,2) -> 0.52 | N126: =ROUND(N125/15.74,2) -> 0.8
A127: 42-6538-03 Orem Treatment Plant | B127: 1.77 | C127: 0.33 | D127: 2.19 | E127: 4.99 | F127: 0.57 | G127: 0.35 | H127: 0.13 | I127: 1.12 | J127: 0.33 | K127: 0.07 | L127: 0.12 | M127: M | N127: =SUM(B127:M127) -> 11.97
A128: % of normal | B128: =ROUND(B127/1.49,2) -> 1.19 | C128: =ROUND(C127/1.03,2) -> 0.32 | D128: =ROUND(D127/0.79,2) -> 2.77 | E128: =ROUND(E127/1.22,2) -> 4.09 | F128: =ROUND(F127/1.11,2) -> 0.51 | G128: =ROUND(G127/1.15,2) -> 0.3 | H128: =ROUND(H127/1.3,2) -> 0.1 | I128: =ROUND(I127/1.38,2) -> 0.81 | J128: =ROUND(J127/0.78,2) -> 0.42 | K128: =ROUND(K127/0.67,2) -> 0.1 | L128: =ROUND(L127/0.77,2) -> 0.16 | M128: =ROUND(M127/1.15,2) -> ##### | N128: =ROUND(N127/12.84,2) -> 0.93
A129: 42-6601-04 Panguitch | B129: M | C129: M | D129: M | E129: M | F129: M | G129: M | H129: M | I129: M | J129: M | K129: M | L129: M | M129: M | N129: =SUM(B129:M129) -> 0.00
A130: % of normal | B130: M | C130: M | D130: M | E130: M | F130: M | G130: M | H130: M | I130: M | J130: M | K130: M | L130: M | M130: M | N130: M
A131: 42-6640-04 Paria Ranger Station | B131: 0.26 | C131: 0.68 | D131: 0.73 | E131: 1.66 | F131: 1.51 | G131: 0.46 | H131: M | I131: 0.26 | J131: 0.09 | K131: 0.35 | L131: 0.90 | M131: 1.19 | N131: =SUM(B131:M131) -> 8.09
A132: Normals not available | B132: NA | C132: NA | D132: NA | E132: NA | F132: NA | G132: NA | H132: M | I132: NA | J132: NA | K132: NA | L132: NA | M132: NA | N132: NA
A133: 42-6644-05 Park City | B133: 1.74 | C133: 0.21 | D133: M | E133: M | F133: M | G133: M | H133: M | I133: M | J133: M | K133: M | L133: M | M133: M | N133: =SUM(B133:M133) -> 1.95
A134: Normals not available | B134: NA | C134: NA | D134: M | E134: M | F134: M | G134: M | H134: M | I134: M | J134: M | K134: M | L134: NA | M134: NA | N134: NA
A135: 42-6869-05 Pine View Dam | B135: 2.74 | C135: 0.68 | D135: 4.93 | E135: 6.45 | F135: 5.18 | G135: 2.39 | H135: 1.02 | I135: 2.10 | J135: 0.92 | K135: 0.04 | L135: 0.25 | M135: M | N135: =SUM(B135:M135) -> 26.70
A136: % of normal | B136: =ROUND(B135/2.91,2) -> 0.94 | C136: =ROUND(C135/3.15,2) -> 0.22 | D136: =ROUND(D135/3.34,2) -> 1.48 | E136: =ROUND(E135/3.89,2) -> 1.66 | F136: =ROUND(F135/3.25,2) -> 1.59 | G136: =ROUND(G135/3.45,2) -> 0.69 | H136: =ROUND(H135/2.94,2) -> 0.35 | I136: =ROUND(I135/3.4,2) -> 0.62 | J136: =ROUND(J135/1.74,2) -> 0.53 | K136: =ROUND(K135/1.15,2) -> 0.03 | L136: =ROUND(L135/1.13,2) -> 0.22 | M136: =ROUND(M135/2.03,2) -> ##### | N136: =ROUND(N135/32.38,2) -> 0.82
A137: 42-6919-03 Pleasant Grove | B137: 1.71 | C137: 0.18 | D137: 3.41 | E137: 1.81 | F137: 1.66 | G137: 0.55 | H137: 0.15 | I137: 1.50 | J137: 0.43 | K137: 0.14 | L137: 0.26 | M137: 1.08 | N137: =SUM(B137:M137) -> 12.88
A138: % of normal | B138: =ROUND(B137/1.78,2) -> 0.96 | C138: =ROUND(C137/1.51,2) -> 0.12 | D138: =ROUND(D137/1.44,2) -> 2.37 | E138: =ROUND(E137/1.84,2) -> 0.98 | F138: =ROUND(F137/1.76,2) -> 0.94 | G138: =ROUND(G137/1.87,2) -> 0.29 | H138: =ROUND(H137/1.65,2) -> 0.09 | I138: =ROUND(I137/1.85,2) -> 0.81 | J138: =ROUND(J137/0.9,2) -> 0.48 | K138: =ROUND(K137/0.86,2) -> 0.16 | L138: =ROUND(L137/0.88,2) -> 0.3 | M138: =ROUND(M137/1.32,2) -> 0.82 | N138: =ROUND(N137/17.66,2) -> 0.73
A139: 42-7026-07 Price BLM | B139: 0.19 | C139: T | D139: 1.80 | E139: 1.07 | F139: 2.36 | G139: 0.09 | H139: 0.12 | I139: 0.73 | J139: 0.34 | K139: 0.29 | L139: M | M139: 1.45 | N139: =SUM(B139:M139) -> 8.44
A140: % of normal | B140: =ROUND(B139/1.24,2) -> 0.15 | C140: 0 | D140: =ROUND(D139/0.48,2) -> 3.75 | E140: =ROUND(E139/0.76,2) -> 1.41 | F140: =ROUND(F139/0.8,2) -> 2.95 | G140: =ROUND(G139/0.79,2) -> 0.11 | H140: =ROUND(H139/0.59,2) -> 0.2 | I140: =ROUND(I139/0.8,2) -> 0.91 | J140: =ROUND(J139/0.55,2) -> 0.62 | K140: =ROUND(K139/0.89,2) -> 0.33 | L140: =ROUND(L139/1.1,2) -> ##### | M140: =ROUND(M139/1.14,2) -> 1.27 | N140: =ROUND(N139/9.74,2) -> 0.87
A141: 42-7064-03 Provo BYU | B141: 1.85 | C141: 0.32 | D141: 3.72 | E141: 1.64 | F141: 1.60 | G141: 0.84 | H141: 0.29 | I141: 1.77 | J141: 0.32 | K141: 0.31 | L141: 0.10 | M141: 1.25 | N141: =SUM(B141:M141) -> 14.01
A142: % of normal | B142: =ROUND(B141/2.03,2) -> 0.91 | C142: =ROUND(C141/1.79,2) -> 0.18 | D142: =ROUND(D141/1.65,2) -> 2.25 | E142: =ROUND(E141/2.13,2) -> 0.77 | F142: =ROUND(F141/1.93,2) -> 0.83 | G142: =ROUND(G141/2.02,2) -> 0.42 | H142: =ROUND(H141/1.85,2) -> 0.16 | I142: =ROUND(I141/2.03,2) -> 0.87 | J142: =ROUND(J141/1.13,2) -> 0.28 | K142: =ROUND(K141/0.89,2) -> 0.35 | L142: =ROUND(L141/1.14,2) -> 0.09 | M142: =ROUND(M141/1.54,2) -> 0.81 | N142: =ROUND(N141/20.13,2) -> 0.7
A143: 42-7260-04 Richfield Radio KSVC | B143: 0.24 | C143: 0.07 | D143: 1.78 | E143: 0.33 | F143: 0.73 | G143: 0.39 | H143: 0.18 | I143: 0.63 | J143: 0.30 | K143: 0.57 | L143: 0.93 | M143: 0.45 | N143: =SUM(B143:M143) -> 6.60
A144: % of normal | B144: =ROUND(B143/0.99,2) -> 0.24 | C144: =ROUND(C143/0.65,2) -> 0.11 | D144: =ROUND(D143/0.45,2) -> 3.96 | E144: =ROUND(E143/0.62,2) -> 0.53 | F144: =ROUND(F143/0.5,2) -> 1.46 | G144: =ROUND(G143/0.77,2) -> 0.51 | H144: =ROUND(H143/0.63,2) -> 0.29 | I144: =ROUND(I143/1.04,2) -> 0.61 | J144: =ROUND(J143/0.59,2) -> 0.51 | K144: =ROUND(K143/0.72,2) -> 0.79 | L144: =ROUND(L143/0.69,2) -> 1.35 | M144: =ROUND(M143/0.86,2) -> 0.52 | N144: =ROUND(N143/8.51,2) -> 0.78
A145: 42-7557-04 Salina | B145: 1.10 | C145: 0.30 | D145: 3.69 | E145: 0.77 | F145: 1.74 | G145: 0.75 | H145: 0.48 | I145: 1.69 | J145: 0.74 | K145: 0.75 | L145: 0.42 | M145: 0.64 | N145: =SUM(B145:M145) -> 13.07
A146: % of normal | B146: =ROUND(B145/1.03,2) -> 1.07 | C146: =ROUND(C145/0.81,2) -> 0.37 | D146: =ROUND(D145/0.58,2) -> 6.36 | E146: =ROUND(E145/0.69,2) -> 1.12 | F146: =ROUND(F145/0.64,2) -> 2.72 | G146: =ROUND(G145/1.18,2) -> 0.64 | H146: =ROUND(H145/0.93,2) -> 0.52 | I146: =ROUND(I145/1.14,2) -> 1.48 | J146: =ROUND(J145/0.5,2) -> 1.48 | K146: =ROUND(K145/0.63,2) -> 1.19 | L146: =ROUND(L145/0.75,2) -> 0.56 | M146: =ROUND(M145/1,2) -> 0.64 | N146: =ROUND(N145/9.88,2) -> 1.32
A147: 42-7559-04 Salina 24E | B147: 0.66 | C147: 0.04 | D147: 2.02 | E147: 1.58 | F147: 1.55 | G147: 0.57 | H147: 0.18 | I147: 0.70 | J147: 0.37 | K147: 0.10 | L147: 0.84 | M147: 0.32 | N147: =SUM(B147:M147) -> 8.93
A148: % of normal | B148: =ROUND(B147/1.36,2) -> 0.49 | C148: =ROUND(C147/1.01,2) -> 0.04 | D148: =ROUND(D147/0.85,2) -> 2.38 | E148: =ROUND(E147/1.03,2) -> 1.53 | F148: =ROUND(F147/0.9,2) -> 1.72 | G148: =ROUND(G147/1.25,2) -> 0.46 | H148: =ROUND(H147/1.01,2) -> 0.18 | I148: =ROUND(I147/1.2,2) -> 0.58 | J148: =ROUND(J147/0.79,2) -> 0.47 | K148: =ROUND(K147/1.39,2) -> 0.07 | L148: =ROUND(L147/1.71,2) -> 0.49 | M148: =ROUND(M147/1.69,2) -> 0.19 | N148: =ROUND(N147/14.19,2) -> 0.63
A149: 42-7598-03 Salt Lake City Intl Airport | B149: 1.88 | C149: 0.49 | D149: 3.35 | E149: 1.30 | F149: 1.24 | G149: 1.34 | H149: 0.75 | I149: 1.01 | J149: 0.75 | K149: 0.14 | L149: 0.83 | M149: 0.31 | N149: =SUM(B149:M149) -> 13.39
A150: % of normal | B150: =ROUND(B149/1.57,2) -> 1.2 | C150: =ROUND(C149/1.4,2) -> 0.35 | D150: =ROUND(D149/1.23,2) -> 2.72 | E150: =ROUND(E149/1.37,2) -> 0.95 | F150: =ROUND(F149/1.33,2) -> 0.93 | G150: =ROUND(G149/1.91,2) -> 0.7 | H150: =ROUND(H149/2.02,2) -> 0.37 | I150: =ROUND(I149/2.09,2) -> 0.48 | J150: =ROUND(J149/0.77,2) -> 0.97 | K150: =ROUND(K149/0.72,2) -> 0.19 | L150: =ROUND(L149/0.76,2) -> 1.09 | M150: =ROUND(M149/1.33,2) -> 0.23 | N150: =ROUND(N149/16.5,2) -> 0.81
A151: 42-7606-03 Salt Lake Triad Center | B151: 2.10 | C151: 0.50 | D151: 2.26 | E151: 0.97 | F151: 1.15 | G151: 1.36 | H151: 0.94 | I151: 1.23 | J151: 0.90 | K151: 0.19 | L151: 0.98 | M151: 0.44 | N151: =SUM(B151:M151) -> 13.02
A152: % of normal | B152: =ROUND(B151/1.69,2) -> 1.24 | C152: =ROUND(C151/1.65,2) -> 0.3 | D152: =ROUND(D151/1.26,2) -> 1.79 | E152: =ROUND(E151/1.58,2) -> 0.61 | F152: =ROUND(F151/1.63,2) -> 0.71 | G152: =ROUND(G151/2.02,2) -> 0.67 | H152: =ROUND(H151/2.18,2) -> 0.43 | I152: =ROUND(I151/2.31,2) -> 0.53 | J152: =ROUND(J151/0.84,2) -> 1.07 | K152: =ROUND(K151/0.71,2) -> 0.27 | L152: =ROUND(L151/0.64,2) -> 1.53 | M152: =ROUND(M151/1.24,2) -> 0.35 | N152: =ROUND(N151/17.75,2) -> 0.73
A153: 42-7686-03 Santaquin Chlorinator | B153: 2.00 | C153: 0.15 | D153: 4.18 | E153: 1.38 | F153: 2.02 | G153: 2.24 | H153: 1.17 | I153: 2.74 | J153: 1.79 | K153: 0.76 | L153: 1.06 | M153: 1.66 | N153: =SUM(B153:M153) -> 21.15
A154: % of normal | B154: =ROUND(B153/2.06,2) -> 0.97 | C154: =ROUND(C153/1.8,2) -> 0.08 | D154: =ROUND(D153/1.33,2) -> 3.14 | E154: =ROUND(E153/1.54,2) -> 0.9 | F154: =ROUND(F153/1.58,2) -> 1.28 | G154: =ROUND(G153/1.91,2) -> 1.17 | H154: =ROUND(H153/1.94,2) -> 0.6 | I154: =ROUND(I153/2.09,2) -> 1.31 | J154: =ROUND(J153/0.83,2) -> 2.16 | K154: =ROUND(K153/0.74,2) -> 1.03 | L154: =ROUND(L153/0.98,2) -> 1.08 | M154: =ROUND(M153/1.42,2) -> 1.17 | N154: =ROUND(N153/18.22,2) -> 1.16
A155: 42-7714-04 Scipio | B155: 0.81 | C155: 0.15 | D155: 4.18 | E155: 1.62 | F155: 1.09 | G155: 0.72 | H155: 0.20 | I155: 1.66 | J155: 1.39 | K155: 1.01 | L155: 0.03 | M155: 1.08 | N155: =SUM(B155:M155) -> 13.94
A156: % of normal | B156: =ROUND(B155/1.54,2) -> 0.53 | C156: =ROUND(C155/1.25,2) -> 0.12 | D156: =ROUND(D155/1.03,2) -> 4.06 | E156: =ROUND(E155/1.31,2) -> 1.24 | F156: =ROUND(F155/1.34,2) -> 0.81 | G156: =ROUND(G155/1.33,2) -> 0.54 | H156: =ROUND(H155/1.21,2) -> 0.17 | I156: =ROUND(I155/1.44,2) -> 1.15 | J156: =ROUND(J155/0.66,2) -> 2.11 | K156: =ROUND(K155/0.85,2) -> 1.19 | L156: =ROUND(L155/1.13,2) -> 0.03 | M156: =ROUND(M155/1.1,2) -> 0.98 | N156: =ROUND(N155/14.19,2) -> 0.98
A157: 42-7729-05 Scofield-Skyline Mine | B157: 3.04 | C157: 1.07 | D157: 3.90 | E157: 8.08 | F157: 4.56 | G157: 1.72 | H157: 1.34 | I157: 3.24 | J157: 1.20 | K157: 0.60 | L157: 1.41 | M157: 0.53 | N157: =SUM(B157:M157) -> 30.69
A158: % of normal | B158: =ROUND(B157/1.96,2) -> 1.55 | C158: =ROUND(C157/2.4,2) -> 0.45 | D158: =ROUND(D157/2.15,2) -> 1.81 | E158: =ROUND(E157/2.6,2) -> 3.11 | F158: =ROUND(F157/2.72,2) -> 1.68 | G158: =ROUND(G157/2.91,2) -> 0.59 | H158: =ROUND(H157/2.11,2) -> 0.64 | I158: =ROUND(I157/1.69,2) -> 1.92 | J158: =ROUND(J157/1.24,2) -> 0.97 | K158: =ROUND(K157/1.43,2) -> 0.42 | L158: =ROUND(L157/1.32,2) -> 1.07 | M158: =ROUND(M157/2.05,2) -> 0.26 | N158: =ROUND(N157/24.58,2) -> 1.25
A159: 42-7846-05 Silver Lake Brighton | B159: 4.24 | C159: M | D159: 7.06 | E159: 11.22 | F159: 5.86 | G159: 3.44 | H159: 3.19 | I159: 3.56 | J159: 1.42 | K159: 0.00 | L159: 0.50 | M159: 2.96 | N159: =SUM(B159:M159) -> 43.45
A160: % of normal | B160: =ROUND(B159/3.59,2) -> 1.18 | C160: =ROUND(C159/4.81,2) -> ###### | D160: =ROUND(D159/4.63,2) -> 1.52 | E160: =ROUND(E159/5.06,2) -> 2.22 | F160: =ROUND(F159/4.88,2) -> 1.2 | G160: =ROUND(G159/5.28,2) -> 0.65 | H160: =ROUND(H159/4.15,2) -> 0.77 | I160: =ROUND(I159/3.45,2) -> 1.03 | J160: =ROUND(J159/1.52,2) -> 0.93 | K160: =ROUND(K159/1.65,2) -> 0 | L160: =ROUND(L159/1.85,2) -> 0.27 | M160: =ROUND(M159/2.55,2) -> 1.16 | N160: =ROUND(N159/43.42,2) -> 1
A161: 42-7909-05 Snake Creek Powerhouse | B161: 1.93 | C161: 0.16 | D161: 3.79 | E161: 3.94 | F161: 4.08 | G161: 1.23 | H161: 0.79 | I161: 1.03 | J161: 0.72 | K161: 0.00 | L161: 0.10 | M161: M | N161: =SUM(B161:M161) -> 17.77
A162: % of normal | B162: =ROUND(B161/1.92,2) -> 1.01 | C162: =ROUND(C161/2.23,2) -> 0.07 | D162: =ROUND(D161/2.32,2) -> 1.63 | E162: =ROUND(E161/2.88,2) -> 1.37 | F162: =ROUND(F161/2.67,2) -> 1.53 | G162: =ROUND(G161/1.9,2) -> 0.65 | H162: =ROUND(H161/1.61,2) -> 0.49 | I162: =ROUND(I161/1.89,2) -> 0.54 | J162: =ROUND(J161/0.91,2) -> 0.79 | K162: =ROUND(K161/1.08,2) -> 0 | L162: =ROUND(L161/1.2,2) -> 0.08 | M162: =ROUND(M161/1.52,2) -> ##### | N162: =ROUND(N161/22.13,2) -> 0.8
A163: 42-7942-05 Snyderville | B163: 1.37 | C163: 0.55 | D163: 3.41 | E163: 5.90 | F163: M | G163: 1.97 | H163: 2.21 | I163: 1.47 | J163: 0.97 | K163: 0.27 | L163: 1.72 | M163: 0.70 | N163: =SUM(B163:M163) -> 20.54
A164: Normals not available | B164: NA | C164: NA | D164: NA | E164: NA | F164: NA | G164: NA | H164: NA | I164: NA | J164: NA | K164: NA | L164: NA | M164: NA | N164: NA
A165: 42-8119-03 Spanish Fork Power House | B165: 1.97 | C165: 0.21 | D165: 3.70 | E165: 1.96 | F165: 2.37 | G165: 1.28 | H165: 0.86 | I165: 3.43 | J165: 0.58 | K165: 0.21 | L165: 0.01 | M165: 1.73 | N165: =SUM(B165:M165) -> 18.31
A166: % of normal | B166: =ROUND(B165/2.16,2) -> 0.91 | C166: =ROUND(C165/2.21,2) -> 0.1 | D166: =ROUND(D165/1.78,2) -> 2.08 | E166: =ROUND(E165/1.87,2) -> 1.05 | F166: =ROUND(F165/2.1,2) -> 1.13 | G166: =ROUND(G165/2.35,2) -> 0.54 | H166: =ROUND(H165/2.28,2) -> 0.38 | I166: =ROUND(I165/2.25,2) -> 1.52 | J166: =ROUND(J165/1.09,2) -> 0.53 | K166: =ROUND(K165/0.91,2) -> 0.23 | L166: =ROUND(L165/1.03,2) -> 0.01 | M166: =ROUND(M165/1.52,2) -> 1.14 | N166: =ROUND(N165/21.55,2) -> 0.85
A167: 42-8465-05 Sundance | B167: 3.13 | C167: 0.28 | D167: 9.71 | E167: 6.55 | F167: 5.30 | G167: 1.90 | H167: 1.18 | I167: 2.28 | J167: 0.92 | K167: 0.82 | L167: 0.58 | M167: 3.04 | N167: =SUM(B167:M167) -> 35.69
A168: Normals not available | B168: NA | C168: NA | D168: NA | E168: NA | F168: NA | G168: NA | H168: NA | I168: NA | J168: NA | K168: NA | L168: NA | M168: NA | N168: NA
A169: 42-8478-07 Sunnyside City Center | B169: 0.93 | C169: 0.00 | D169: 2.76 | E169: 0.62 | F169: M | G169: M | H169: 0.53 | I169: 1.95 | J169: 0.60 | K169: 0.15 | L169: 1.19 | M169: 1.77 | N169: =SUM(B169:M169) -> 10.50
A170: % of normal | B170: =ROUND(B169/1.45,2) -> 0.64 | C170: =ROUND(C169/0.57,2) -> 0 | D170: =ROUND(D169/0.52,2) -> 5.31 | E170: =ROUND(E169/0.82,2) -> 0.76 | F170: M | G170: M | H170: =ROUND(H169/1.09,2) -> 0.49 | I170: =ROUND(I169/1.17,2) -> 1.67 | J170: =ROUND(J169/0.74,2) -> 0.81 | K170: =ROUND(K169/1.42,2) -> 0.11 | L170: =ROUND(L169/1.05,2) -> 1.13 | M170: =ROUND(M169/1.87,2) -> 0.95 | N170: =ROUND(N169/12.56,2) -> 0.84
A171: 42-8733-03 Timpanogos Cave | B171: 2.04 | C171: 0.41 | D171: 1.72 | E171: 3.05 | F171: 8.20 | G171: M | H171: 0.62 | I171: 1.73 | J171: 0.43 | K171: 0.16 | L171: 0.69 | M171: M | N171: =SUM(B171:M171) -> 19.05
A172: % of normal | B172: =ROUND(B171/2.54,2) -> 0.8 | C172: =ROUND(C171/2.02,2) -> 0.2 | D172: =ROUND(D171/1.96,2) -> 0.88 | E172: =ROUND(E171/2.41,2) -> 1.27 | F172: =ROUND(F171/2.34,2) -> 3.5 | G172: =ROUND(G171/2.82,2) -> ##### | H172: =ROUND(H171/2.26,2) -> 0.27 | I172: =ROUND(I171/3.06,2) -> 0.57 | J172: =ROUND(J171/1.48,2) -> 0.29 | K172: =ROUND(K171/1.08,2) -> 0.15 | L172: =ROUND(L171/1.44,2) -> 0.48 | M172: =ROUND(M171/2.05,2) -> ##### | N172: =ROUND(N171/25.46,2) -> 0.75
A173: 42-8973-03 Utah Lake Lehi | B173: 0.74 | C173: 0.58 | D173: 2.09 | E173: 1.68 | F173: M | G173: M | H173: M | I173: 1.52 | J173: M | K173: 0.19 | L173: 0.31 | M173: 1.23 | N173: =SUM(B173:M173) -> 8.34
A174: % of normal | B174: =ROUND(B173/1.33,2) -> 0.56 | C174: =ROUND(C173/1.13,2) -> 0.51 | D174: =ROUND(D173/0.69,2) -> 3.03 | E174: =ROUND(E173/0.98,2) -> 1.71 | F174: =ROUND(F173/1,2) -> ##### | G174: =ROUND(G173/1.12,2) -> ##### | H174: =ROUND(H173/1.3,2) -> ##### | I174: =ROUND(I173/1.4,2) -> 1.09 | J174: =ROUND(J173/0.66,2) -> ##### | K174: =ROUND(K173/0.67,2) -> 0.28 | L174: =ROUND(L173/0.98,2) -> 0.32 | M174: =ROUND(M173/1.15,2) -> 1.07 | N174: =ROUND(N173/12.41,2) -> 0.67
A175: 42-9165-05 Wanship Dam | B175: 2.11 | C175: 0.07 | D175: 2.10 | E175: 1.82 | F175: 1.38 | G175: 0.87 | H175: 1.39 | I175: 2.13 | J175: 0.96 | K175: 0.12 | L175: 0.02 | M175: 2.23 | N175: =SUM(B175:M175) -> 15.20
A176: % of normal | B176: =ROUND(B175/1.71,2) -> 1.23 | C176: =ROUND(C175/1.68,2) -> 0.04 | D176: =ROUND(D175/1.05,2) -> 2 | E176: =ROUND(E175/1.22,2) -> 1.49 | F176: =ROUND(F175/1.08,2) -> 1.28 | G176: =ROUND(G175/1.5,2) -> 0.58 | H176: =ROUND(H175/1.76,2) -> 0.79 | I176: =ROUND(I175/2.02,2) -> 1.05 | J176: =ROUND(J175/1.01,2) -> 0.95 | K176: =ROUND(K175/1.07,2) -> 0.11 | L176: =ROUND(L175/1.03,2) -> 0.02 | M176: =ROUND(M175/1.49,2) -> 1.5 | N176: =ROUND(N175/16.62,2) -> 0.91
A177: 42-9346-03 Weber Basin Pump Plant 3 | B177: 2.37 | C177: 0.72 | D177: 5.18 | E177: 2.67 | F177: M | G177: M | H177: M | I177: M | J177: M | K177: M | L177: M | M177: M | N177: =SUM(B177:M177) -> 10.94
A178: % of normal | B178: =ROUND(B177/2.37,2) -> 1 | C178: =ROUND(C177/2.2,2) -> 0.33 | D178: =ROUND(D177/2.26,2) -> 2.29 | E178: =ROUND(E177/2.61,2) -> 1.02 | F178: =ROUND(F177/2.46,2) -> ##### | G178: =ROUND(G177/2.82,2) -> ##### | H178: =ROUND(H177/2.89,2) -> ##### | I178: =ROUND(I177/3.17,2) -> ##### | J178: =ROUND(J177/1.47,2) -> ##### | K178: =ROUND(K177/1.02,2) -> ##### | L178: =ROUND(L177/1.13,2) -> ##### | M178: =ROUND(M177/1.79,2) -> ##### | N178: =ROUND(N177/26.19,2) -> 0.42
A179: 42-9368-07 Wellington 3E | B179: 0.50 | C179: 0.00 | D179: 2.05 | E179: 0.85 | F179: 0.91 | G179: 0.00 | H179: 0.07 | I179: 1.08 | J179: 0.40 | K179: 0.15 | L179: 0.15 | M179: 0.06 | N179: =SUM(B179:M179) -> 6.22
A180: % of normal | B180: =ROUND(B179/0.88,2) -> 0.57 | C180: =ROUND(C179/0.47,2) -> 0 | D180: =ROUND(D179/0.42,2) -> 4.88 | E180: =ROUND(E179/0.58,2) -> 1.47 | F180: =ROUND(F179/0.51,2) -> 1.78 | G180: =ROUND(G179/0.79,2) -> 0 | H180: =ROUND(H179/0.68,2) -> 0.1 | I180: =ROUND(I179/0.79,2) -> 1.37 | J180: =ROUND(J179/0.42,2) -> 0.95 | K180: =ROUND(K179/0.84,2) -> 0.18 | L180: =ROUND(L179/0.9,2) -> 0.17 | M180: =ROUND(M179/1.22,2) -> 0.05 | N180: =ROUND(N179/8.5,2) -> 0.73
A181: 42-9382-01 Wendover Ut | B181: 0.03 | C181: 0.01 | D181: 0.33 | E181: 0.08 | F181: 0.19 | G181: 0.04 | H181: 0.00 | I181: 0.08 | J181: 0.00 | K181: 0.00 | L181: 0.00 | M181: 0.01 | N181: =SUM(B181:M181) -> 0.77
A182: % of normal | B182: =ROUND(B181/0.53,2) -> 0.06 | C182: =ROUND(C181/0.27,2) -> 0.04 | D182: =ROUND(D181/0.16,2) -> 2.06 | E182: =ROUND(E181/0.31,2) -> 0.26 | F182: =ROUND(F181/0.26,2) -> 0.73 | G182: =ROUND(G181/0.44,2) -> 0.09 | H182: =ROUND(H181/0.48,2) -> 0 | I182: =ROUND(I181/0.82,2) -> 0.1 | J182: =ROUND(J181/0.38,2) -> 0 | K182: =ROUND(K181/0.29,2) -> 0 | L182: =ROUND(L181/0.4,2) -> 0 | M182: =ROUND(M181/0.43,2) -> 0.02 | N182: =ROUND(N181/4.77,2) -> 0.16
A183: 48-1736-03 Church Buttes Gas Plant, Wyo | B183: 0.79 | C183: 0.02 | D183: 0.37 | E183: 0.42 | F183: 0.37 | G183: 0.37 | H183: 0.05 | I183: 0.97 | J183: 0.49 | K183: 1.29 | L183: 0.34 | M183: 1.34 | N183: =SUM(B183:M183) -> 6.82
A184: % of normal | B184: =ROUND(B183/0.68,2) -> 1.16 | C184: =ROUND(C183/0.64,2) -> 0.03 | D184: =ROUND(D183/0.42,2) -> 0.88 | E184: M | F184: M | G184: M | H184: M | I184: M | J184: M | K184: =ROUND(K183/0.59,2) -> 2.19 | L184: =ROUND(L183/0.67,2) -> 0.51 | M184: =ROUND(M183/0.85,2) -> 1.58 | N184: =ROUND(N183/8.08,2) -> 0.84
A185: 48-3100-03 Evanston 1E, Wyo | B185: 1.43 | C185: 0.18 | D185: 0.78 | E185: 1.56 | F185: 0.32 | G185: 0.18 | H185: 0.02 | I185: 1.76 | J185: M | K185: M | L185: M | M185: M | N185: =SUM(B185:M185) -> 6.23
A186: % of normal | B186: =ROUND(B185/1.15,2) -> 1.24 | C186: =ROUND(C185/0.84,2) -> 0.21 | D186: =ROUND(D185/0.67,2) -> 1.16 | E186: =ROUND(E185/0.68,2) -> 2.29 | F186: =ROUND(F185/0.62,2) -> 0.52 | G186: =ROUND(G185/0.89,2) -> 0.2 | H186: =ROUND(H185/1.13,2) -> 0.02 | I186: =ROUND(I185/1.47,2) -> 1.2 | J186: =ROUND(J185/0.96,2) -> ##### | K186: =ROUND(K185/0.91,2) -> ##### | L186: =ROUND(L185/0.94,2) -> ##### | M186: =ROUND(M185/1.27,2) -> ##### | N186: =ROUND(N185/11.53,2) -> 0.54
A187: 48-5703-03 Lonetree No1, Wyo | B187: 1.49 | C187: 0.15 | D187: 0.67 | E187: 1.02 | F187: 1.30 | G187: 0.68 | H187: 0.27 | I187: 0.94 | J187: 1.08 | K187: 1.36 | L187: 1.08 | M187: 1.84 | N187: =SUM(B187:M187) -> 11.88
A188: Normals not available | B188: NA | C188: NA | D188: NA | E188: NA | F188: NA | G188: NA | H188: NA | I188: NA | J188: NA | K188: NA | L188: NA | M188: NA | N188: NA
A189: 48-6555-03 Mountain View, Wyo | B189: 1.40 | C189: 0.01 | D189: 0.88 | E189: 0.82 | F189: 0.85 | G189: 0.71 | H189: 0.21 | I189: 1.64 | J189: 0.72 | K189: 0.93 | L189: 0.57 | M189: 1.49 | N189: =SUM(B189:M189) -> 10.23
A190: % of normal | B190: =ROUND(B189/0.92,2) -> 1.52 | C190: =ROUND(C189/0.61,2) -> 0.02 | D190: =ROUND(D189/0.82,2) -> 1.07 | E190: =ROUND(E189/0.44,2) -> 1.86 | F190: =ROUND(F189/0.37,2) -> 2.3 | G190: =ROUND(G189/0.51,2) -> 1.39 | H190: =ROUND(H189/0.95,2) -> 0.22 | I190: =ROUND(I189/1.25,2) -> 1.31 | J190: =ROUND(J189/0.96,2) -> 0.75 | K190: =ROUND(K189/0.94,2) -> 0.99 | L190: =ROUND(L189/0.87,2) -> 0.66 | M190: =ROUND(M189/1.07,2) -> 1.39 | N190: =ROUND(N189/9.31,2) -> 1.1